Companynumber,Companyname,BestEstimateCurrentEmployees,BestEstimateCurrentTurnover,BestEstimateGrowthPercentagePerYear,BestEstimateEmployeeGrowthPercentagePerYear,BestEstimateTurnoverGrowthPercentagePerYear,CompanyGrowthStage,SortableIncorporationDate,Description,URLs,Registeredpostcode,RTICs,RTICsubsectors,TotalInnovateUKFunding,TotalDealroomFundingMillionPounds,LastKnownDealroomFunding,WomenFounded
10551260,ROUSE ACQUISITIONCO LIMITED,440,48179766,0.2895,0.345,0.234,Large,01/06/2017 00:00:00,"Humanetics is the global leader in the design, manufacture & supply of biofidelic crash test dummies, calibration equipment, crash sensors instrumentation, software modeling and active safety testing equipment.",humaneticsgroup.com,SO16 7QQ,"Space Energy, Sensors, Electronics Manufacturing","Space Energy: Power Core, Sensors: Autonomous vehicles, Sensors: Mobility, Sensors: Industry 4.0, Sensors: Environmental Monitoring, Electronics Manufacturing: Communications",,0,,0
10683955,ECLIPSE ENERGY NORTH LIMITED,252,16535720,0.801,0.801,,Large,03/22/2017 00:00:00,"Specialists in insulation, solar panels & home energy & ways to keep your home warm and dry for less. grants for part or full funding.",eclipseenergy.co.uk,HX1 3TT,Net Zero,Net Zero: Renewable Energy Planning Database,,0,,0
02826294,MES ENVIRONMENTAL LIMITED,272,27785441,1.126,2.194,0.058,Large,06/11/1993 00:00:00,,mesenvironmental.co.uk,LE19 1SD,Net Zero,Net Zero: Waste Management and Recycling,,0,,0
08318444,FUTURE CLIMATE INFO LTD,40,1219703,0.54,0.54,,Small,12/05/2012 00:00:00,"Environmental searches for conveyancing solicitors, covering contaminated land, flood, ground stability, energy and infrastructure, planning.",futureclimateinfo.com,W2 1AF,Net Zero,"Net Zero: Low Carbon Consultancy, Advisory & Offsetting Services",,0,,0
07889412,CITY ENERGY NETWORK LIMITED,222,255293880,0.6295,0.427,0.832,Large,12/21/2011 00:00:00,"Our serviceswe offer a 'whole home approach'renewable energyhaving the right system installed for you means that you can generate your own heat and hot water, whilst contributing to a much healthier planet.read moreheatingwe offer a wealth of industry knowledge and practical hands-on experience, meaning our customers can enjoy a warm and energy savings for many",cityenergy.co.uk,CF10 5EE,"Energy Management, Net Zero","Energy Management: Energy Management Systems, Net Zero: Renewable Energy Planning Database",,0,,0
NI041488,BAYVIEW CONTRACTS LTD,130,37504880,0.276,-0.002,0.554,Large,09/07/2001 00:00:00,,bayviewcontracts.com,BT34 2QU,Net Zero,Net Zero: Renewable Energy Planning Database,,0,,0
03768856,NPOWER COMMERCIAL GAS LIMITED,1918,15617295000,1.3165,0.415,2.218,Large,05/07/1999 00:00:00,"If you have an npower billing or payment query and are not an e.on next customer, you can get information here.",eonnext.com,CV4 8LG,"Energy Management, Net Zero","Energy Management: Energy Management Systems, Net Zero: Renewable Energy Planning Database",,0,,0
07977817,INTELLIGENT BUILDING GROUP LTD,24,1129975,0.335,0.335,,Small,03/06/2012 00:00:00,"Ibg’s smart building & energy management software will help your building eradicate wastage & reduce your carbon footprint at zero cost, learn how today!",ibg-uk.com,SK9 3ND,"Net Zero, Internet of Things","Net Zero: Building Technologies, Internet of Things: Energy Management & Smart Buildings",,0,,0
04057938,NETWORK PLUS SERVICES LTD,4018,835109987,0.347,0.342,0.352,Large,08/22/2000 00:00:00,"With more than 20 years experience, we are experts in delivering utility and infrastructure services across the uk.",networkplus.co.uk,M28 1XW,Net Zero,Net Zero: Renewable Energy Planning Database,,0,,0
12057804,GARO ELECTRIC LIMITED,36,14540967,0.9775,0.458,1.497,Medium,06/18/2019 00:00:00,,garo.co.uk,B6 7FH,Net Zero,Net Zero: Low Emission Vehicles,,0,,0
09364823,MATERIALS SOLUTIONS LIMITED,95,15349830,0.2685,0.202,0.335,Medium,12/22/2014 00:00:00,"Materials solutions – a siemens energy business - is an expert in the use of selective laser melting (slm) to manufacture of high-performance metal parts. the company offers additive manufacturing services for the energy industry as well as for aerospace, automotive and motor sports, and other high-performance applications.",materialssolutions.co.uk,NE6 2YL,"Space Energy, In-Orbit Servicing and Manufacturing, Space Economy, Electronics Manufacturing, Artificial Intelligence","Space Energy: Power Core, In-Orbit Servicing and Manufacturing: Inspection, In-Orbit Servicing and Manufacturing: Space Manufacturing, Space Economy: Engineering, Space Economy: In-orbit manufacturing, Electronics Manufacturing: Electromedical technologies, Artificial Intelligence: Industry 4.0 and Automation",24517,0,2016-08-01,0
12343762,GREENBANK RECYCLING SOLUTIONS LTD,55,8185816,0.442,0.442,,Medium,12/02/2019 00:00:00,"Speak to greenbank today to save time and create additional revenue streams for your business, from labour saving machines to waste solutions and recycling.",greenbankwastesolutions.com,TS3 8BT,Net Zero,Net Zero: Waste Management and Recycling,,0,,0
07776432,INFINITY ENERGY SERVICES LIMITED,70,3930992,0.588,0.588,,Medium,09/16/2011 00:00:00,"Infinity energy services designs and installs solar panel systems, led lighting, tesla powerwall battery storage, general electrical work. contact us now...",infinity-energy.co.uk,SO31 7GB,"Energy Storage, Net Zero, Energy Generation","Energy Storage: Batteries, Net Zero: Renewables, Net Zero: Renewable Energy Planning Database, Energy Generation: Solar",,0,,0
07215578,MOLE ENERGY LIMITED,56,17596816,0.46499999999999997,0.294,0.636,Medium,04/07/2010 00:00:00,"Mole energy solar pv systems installations, battery storage, service, repairs, maintenance and remote monitoring ensuring your system operates at its maximum efficiency.",moleenergy.com,EX36 3LH,"Photonics, Energy Storage, Energy Management, Net Zero, Energy Generation","Photonics: Photovoltaics, Energy Storage: Batteries, Energy Management: Energy Management Systems, Net Zero: Energy Storage, Net Zero: Renewables, Net Zero: Renewable Energy Planning Database, Energy Generation: Solar",,0,,0
06457815,PAPREC UK LIMITED,11,10511415,0.368,0.065,0.671,Medium,12/19/2007 00:00:00,,mesenvironmental.co.uk,S1 4BY,Net Zero,Net Zero: Waste Management and Recycling,,0,,0
10006957,LIVE MANAGE FACILITATE LIMITED,103,47639197,0.338,0.338,,Large,02/16/2016 00:00:00,Energy efficiency and retrofit specialists. apply now for your free energy saving measures.,lmfenergyservices.co.uk,CH41 3PS,"Net Zero, Energy Generation","Net Zero: Renewables, Energy Generation: Renewable Thermal, Energy Generation: Solar",,0,,0
11613702,ZEROAVIA LTD,508,40500,2.256,2.256,,Large,10/09/2018 00:00:00,Zeroavia is developing the first zero-emission powertrain for aviation,zeroavia.com,GL7 6BA,"Energy Storage, Net Zero, Energy Generation","Energy Storage: Hydrogen, Net Zero: Low Carbon Energy Generation, Energy Generation: Hydrogen",20476066.49,0,,0
06264908,THE BARTON PARTNERSHIP LTD,124,82479030,0.2975,0.216,0.379,Large,05/31/2007 00:00:00,"The barton partnership offer recruitment services and independent consulting across strategy and m&a, esg, data & analytics, transformation & cha...",thebartonpartnership.com,WC1V 6BX,"ESG, Agency Market","ESG: ESG Consultants, Agency Market: Analytics",,0,,0
SC597702,FLOTATION ENERGY LIMITED,130,3594925,0.7465,1.072,0.421,Medium,05/21/2018 00:00:00,"Flotation energy was founded to develop new opportunities for renewable energy in all parts of the globe. its greatest expertise is in offshore floating wind. its founders initiated and developed the world’s largest offshore floating windfarm in the north sea near aberdeen, scotland. they have unrivalled experience in consenting and developing new offshore wind projects.",flotationenergy.com,EH2 4QG,"Net Zero, Energy Generation","Net Zero: Low Carbon Energy Generation, Net Zero: Energy Cooperatives, Net Zero: Renewables, Net Zero: Renewable Energy Planning Database, Energy Generation: Onshore Wind, Energy Generation: Offshore Wind",,0,,0
13344064,VENTERRA GROUP PLC,1175,269297500,1.3805,1.164,1.597,Large,04/19/2021 00:00:00,"We engineer, support, build and operate multiple offshore wind farms through our portfolio of specialist operators providing reliable, high-quality services to the offshore wind industry.",venterra-group.com,W1S 4PD,Net Zero,"Net Zero: Renewables, Net Zero: Renewable Energy Planning Database",,190,2023-08-01,0
09924516,VIVACITY LABS LIMITED,240,5937188,0.414,0.414,,Medium,12/21/2015 00:00:00,Vivacity's artificial intelligence solution provides detailed and anonymous data insights to help optimise the transport network and improve urban infrastructure.,vivacitylabs.com,N1 6ED,"Sensors, Data Infrastructure, Space Economy, Artificial Intelligence, Net Zero, Internet of Things","Sensors: Mobility, Sensors: Industry 4.0, Sensors: Image and Video Analysis, Data Infrastructure: Data Infrastructure Services, Space Economy: Location and Connectivity, Artificial Intelligence: Image Processing, Net Zero: Pollution Control and Mitigation, Internet of Things: Smart Cities and Transport",4716378.02,15.76,2023-02-01,0
06797423,UK ALTERNATIVE ENERGY LTD,26,2105016,0.246,0.246,,Small,01/21/2009 00:00:00,"Welcome to the home page for uk alternative energy, the longest serving mcs accredited renewable energy specialists in lincolnshire.",ukalternativeenergy.co.uk,LN6 3QY,"Net Zero, Energy Generation","Net Zero: Heating, Net Zero: Renewables, Net Zero: Renewable Energy Planning Database, Energy Generation: Renewable Thermal, Energy Generation: Solar",,0,,0
11855286,GEOPURA LTD,92,4294276,1.483,1.483,,Medium,03/01/2019 00:00:00,"Geopura supply renewable energy & ev charging, & emission-free electricity. green hydrogen fuel cell technology in partnership with siemens.",geopura.com,NG5 1AY,"CleanTech, Energy Storage, Energy Management, Net Zero, Energy Generation","CleanTech: Energy Production, Management and Storage, Energy Storage: Hydrogen, Energy Management: Energy Management Systems, Net Zero: Low Carbon Energy Generation, Net Zero: Energy Storage, Net Zero: Carbon Capture, Net Zero: Renewables, Net Zero: Renewable Energy Planning Database, Net Zero: Low Emission Vehicles, Energy Generation: Hydrogen",72262.74,92.17,2024-02-01,0
OC346088,SCHRODERS GREENCOAT LLP,125,59857685,0.2165,0.246,0.187,Large,06/02/2009 00:00:00,The uk’s largest sector focused investor with over £6bn under management. global energy and resource paradigms are realigning. companies are maturing. the opportunities for investment are immense.,greencoat-capital.com,SW1V 1AN,Net Zero,"Net Zero: Renewables, Net Zero: Renewable Energy Planning Database",,0,,0
09145430,ENVIRONMENTAL ROOFING SERVICES LTD,62,5503875,1.007,1.007,,Medium,07/24/2014 00:00:00,,ers-ltd.co.uk,BL1 2HS,"Net Zero, Energy Generation","Net Zero: Renewables, Net Zero: Renewable Energy Planning Database, Energy Generation: Solar",,0,,0
09391307,CAMBRIDGE ENERGY LIMITED,120,10654081,1.199,1.199,,Medium,01/15/2015 00:00:00,Cambridge energy partners is a solar company that makes energy simple and flexible. we advise customers on the process of implementing solar for challenging projects.,cambridge-ep.com,CB1 1BH,"CleanTech, Net Zero, Energy Generation","CleanTech: Energy Production, Management and Storage, Net Zero: Renewables, Net Zero: Renewable Energy Planning Database, Energy Generation: Solar",650016,0,2020-01-01,0
09161078,ORACLE ENVIRONMENTAL EXPERTS LIMITED,45,6111818,0.239,0.239,,Small,08/05/2014 00:00:00,,oracle-environmental.com,WR14 2JS,"Life Sciences, CleanTech, Land Remediation, Net Zero","Life Sciences: Environmental Sciences Products and Services, CleanTech: Environmental Protection and Monitoring, Land Remediation: Brownfield Regeneration, Land Remediation: Regulatory Services, Net Zero: Low Carbon Consultancy, Advisory & Offsetting Services, Net Zero: Pollution Control and Mitigation",,0,,1
09439890,NETWORK ACCESS ASSOCIATES LIMITED,905,5368042,0.21549999999999997,0.708,-0.277,Large,02/13/2015 00:00:00,Space is the future for communications on earth,oneweb.net,W12 7FQ,"Space Energy, Space Economy, Telecommunications","Space Energy: Operations Management, Space Economy: Communications, Space Economy: Data Infrastructures, Space Economy: Location and Connectivity, Telecommunications: Wireless Connectivity, Telecommunications: Network Providers, Telecommunications: Satellite Communications",25320,0,,0
06968842,SEVERN TRENT GREEN POWER GROUP LIMITED,106,11599146,0.2395,0.145,0.334,Medium,07/21/2009 00:00:00,"We are experts in the provision of food waste recycling services, composting and the construction of complex food, green and sewage recycling facilities.",stgreenpower.co.uk,OX7 4EB,"Net Zero, Energy Generation","Net Zero: Waste Management and Recycling, Net Zero: Renewable Energy Planning Database, Energy Generation: Bioenergy",,0,,0
10456978,GREEN NATION ENERGY LTD,23,8364188,0.229,0.229,,Small,11/01/2016 00:00:00,"We believe that over the next 30 years, solar will become the most important source of electricity in the world, and we are one of the companies that will make that happen.",greennation.co.uk,BA3 4QF,"CleanTech, Net Zero, Energy Generation","CleanTech: Energy Production, Management and Storage, Net Zero: Low Carbon Energy Generation, Net Zero: Renewables, Net Zero: Renewable Energy Planning Database, Energy Generation: Solar",,0,,0
11552137,PROJECT HEATING SOLUTIONS LIMITED,54,3058288,0.51,0.51,,Medium,09/04/2018 00:00:00,Project heating solutions are a doncaster based company that specialise in renewable products.we il get you the best price or quote for renewable products,projectheatingsolutions.com,S35 2PH,"Net Zero, Energy Generation","Net Zero: Heating, Energy Generation: Renewable Thermal, Energy Generation: Solar",,0,2022-12-01,0
09523048,POZITIVE ENERGY LTD,25,2600301405,0.4155,0.074,0.757,Large,04/01/2015 00:00:00,,pozitive.energy,E14 5AB,Energy Management,Energy Management: Energy Management Systems,,0,,0
10554399,HELIX TECHNOLOGIES LIMITED,27,4526860,0.355,0.355,,Small,01/10/2017 00:00:00,"Helix provides pioneering antenna-based solutions & electronic systems, for the design & development of resilient & precise pnt applications.",helixgeospace.com,OX14 3NB,"Space Energy, Space Economy, Telecommunications, Geospatial Economy","Space Energy: Ground Segment, Space Economy: Geospatial Platforms, Space Economy: Location and Connectivity, Telecommunications: Satellite Communications, Geospatial Economy: Navigation Technologies",349465,5.68,2021-12-01,0
10484882,INSTAVOLT LIMITED,129,84310852,1.206,0.32,2.092,Large,11/17/2016 00:00:00,Introducing the uk's simplest and most transparent public rapid electric vehicle charging network. helping you get back on the road quickly.,instavolt.co.uk,RG24 8WD,Net Zero,Net Zero: Low Emission Vehicles,,12,2024-01-01,0
SC547712,COMPLETE ENERGY CONTROLS LTD.,48,1877580,0.751,0.751,,Small,10/13/2016 00:00:00,Infrastructure that empowers,cecontrols.co.uk,FK1 1HZ,"Energy Management, Internet of Things","Energy Management: Energy Management Systems, Internet of Things: Energy Management & Smart Buildings",,0,2023-05-01,0
10956325,NANOSUN LIMITED,165,0,0.701,0.701,,Medium,09/11/2017 00:00:00,"Nanosun develop and manufacture low-cost hydrogen refuelling solutions for the transport sector, enabling end users to unlock the benefits of hydrogen.",nanosun.co.uk,M2 3DE,"Advanced Materials, Energy Storage, Net Zero, Energy Generation","Advanced Materials: Emergent, Energy Storage: Hydrogen, Net Zero: Low Carbon Energy Generation, Energy Generation: Hydrogen",1296106,14.04,2021-12-01,0
07245223,THE LITTLE GREEN ENERGY COMPANY LIMITED,51,2867716,0.374,0.374,,Medium,05/06/2010 00:00:00,"Award winning solar pv energy, battery storage & ev charging specialists. experienced professionals, design & installation in the south east.",tlgec.co.uk,TN17 2LR,"Energy Storage, Net Zero, Energy Generation","Energy Storage: Batteries, Net Zero: Energy Storage, Net Zero: Renewables, Net Zero: Renewable Energy Planning Database, Net Zero: Low Emission Vehicles, Energy Generation: Solar",,0,2024-04-01,0
12474011,BUTE ENERGY LIMITED,115,7250143,0.813,0.813,,Medium,02/20/2020 00:00:00,"Focused and based in wales, bute energy is a renewable energy and infrastructure company which aims to generate clean green power to support the transition to net-zero.",bute.energy,CF10 1DY,"CleanTech, Energy Management, Net Zero","CleanTech: Energy Production, Management and Storage, Energy Management: Energy Management Systems, Net Zero: Low Carbon Energy Generation, Net Zero: Energy Storage, Net Zero: Energy Cooperatives, Net Zero: Renewables, Net Zero: Renewable Energy Planning Database",,0,,0
06889612,GINGER ENERGY LIMITED,31,1116782,0.277,0.277,,Small,04/28/2009 00:00:00,Specialist business energy consultancy & management with extensive expert knowledge in the energy supply and water industry. find out more.,gingerenergy.co.uk,B15 1NP,Energy Management,Energy Management: Energy Management Systems,,0,,0
07223160,ETHICAL POWER LTD,146,65905000,0.532,0.476,0.588,Large,04/14/2010 00:00:00,Ethical power - innovating energy,ethical-power.com,EX2 9UA,"CleanTech, Net Zero","CleanTech: Energy Production, Management and Storage, Net Zero: Low Carbon Energy Generation, Net Zero: Energy Storage, Net Zero: Renewables, Net Zero: Renewable Energy Planning Database",,0,,0
SC147604,VWS WESTGARTH LIMITED,118,77406560,0.079,0.025,0.133,Large,11/18/1993 00:00:00,,vwswestgarth.com,G74 5PR,CleanTech,CleanTech: Water Processing,,0,,0
07455556,ECOGENR8 LIMITED,34,10505276,0.2015,0.099,0.304,Medium,11/30/2010 00:00:00,,ecogenr8.com,WA5 3UZ,Energy Generation,Energy Generation: Bioenergy,30000,0,2024-04-01,0
10877539,OS PHOENIX MIDCO LIMITED,8368,2510360000,0.6659999999999999,0.75,0.582,Large,07/21/2017 00:00:00,"Secure the best method of waste management for your business. speak to the experts at reconomy today for a sustainable, cost-effective solution.",reconomy.com,TF3 3BD,Net Zero,Net Zero: Waste Management and Recycling,,0,,0
10147744,NEXT ENERGY SOLUTIONS LTD,173,99194997,0.6995,0.572,0.827,Large,04/26/2016 00:00:00,"For free boiler grants, visit next energy solutions. you may be eligible for a free boiler. it's easy to start your application today.",nextenergyuk.co.uk,WA3 6GR,Net Zero,Net Zero: Renewable Energy Planning Database,,0,2024-05-01,0
06446471,ETHICAL POWER CONNECTIONS LTD.,132,98745000,1.5939999999999999,1.006,2.182,Large,12/06/2007 00:00:00,Ethical power - innovating energy,ethical-power.com,EX2 9UA,"CleanTech, Net Zero","CleanTech: Energy Production, Management and Storage, Net Zero: Low Carbon Energy Generation, Net Zero: Energy Storage, Net Zero: Renewables, Net Zero: Renewable Energy Planning Database",,0,2023-10-01,0
11182598,SLR MD LIMITED,2496,437270000,0.333,0.111,0.555,Large,02/01/2018 00:00:00,Global leaders in environmental and advisory solutions: helping clients achieve their sustainability goals,slrconsulting.com,EC2N 2AX,"ESG, Life Sciences, Land Remediation, Net Zero","ESG: ESG Consultants, Life Sciences: Environmental Sciences Products and Services, Land Remediation: Regulatory Services, Net Zero: Low Carbon Consultancy, Advisory & Offsetting Services",,0,,0
06451452,IB VOGT UK LTD,39,5320893,0.302,0.302,,Small,12/12/2007 00:00:00,"The family-owned company provides high-quality turnkey pv plants, designed and engineered in germany, to end investors internationally. ib vogt gmbh focuses on developing and delivering high-quality large-scale turnkey pv plants worldwide.",ibvogt.com,EC2V 6BT,Energy Generation,Energy Generation: Solar,,0,,0
06669123,MARINE POWER SYSTEMS LTD,41,83166,0.284,0.284,,Small,08/11/2008 00:00:00,"Our flexible technology is the only solution of its type that can be configured to harness wind and wave energy, either as a combined solution or on their own, in deep water.",marinepowersystems.co.uk,SA1 2AQ,"CleanTech, Net Zero, Energy Generation","CleanTech: Energy Production, Management and Storage, Net Zero: Renewables, Net Zero: Renewable Energy Planning Database, Energy Generation: Hydropower",688832,8.3,2024-06-01,0
09677724,BELLTOWN POWER UK LIMITED,26,4500187,0.5335000000000001,0.265,0.802,Small,07/09/2015 00:00:00,"Belltown power is an international leader in the development and management of sustainable infrastructure, through renewable energy and regenerative agriculture.",belltownpower.com,BS1 6BN,"CleanTech, Net Zero, Energy Generation","CleanTech: Energy Production, Management and Storage, Net Zero: Low Carbon Energy Generation, Net Zero: Renewables, Net Zero: Renewable Energy Planning Database, Energy Generation: Solar",,0,,0
11182524,SLR GLOBAL LIMITED,3447,581876334,0.275,0.167,0.383,Large,02/01/2018 00:00:00,Global leaders in environmental and advisory solutions: helping clients achieve their sustainability goals,slrconsulting.com,EC2N 2AX,"ESG, Life Sciences, Land Remediation, Net Zero","ESG: ESG Consultants, Life Sciences: Environmental Sciences Products and Services, Land Remediation: Regulatory Services, Net Zero: Low Carbon Consultancy, Advisory & Offsetting Services",,0,,0
03341304,MRI SOFTWARE LIMITED,2019,250795099,0.39549999999999996,0.428,0.363,Large,03/27/1997 00:00:00,Mri software has the most comprehensive range of social housing management software solutions today. tech which puts customers first.,mrisoftware.com,EC2V 8EA,Energy Management,Energy Management: Smart Grid,,0,,0
03426833,CHALLEN COMMERCIAL INVESTIGATIONS LIMITED,454,26419477,0.2485,0.245,0.252,Large,09/01/1997 00:00:00,We excel at managing risks so you have peace of mind and can focus on your projects. looking for compliance without complication? then visit our site!,ensafe.co.uk,SO15 2BG,"Life Sciences, Net Zero","Life Sciences: Environmental Sciences Products and Services, Net Zero: Low Carbon Consultancy, Advisory & Offsetting Services",,0,,0
03739805,KENSA HEAT PUMPS LIMITED,120,0,0.274,0.274,,Medium,03/24/1999 00:00:00,"Kensa's award-winning ground source heat pumps provide sustainable, affordable & efficient heating alternatives to polluting fossil fuels.",kensaheatpumps.com,TR4 8RJ,"Net Zero, Energy Generation","Net Zero: Heating, Net Zero: Building Technologies, Energy Generation: Renewable Thermal",7644,0,,0
04501557,SEVERN TRENT GREEN POWER LIMITED,195,130316772,0.2395,0.205,0.274,Large,08/01/2002 00:00:00,"We are experts in the provision of food waste recycling services, composting and the construction of complex food, green and sewage recycling facilities.",stgreenpower.co.uk,OX7 4EB,"Net Zero, Energy Generation","Net Zero: Waste Management and Recycling, Net Zero: Renewable Energy Planning Database, Energy Generation: Bioenergy",0,0,,0
09667089,MCNALLY ELECTRICAL (YORKSHIRE) LIMITED,31,1641700,0.227,0.227,,Small,07/02/2015 00:00:00,Electric vehicle charger installation experts,mcnallyev.uk,BD23 4QP,Net Zero,Net Zero: Low Emission Vehicles,,0,,0
10533157,EFFICIENCYIT LIMITED,22,1328460,0.26,0.26,,Small,12/20/2016 00:00:00,Efficiencyit are leading technology and data centre experts. unbiased advice on the world's best datacentre technology and it infrastructures,efficiencyit.com,RH4 1BS,"Data Infrastructure, Energy Storage","Data Infrastructure: Data Infrastructure Hardware, Data Infrastructure: Data Infrastructure Services, Data Infrastructure: Data Centres, Data Infrastructure: Data Centre Cooling, Energy Storage: Uninterruptible power supply",,0,,0
02885265,AGRIVERT LIMITED,15,76760747,0.2495,-0.123,0.622,Large,01/06/1994 00:00:00,"We are experts in the provision of food waste recycling services, composting and the construction of complex food, green and sewage recycling facilities.",stgreenpower.co.uk,HP14 3SX,"Net Zero, Energy Generation","Net Zero: Waste Management and Recycling, Net Zero: Renewable Energy Planning Database, Energy Generation: Bioenergy",,33,2015-08-01,0
SC355209,TAYLOR HOPKINSON LIMITED,208,110715045,0.39349999999999996,0.414,0.373,Large,02/17/2009 00:00:00,Taylor hopkinson is the leading renewables recruitment consultancy and a trusted advisory partner to the world's biggest green energy firms.,taylorhopkinson.com,G2 7DA,Net Zero,Net Zero: Renewable Energy Planning Database,,0,,0
SC411662,REALISE ENERGY SERVICES LIMITED,23,1869057,0.273,0.273,,Small,11/21/2011 00:00:00,Realise energy services is a locally based uk mid-wind service and maintenance company with a large portfolio of wind turbines that we currently support.,realise-energy.co.uk,PH1 3UQ,Net Zero,Net Zero: Renewable Energy Planning Database,,0,2023-09-01,0
SC177385,IMS HEAT PUMPS LIMITED,57,4613240,0.792,0.792,,Medium,07/18/1997 00:00:00,Heat pump installers,imsheatpumps.co.uk,PH1 3UF,"Net Zero, Energy Generation","Net Zero: Heating, Net Zero: Building Technologies, Energy Generation: Renewable Thermal",,0,2024-06-01,0
09442694,BIRDSHILL BIOMASS LTD.,22,1409096,0.291,0.291,,Small,02/17/2015 00:00:00,"We supply and install biomass boilers, solar thermal and ground source and air source renewable heating systems throughout wales and england.",birdshill.wales,SA32 8QX,"Energy Storage, Net Zero, Energy Generation","Energy Storage: Thermal, Net Zero: Low Carbon Energy Generation, Net Zero: Heating, Net Zero: Building Technologies, Net Zero: Renewable Energy Planning Database, Energy Generation: Renewable Thermal, Energy Generation: Bioenergy",,0,,0
05367753,KENSA GROUP LIMITED,338,45900925,0.32999999999999996,0.359,0.301,Large,02/17/2005 00:00:00,"Kensa's award-winning ground source heat pumps provide sustainable, affordable & efficient heating alternatives to polluting fossil fuels.",kensaheatpumps.com,TR4 8RJ,"Net Zero, Energy Generation","Net Zero: Heating, Net Zero: Building Technologies, Energy Generation: Renewable Thermal",,0,,0
