Companynumber,Companyname,BestEstimateCurrentEmployees,BestEstimateCurrentTurnover,BestEstimateGrowthPercentagePerYear,BestEstimateEmployeeGrowthPercentagePerYear,BestEstimateTurnoverGrowthPercentagePerYear,CompanyGrowthStage,SortableIncorporationDate,Description,URLs,Registeredpostcode,RTICs,RTICsubsectors,TotalInnovateUKFunding,TotalDealroomFundingMillionPounds,LastKnownDealroomFunding,WomenFounded
05913305,EUROCONSULT INTERNATIONAL MERGERS & ACQUISITIONS LIMITED,24,1773966,0.241,0.241,,Small,08/22/2006 00:00:00,"Euroconsult international mergers & acquisitions (ec m&a) is an independent, globally active, investment banking firm specializing in mergers, acquisitions, company sales and corporate divestitures.",ec-ma.com,E1W 9US,"Sensors, Life Sciences, Pharma, CleanTech, Electronics Manufacturing","Sensors: Industry 4.0, Life Sciences: Life Sciences Manufacturing, Pharma: Automation, CleanTech: Environmental Protection and Monitoring, Electronics Manufacturing: Measuring and metrology devices",,0,,0
07360585,TGRC LTD,66,5336134,0.251,0.251,,Medium,08/31/2010 00:00:00,"The green recruitment company are the leading provider of global recruitment solutions to the green energy & green technology recruitment sector, providi...",greenrecruitmentcompany.com,SE1 8RT,"Business Support Services, Net Zero","Business Support Services: Employment and Recruitment Services, Net Zero: Low Carbon Energy Generation, Net Zero: Renewable Energy Planning Database",,0,,0
11693136,ALTELIUM LTD,35,41345,0.528,0.528,,Small,11/23/2018 00:00:00,"We provide warranties, insurance and consultancy for businesses working with batteries at any stage in their life cycle.",altelium.com,LS1 5DQ,"Energy Storage, Net Zero","Energy Storage: Batteries, Net Zero: Energy Storage",600940,2.7,2022-03-01,0
02564354,FORTUM O&M (UK) LIMITED,92,15264599,0.216,0.197,0.235,Medium,11/30/1990 00:00:00,Our purpose is to drive the change for a cleaner world. we are securing a fast and reliable transition to a carbon-neutral economy by providing customers and societies with clean energy and sustainable solutions.,fortum.com,W1U 7EU,"Net Zero, Energy Generation","Net Zero: Renewables, Net Zero: Renewable Energy Planning Database, Energy Generation: Nuclear",,0,,0
11710336,EATON WAREHOUSE LTD,61,0,0.231,0.231,,Medium,12/04/2018 00:00:00,"Diversified power management company and global technology leader in electrical systems for power quality, distribution and control; hydraulics components, systems and services for industrial and mobile equipment; aerospace fuel, hydraulics and pneumatic systems for commercial and military use; and truck and automotive drivetrain and powertrain systems for performance, fuel economy and safety.",www.eaton.com,UB4 0JZ,Energy Management,Energy Management: Energy Management Systems,,0,,0
01250443,NIRAS GROUP (UK) LTD,204,61538660,0.347,0.267,0.427,Large,03/22/1976 00:00:00,Niras - ip consult in germany has been implementing projects for the past 40 years. we also act as advisors to public and non-governmental organisations in germany.,niras.com,SL5 7JR,"CleanTech, Research and Consulting - Physical Sciences and Engineering, Net Zero","CleanTech: Agriculture, Forestry and Biodiversity, Research and Consulting - Physical Sciences and Engineering: Engineering Consulting, Net Zero: Low Carbon Consultancy, Advisory & Offsetting Services, Net Zero: Renewable Energy Planning Database",,0,,0
07828647,VITAL ENERGI SOLUTIONS LIMITED,67,122439588,0.2195,0.195,0.244,Large,10/31/2011 00:00:00,"Vital energi provides low carbon energy generation, energy distribution & energy management solutions across sectors. heat networks, heat pumps, solar, and battery storage energy services.",vitalenergi.co.uk,BB1 2LD,"Electronics Manufacturing, Energy Management, Net Zero, Energy Generation","Electronics Manufacturing: Energy generation or distribution tech, Energy Management: Smart Grid, Energy Management: Smart Meter, Energy Management: Energy Management Systems, Net Zero: Low Carbon Energy Generation, Net Zero: Renewable Energy Planning Database, Energy Generation: Fossil Fuels",106955,0,,0
06614239,AMERESCO LIMITED,101,82241666,0.273,0.125,0.421,Large,06/09/2008 00:00:00,Ameresco is a leading renewable energy company and energy efficiency company offering espc-funded energy solutions for public and private organizations.,ameresco.com,LS1 2JP,"CleanTech, Energy Storage, Energy Management, Net Zero, Energy Generation","CleanTech: Energy Production, Management and Storage, Energy Storage: Batteries, Energy Management: Energy Management Systems, Net Zero: Low Carbon Energy Generation, Net Zero: Energy Storage, Net Zero: Renewables, Energy Generation: Fossil Fuels, Energy Generation: Bioenergy",59028,0,,0
07068933,SOL ENVIRONMENT LIMITED,20,1484515,0.232,0.232,,Small,11/06/2009 00:00:00,Sol environment is an independent environmental consultancy that provides comprehensive and pragmatic sustainability advice across a broad spectrum of service areas. we specialise in renewable & low carbon technologies and environmental compliance,sol-environment.co.uk,WR14 3HT,"ESG, Life Sciences, Net Zero","ESG: ESG Consultants, Life Sciences: Environmental Sciences Products and Services, Net Zero: Low Carbon Consultancy, Advisory & Offsetting Services, Net Zero: Renewable Energy Planning Database",31098,0,,0
00631825,SIEMENS ENERGY LIMITED,2022,695125431,0.26949999999999996,0.36,0.179,Large,07/03/1959 00:00:00,"We energize society. siemens energy is committed to make sustainable, reliable, and affordable energy possible, with innovative technologies and clear focus on our customers’ needs.",siemens-energy.com,NE6 2YL,"CleanTech, Electronics Manufacturing, Energy Storage, Energy Management, Net Zero, Energy Generation","CleanTech: Energy Production, Management and Storage, Electronics Manufacturing: Electromedical technologies, Energy Storage: Hydrogen, Energy Management: Energy Management Systems, Net Zero: Low Carbon Energy Generation, Net Zero: Energy Storage, Net Zero: Grid, Net Zero: Renewables, Net Zero: Renewable Energy Planning Database, Energy Generation: Hydrogen, Energy Generation: Hydropower, Energy Generation: Fossil Fuels",473077.84,0,,0
11067668,CIRCULOR LTD,98,4628257,1.952,1.952,,Medium,11/16/2017 00:00:00,"Circulor provides a leading solution to industrial, complex supply chain traceability based on ai and blockchain technology.",circulor.com,W6 0LE,"Energy Storage, Net Zero","Energy Storage: Batteries, Net Zero: Energy Storage",315402.8,34.19,2022-06-01,0
06912622,C-CAPTURE LIMITED,48,3334785,0.267,0.267,,Small,05/21/2009 00:00:00,"C-capture designs world-leading chemical processes for the capture of carbon dioxide and has patented a unique, solvent-based technology which offers a safe, low-cost way to remove carbon dioxide from emissions.",c-capture.co.uk,HG1 2PW,"Life Sciences, CleanTech, Net Zero, Energy Generation","Life Sciences: Chemical Products and Services, CleanTech: Mining, Fuels and Biofuels, CleanTech: Environmental Protection and Monitoring, Net Zero: Low Carbon Energy Generation, Net Zero: Carbon Capture, Energy Generation: Bioenergy",163538,20.93,2023-09-01,0
05708056,CARBON8 SYSTEMS LIMITED,53,3694957,0.569,0.569,,Medium,02/13/2006 00:00:00,"Carbon8 is the inventor and owner of a chemical process that treats industrial residues, including hazardous waste, using captured co₂ from flue gas to transform them into valuable, low-carbon products.",carbon8.co.uk,NG1 6HH,CleanTech,CleanTech: Environmental Protection and Monitoring,273953,5.19,2022-06-01,0
SC293690,SUNAMP LIMITED,101,16573535,0.6885,0.205,1.172,Medium,11/25/2005 00:00:00,"Sunamp designs and manufactures space-saving thermal storage that makes homes, buildings and vehicles more energy-efficient and sustainable, while reducing carbon emissions and optimising renewables.",sunamp.com,EH33 1RY,"CleanTech, Energy Storage, Net Zero","CleanTech: Energy Production, Management and Storage, Energy Storage: Batteries, Energy Storage: Thermal, Net Zero: Low Carbon Energy Generation, Net Zero: Building Technologies, Net Zero: Renewables, Net Zero: Renewable Energy Planning Database",2782934.9,28.19,2022-11-01,0
07904461,SONNEDIX UK SERVICES LIMITED,87,46953547,0.21900000000000003,0.166,0.272,Large,01/10/2012 00:00:00,"We are an established independent power producer (ipp) with a proven track record of successfully designing, financing, building and monitoring high-performance, cost-competitive solar plants around the world.",sonnedix.com,SE1 0NW,Energy Generation,Energy Generation: Solar,,220.29,2024-02-01,0
11062616,CONNECTED KERB LIMITED,192,0,1.1,1.1,,Medium,11/14/2017 00:00:00,Connected kerb provide a unique approach to electric vehicle charging infrastructure – one that champions sustainability and connectivity.,connectedkerb.com,OX2 9GG,Net Zero,Net Zero: Low Emission Vehicles,415417,110.12,2022-09-01,0
SC595075,SYNERGY HOTELS (GLASGOW) LIMITED,118,7600574,0.726,0.726,,Medium,04/23/2018 00:00:00,"Synergie environ is an energy engineering firm based in glasgow, scotland focused on cutting cost, consumption and carbon for our clients.",synergie-environ.co.uk,EH1 3JD,"Net Zero, Energy Generation","Net Zero: Low Carbon Energy Generation, Net Zero: Renewable Energy Planning Database, Energy Generation: Bioenergy",,0,,0
03877095,INCONTROL SYSTEMS LIMITED,19,950458,0.189,0.189,,Small,11/15/1999 00:00:00,"Specialist company providing turnkey solutions for process control, automation and information systems for 20 years. we put you in control of your systems.",incontrol.co.uk,S43 4XA,"Robotics and Autonomous systems, Energy Management","Robotics and Autonomous systems: Integrators, Energy Management: Energy Management Systems",,0,,0
SC370321,SYNERGIE ENVIRON LIMITED,33,1164105,0.204,0.204,,Small,12/18/2009 00:00:00,"Synergie environ is an energy engineering firm based in glasgow, scotland focused on cutting cost, consumption and carbon for our clients.",synergie-environ.co.uk,G41 1DX,"Net Zero, Energy Generation","Net Zero: Low Carbon Energy Generation, Net Zero: Renewable Energy Planning Database, Energy Generation: Bioenergy",,0,2021-05-01,0
11175091,DUMAREY FLYBRID LIMITED,48,3344066,0.42,0.42,,Small,01/29/2018 00:00:00,"The silverstone technology cluster (stc) exists to help advanced engineering, electronics and software businesses in the wider geographical area surrounding silverstone. the stc is specifically focused on the areas of: • promotion • support • thought leadership promotion aims to raise the profile of stc members and their capabilities at a national and international …",silverstonetechnologycluster.com,NN12 8GX,Energy Storage,Energy Storage: Mechanical,1934010,0,2014-01-01,1
03925802,SOLARSENSE (UK) LTD,46,2561779,0.232,0.232,,Small,02/15/2000 00:00:00,"Multi-award winning clean energy company. specialising in the installation of solar panels, battery storage, ev & heat pumps for businesses & homeowners.",solarsense-uk.com,BS21 6RR,"CleanTech, Net Zero, Energy Generation","CleanTech: Energy Production, Management and Storage, Net Zero: Low Carbon Energy Generation, Net Zero: Heating, Net Zero: Energy Storage, Net Zero: Renewables, Net Zero: Renewable Energy Planning Database, Energy Generation: Solar",,0,,0
10255214,COMPOUND SEMICONDUCTOR APPLICATIONS CATAPULT LIMITED,124,22827349,0.3805,0.242,0.519,Medium,06/28/2016 00:00:00,"Since 2018, the catapult has built a team of nearly 100 talented employees, developed a state-of-the-art innovation centre and initiated over £100m in projects. take a look at the impact we've made.",csa.catapult.org.uk,NP10 8BE,"Space Energy, Photonics, Computer Hardware, Quantum Economy, Electronics Manufacturing","Space Energy: Power Core, Photonics: Telecommunications, Photonics: Quantum Tech, Photonics: Optics, Photonics: Microelectronics, Computer Hardware: Tools, Quantum Economy: Photonics, Quantum Economy: Components and Materials, Electronics Manufacturing: Communications",63404126,0,,0
05857689,RSK (IRELAND) LIMITED,29,6689642,0.2355,0.208,0.263,Small,06/26/2006 00:00:00,"Rsk has grown into a leading integrated environmental, engineering and technical services business, providing end-to-end services.",rskgroup.com,WA6 0AR,"Life Sciences, Net Zero","Life Sciences: Environmental Sciences Products and Services, Net Zero: Heating, Net Zero: Low Carbon Consultancy, Advisory & Offsetting Services",,0,,0
02901671,RSK PROJECT SERVICES LIMITED,72,11847492,1.3410000000000002,1.618,1.064,Medium,02/23/1994 00:00:00,"Rsk has grown into a leading integrated environmental, engineering and technical services business, providing end-to-end services.",rskgroup.com,WA6 0AR,"Life Sciences, Net Zero","Life Sciences: Environmental Sciences Products and Services, Net Zero: Heating, Net Zero: Low Carbon Consultancy, Advisory & Offsetting Services",,0,,0
03900983,ICAX LIMITED,21,1389331,0.231,0.231,,Small,12/30/1999 00:00:00,Ground source heat pumps | ground source heating | psds | ground source heating and cooling | district heat networks | sustainable energy | ground source heat pump,icax.co.uk,SW15 1BN,"Energy Storage, Net Zero, Energy Generation","Energy Storage: Thermal, Net Zero: Low Carbon Energy Generation, Net Zero: Heating, Net Zero: Building Technologies, Net Zero: Renewables, Net Zero: Renewable Energy Planning Database, Energy Generation: Renewable Thermal",1014887,0,,0
06927267,MATERION UK LIMITED,90,1833159,0.762,0.762,,Medium,06/08/2009 00:00:00,"A global supplier of specialty materials including alloys, beryllium products, composite / clad metals, thin film deposition materials, precision optics",materion.com,GU14 6XE,"Space Energy, In-Orbit Servicing and Manufacturing, Space Economy, Advanced Materials, Computer Hardware, Quantum Economy, MedTech, Electronics Manufacturing","Space Energy: Power Core, In-Orbit Servicing and Manufacturing: Space Manufacturing, Space Economy: Materials, Advanced Materials: Metals, Advanced Materials: Coatings, Advanced Materials: Technical Ceramics and Glass, Advanced Materials: Optics and Photonics, Advanced Materials: Electrochemical, Computer Hardware: Tools, Quantum Economy: Components and Materials, MedTech: Advanced Materials, Electronics Manufacturing: Optical devices",,0,,0
10489088,OCTAIPIPE LIMITED,41,1951293,0.555,0.555,,Small,11/21/2016 00:00:00,We deliver bespoke ai-driven business innovation & solutions through our data science and machine learning services. see how we do it!,t-dab.ai,E1 6JN,"Engineering Biology Supply Chain, Cloud Computing, Advanced Manufacturing, Data Infrastructure, Cyber, MedTech, Energy Management, Artificial Intelligence, Internet of Things","Engineering Biology Supply Chain: Computational - AI / Bioinformatics / Omics / Software, Cloud Computing: Platform as a Service (PaaS) & Platform Management, Advanced Manufacturing: Industrial IoT, Advanced Manufacturing: Artificial Intelligence, Data Infrastructure: Data Infrastructure Services, Cyber: IoT Security, MedTech: Artificial Intelligence, Energy Management: AI and IoT, Artificial Intelligence: Machine Learning, Artificial Intelligence: Systems Optimisation, Artificial Intelligence: Green Tech, Artificial Intelligence: Life Sciences, Artificial Intelligence: Enabling Platforms, Artificial Intelligence: Data Analysis, Internet of Things: Smart Cities and Transport, Internet of Things: Industrial IoT",854341.61,4.54,2024-01-01,0
SC440892,BIOSUS ENERGY LTD,23,8590993,0.206,0.206,,Small,01/22/2013 00:00:00,"Biosus energy, provider of solar, low carbon, energy solutions in uk. specialist in low cost power and heat supply, biomass and energy supply agreements.",biosusenergy.com,AB15 8RA,"Net Zero, Energy Generation","Net Zero: Low Carbon Energy Generation, Net Zero: Heating, Net Zero: Renewables, Net Zero: Renewable Energy Planning Database, Energy Generation: Renewable Thermal, Energy Generation: Fossil Fuels, Energy Generation: Bioenergy",,0,,0
FC031294,EQTEC PUBLIC LIMITED COMPANY,36,16083121,0.338,0.149,0.527,Medium,03/26/2013 00:00:00,"Welcome to eqtec, the world-leading technology innovation company. creating syngas from advanced gasification for sustainable waste to energy and biofuels.",eqtec.com,T12 W7CV,"CleanTech, Research and Consulting - Physical Sciences and Engineering, Net Zero, Energy Generation","CleanTech: Mining, Fuels and Biofuels, CleanTech: Environmental Protection and Monitoring, CleanTech: Energy Production, Management and Storage, Research and Consulting - Physical Sciences and Engineering: Engineering Research, Net Zero: Low Carbon Energy Generation, Net Zero: Renewable Energy Planning Database, Energy Generation: Bioenergy",,0,,0
03761340,RSK GROUP LIMITED,21028,3050112500,0.498,0.413,0.583,Large,04/28/1999 00:00:00,"Rsk has grown into a leading integrated environmental, engineering and technical services business, providing end-to-end services.",rskgroup.com,WA6 0AR,"Life Sciences, Net Zero","Life Sciences: Environmental Sciences Products and Services, Net Zero: Heating, Net Zero: Low Carbon Consultancy, Advisory & Offsetting Services, Net Zero: Renewable Energy Planning Database",303565,10,2021-08-01,0
08142682,INACCESS HOLDINGS LTD,151,119234970,0.5579999999999999,0.007,1.109,Large,07/13/2012 00:00:00,"The leading choice in digital renewable energy infrastructure management for solar, wind, storage, microgrid, vpp, and market integration.",inaccess.com,E11 1GA,"Energy Management, Artificial Intelligence, Net Zero, Energy Generation","Energy Management: Energy Management Systems, Energy Management: AI and IoT, Artificial Intelligence: Green Tech, Net Zero: Energy Storage, Net Zero: Renewables, Net Zero: Renewable Energy Planning Database, Energy Generation: Solar",,0,,0
11138872,DATA SCIENCE CENTRAL UK LIMITED,182,12707718,0.962,0.962,,Medium,01/08/2018 00:00:00,New & notable top webinar recently added new videos,datasciencecentral.com,EC2A 4DS,"Supply Chain Logistics, Advanced Manufacturing, Energy Management, Artificial Intelligence, EdTech","Supply Chain Logistics: Artificial Intelligence, Advanced Manufacturing: Artificial Intelligence, Energy Management: AI and IoT, Artificial Intelligence: Machine Learning, Artificial Intelligence: Green Tech, Artificial Intelligence: Life Sciences, Artificial Intelligence: Enabling Platforms, EdTech: Artificial Intelligence",,0,,0
10317962,CHEESECAKE ENERGY LIMITED,30,1517915,0.381,0.381,,Small,08/08/2016 00:00:00,Cheesecake energy ltd (cel) has developed the world’s most sustainable energy storage technology to support the integration of renewable energy,cheesecakeenergy.com,NG7 2TU,"Space Energy, CleanTech, Energy Storage, Energy Management, Net Zero, Energy Generation","Space Energy: Power Core, CleanTech: Energy Production, Management and Storage, Energy Storage: Batteries, Energy Storage: Mechanical, Energy Storage: Thermal, Energy Management: Energy Management Systems, Net Zero: Low Carbon Energy Generation, Net Zero: Energy Storage, Net Zero: Grid, Net Zero: Renewables, Net Zero: Renewable Energy Planning Database, Energy Generation: Fossil Fuels",829000.76,14.45,2023-04-01,0
08987637,PETALITE LIMITED,60,12569409,0.396,0.396,,Medium,04/09/2014 00:00:00,"We are changing the charge at dc electric vehicle charging stations, reducing costs and increasing reliability for customers globally",petalite.co.uk,B4 7BA,"Artificial Intelligence, Net Zero","Artificial Intelligence: Green Tech, Net Zero: Low Emission Vehicles",3588096.9799999995,4.8,2022-01-01,0
11703451,NATIONAL ENERGY HOLDINGS LIMITED,115,21132321,1.675,1.675,,Medium,11/29/2018 00:00:00,National energy is a privately funded corporate group active in the renewable energy sector.,national.energy,EC4R 3TT,"CleanTech, Net Zero, Energy Generation","CleanTech: Energy Production, Management and Storage, Net Zero: Low Carbon Energy Generation, Net Zero: Energy Storage, Net Zero: Energy Cooperatives, Net Zero: Renewables, Net Zero: Renewable Energy Planning Database, Energy Generation: Onshore Wind, Energy Generation: Solar",,43.35,2021-12-01,0
06339353,I.D.D.E.A. LTD,28,1551310,0.225,0.225,,Small,08/09/2007 00:00:00,"Iddea is a renewable energy company based in wiltshire. we are specialists in domestic solar systems, battery storage, and commercial solar projects too.",iddea.co.uk,SK9 1BQ,"Net Zero, Energy Generation","Net Zero: Energy Storage, Net Zero: Renewables, Net Zero: Renewable Energy Planning Database, Energy Generation: Solar",,0,,0
02458109,WESTINGHOUSE ELECTRIC UK HOLDINGS LIMITED,212,0,0.374,0.374,,Medium,01/10/1990 00:00:00,,westinghousenuclear.com,PR4 0XJ,Energy Generation,"Energy Generation: Nuclear, Energy Generation: Nuclear Fusion",,0,,0
10907810,ILKE HOMES HOLDINGS LIMITED,1322,68805000,1.3824999999999998,0.542,2.223,Large,08/09/2017 00:00:00,Our stunning modular homes sit in well designed places where people want to live. they’re built at a pace and a quality that’s unlike any other.,ilkehomes.co.uk,M2 4WU,"Modular Construction, Net Zero","Modular Construction: Supply Chain, Modular Construction: Permanent Modular Buildings, Net Zero: Renewable Energy Planning Database",,0,,0
08536866,SUPERDIELECTRICS LTD,43,2969763,0.588,0.588,,Small,05/20/2013 00:00:00,Storing sustainable energy without costing the earth // a breakthrough energy storage technology that complements batteries & solves the world’s renewable energy storage problem.,superdielectrics.com,CB10 1XL,"Life Sciences, CleanTech, Energy Storage, Research and Consulting - Physical Sciences and Engineering, Net Zero","Life Sciences: Research, CleanTech: Energy Production, Management and Storage, Energy Storage: Batteries, Energy Storage: Mechanical, Research and Consulting - Physical Sciences and Engineering: Engineering Research, Net Zero: Low Carbon Energy Generation, Net Zero: Energy Storage",,0,,0
11154487,INFINITY RENEWABLES GROUP LTD.,62,3516244,0.688,0.688,,Medium,01/17/2018 00:00:00,,infinity-renewables.com,RH10 1JH,"CleanTech, Energy Storage, Energy Management, Net Zero, Energy Generation","CleanTech: Energy Production, Management and Storage, Energy Storage: Batteries, Energy Management: Energy Management Systems, Net Zero: Energy Storage, Net Zero: Renewables, Net Zero: Renewable Energy Planning Database, Energy Generation: Solar",,0,,1
12027814,SYMBIOTEC LTD,100,6339696,1.446,1.446,,Medium,06/03/2019 00:00:00,"We harness the natural flexibility and strength of mycelium, the material structure of fungi, to grow protective packaging at any scale by combining it with agricultural waste such as hemp, cork and sawdust.",www.magicalmushroom.com,KT10 9QY,CleanTech,CleanTech: Adapted Goods,38660,0,,0
07253661,GEOGREEN POWER LIMITED,59,3338213,0.203,0.203,,Medium,05/14/2010 00:00:00,"Specialist uk renewable energy company, solar panel installers and ground source heat pumps systems. download our brochure and get a free quote today.",geogreenpower.com,NG5 1AY,"Net Zero, Energy Generation","Net Zero: Low Carbon Energy Generation, Net Zero: Heating, Net Zero: Energy Storage, Net Zero: Renewables, Net Zero: Renewable Energy Planning Database, Energy Generation: Renewable Thermal, Energy Generation: Solar",856309,0.25,2021-08-01,0
10909968,ILKE HOMES LIMITED,1310,31630000,0.8420000000000001,0.499,1.185,Large,08/10/2017 00:00:00,Our stunning modular homes sit in well designed places where people want to live. they’re built at a pace and a quality that’s unlike any other.,ilkehomes.co.uk,M2 4WU,"Modular Construction, Net Zero","Modular Construction: Supply Chain, Modular Construction: Permanent Modular Buildings, Net Zero: Renewable Energy Planning Database",0,100,2022-12-01,0
SC624904,EASEE UK LTD,95,17282810,1.416,1.416,,Medium,03/19/2019 00:00:00,Easee deliver the maximum roi whilst reducing overall expenditure. working with existing energy solutions and or speccing/fitting completely new installations.,easeeltd.co.uk,G2 4TP,"Life Sciences, CleanTech, Energy Storage, Energy Management, Net Zero, Energy Generation","Life Sciences: Environmental Sciences Products and Services, CleanTech: Energy Production, Management and Storage, Energy Storage: Batteries, Energy Management: Smart Meter, Energy Management: Energy Management Systems, Net Zero: Energy Storage, Net Zero: Low Carbon Consultancy, Advisory & Offsetting Services, Net Zero: Renewables, Net Zero: Renewable Energy Planning Database, Energy Generation: Fossil Fuels",,4.6,2023-08-01,0
07336550,SSWUK LIMITED,40,3550543,0.222,0.222,,Small,08/05/2010 00:00:00,,solarsouthwest.co.uk,TA18 8RR,"Photonics, Net Zero, Energy Generation","Photonics: Photovoltaics, Net Zero: Energy Storage, Net Zero: Renewables, Net Zero: Renewable Energy Planning Database, Energy Generation: Solar",,0,,0
07993907,ZLC ENERGY LTD,29,1737329,0.268,0.268,,Small,03/16/2012 00:00:00,"Zlc energy install solar pv, heat pumps and biomass. we are also cornwall’s leading experts for combined heat & power (chp) and energy storage.",zlcenergy.co.uk,PL14 4DH,"Energy Management, Net Zero, Energy Generation","Energy Management: Energy Management Systems, Net Zero: Low Carbon Energy Generation, Net Zero: Heating, Net Zero: Energy Storage, Net Zero: Renewables, Net Zero: Renewable Energy Planning Database, Energy Generation: Renewable Thermal, Energy Generation: Solar",,0,,0
07597351,SYZYGY RENEWABLES LIMITED,51,1876533,0.213,0.213,,Medium,04/08/2011 00:00:00,Syzygy specialises in delivering embedded renewable energy solutions to the commercial real estate sector.,syzygyconsulting.eu,SE1 3LA,"CleanTech, Net Zero","CleanTech: Energy Production, Management and Storage, Net Zero: Renewable Energy Planning Database",,0,,0
