Companynumber,Companyname,BestEstimateCurrentEmployees,BestEstimateCurrentTurnover,BestEstimateGrowthPercentagePerYear,BestEstimateEmployeeGrowthPercentagePerYear,BestEstimateTurnoverGrowthPercentagePerYear,CompanyGrowthStage,SortableIncorporationDate,Description,URLs,Registeredpostcode,RTICs,RTICsubsectors,TotalInnovateUKFunding,TotalDealroomFundingMillionPounds,LastKnownDealroomFunding,WomenFounded
06279529,UP FITNESS LIMITED,180,19564467,0.233,0.327,0.139,Medium,06/14/2007 00:00:00,"Experience world-class personal training with u.p. london, manchester, leeds, and beyond, that delivers 'maximum results in minimum time'.",ultimateperformance.com,M2 7HA,Food Tech,Food Tech: Consumer Products and Services,,0,2024-05-01,0
07893709,GROCERY DELIVERY E-SERVICES UK LTD.,5398,1171102500,0.7025,0.778,0.627,Large,12/29/2011 00:00:00,"Uk's leading recipe box | fresh, quality ingredients | even more recipe choice and variety | flexible subscription | free delivery - get started now!",hellofresh.co.uk,EC2A 2EZ,Food Tech,Food Tech: Consumer Products and Services,,0,,0
11632704,THINGSTREAM LIMITED,23,9031562,1.4204999999999999,0.009,2.832,Small,10/19/2018 00:00:00,U-blox iot communication-as-a-service makes it simple to get data from iot devices to the enterprise. accelerate your iot.,thingstream.io,BH15 2PW,"Software Development, Advanced Manufacturing, Cyber, AgriTech, Internet of Things","Software Development: Embedded Software, Advanced Manufacturing: Industrial IoT, Cyber: IoT Security, AgriTech: Remote Sensing, Internet of Things: Connectivity Platforms",,0,,0
10078453,UBER EATS UK LIMITED,311,1808650250,1.3185,0.294,2.343,Large,03/22/2016 00:00:00,"Use your uber account to order delivery from el falafel (bristo place) in edinburgh. browse the menu, view popular items, and track your order.",ubereats.com,E1 8FA,Food Tech,Food Tech: Food Delivery,,0,,0
12070118,SWEET TEMPTATIONS LTD,30,1270080,0.414,0.414,,Small,06/26/2019 00:00:00,"Use your uber account to order delivery from el falafel (bristo place) in edinburgh. browse the menu, view popular items, and track your order.",ubereats.com,L36 8HT,Food Tech,Food Tech: Food Delivery,,0,,1
12226451,SHAKESPEARE COFFEE AND BISTRO LTD,58,1642158,0.958,0.958,,Medium,09/25/2019 00:00:00,"Use your uber account to order delivery from el falafel (bristo place) in edinburgh. browse the menu, view popular items, and track your order.",ubereats.com,N9 0PD,Food Tech,Food Tech: Food Delivery,,0,,1
10246065,NW FOOD AND DRINK LTD,52,2056517,0.364,0.364,,Medium,06/22/2016 00:00:00,Supper club / restaurant ramsbottom,rootsfoodanddrink.co.uk,BL0 9ND,Food Tech,Food Tech: Food Delivery,,0,,0
SC536201,BEL'S BUTCHERS LIMITED,36,3987248,0.42,0.42,,Small,05/24/2016 00:00:00,,belsbutchers.co.uk,DD8 1BJ,Food Tech,Food Tech: Food Delivery,,0,,1
