Companynumber,Companyname,BestEstimateCurrentEmployees,BestEstimateCurrentTurnover,BestEstimateGrowthPercentagePerYear,BestEstimateEmployeeGrowthPercentagePerYear,BestEstimateTurnoverGrowthPercentagePerYear,CompanyGrowthStage,SortableIncorporationDate,Description,URLs,Registeredpostcode,RTICs,RTICsubsectors,TotalInnovateUKFunding,TotalDealroomFundingMillionPounds,LastKnownDealroomFunding,WomenFounded
11060647,BLURRED LIMITED,37,1406395,0.461,0.461,,Small,11/13/2017 00:00:00,"A strategic and creative advisory firm. our work is built on the principles of esgp (environment, social, governance and purpose).",blurred.global,EC1V 3PS,"ESG, Agency Market","ESG: ESG Consultants, Agency Market: Public Relations",,0,,0
07658606,JAG FORCE SECURITY LTD,74,2128421,0.339,0.339,,Medium,06/06/2011 00:00:00,,jagforcesecurity.co.uk,HA6 1NW,Business Support Services,Business Support Services: Security Services,,0,,0
07239001,REDDO CARE AND SUPPORT C.I.C.,45,2893981,0.3045,0.128,0.481,Small,04/29/2010 00:00:00,At reddo everything we do is designed to deliver the highest standard of care that people can depend upon. our staff are experienced and dedicated at delivering.,reddorecruitment.co.uk,IG10 3EF,Business Support Services,Business Support Services: Employment and Recruitment Services,,0,,1
09255858,ALTITUDE-RECRUITMENT LIMITED,78,6352211,0.242,0.242,,Medium,10/09/2014 00:00:00,Welcome to altitude-recruitment. a bespoke recruitment service by sarah coppock founded on integrity and reliability. delivering effective tailor made recruitment solutions to clients and candidates alike.,altitude-recruitment.co.uk,NN7 1ER,Business Support Services,Business Support Services: Employment and Recruitment Services,,0,,1
06822584,CONTRACTED TRAINED SECURITY LTD,210,6080396,0.695,0.695,,Medium,02/18/2009 00:00:00,"Manned guarding we recruit and train a number of specialist staff dedicated to manned guarding. our guard force are all fully vetted and sia licensed and undergo full ""due diligence"" during the recruitment phase. read more",contractsecurityuk.co.uk,SM6 9AA,Business Support Services,Business Support Services: Security Services,,0,,0
02845800,HSBC ALTERNATIVE INVESTMENTS LIMITED,85,156665929,0.2095,0.177,0.242,Large,08/13/1993 00:00:00,"We align our expertise in banking, investments and wealth management with your individual needs, putting you at the centre.",privatebanking.hsbc.com,E14 5HQ,Legal Services,"Legal Services: Wills, trusts, probate and estate administration",,0,,0
09898092,NATIONAL ACCIDENT SUPPORT LINE LIMITED,56,2645862,0.212,0.212,,Medium,12/02/2015 00:00:00,"Get your accident compensation uk for any type of accident in uk from best accident claim advisory team in uk, who assist you how to claim accident in uk.",nationalaccidentsupportline.co.uk,EC3R 7LP,Legal Services,Legal Services: Injury,,0,,0
09779922,BRIT LOCUMS LIMITED,192,5346688,1.306,1.306,,Medium,09/16/2015 00:00:00,,britlocums.co.uk,IG1 4LZ,Business Support Services,Business Support Services: Employment and Recruitment Services,,0,,0
03110696,FINANCIAL EXPRESS INVESTMENTS LTD,110,17910147,1.562,2.83,0.294,Medium,10/05/1995 00:00:00,"For financial advisers (ifas) - we provide powerful data, knowledge and analysis that help you make better and more informed investment decisions with your clients",fefundinfo.com,EC2R 7HJ,ESG,ESG: ESG Consultants,,0,2018-05-01,0
08048645,LOGIC SERVICE MANAGEMENT LIMITED,134,5830373,0.306,0.306,,Medium,04/27/2012 00:00:00,Cleaning. training. security. choose logic service management today for your facility management needs. we have centres near peterborough and across the uk,logicservicemanagement.com,PE8 4HN,Business Support Services,Business Support Services: Landscaping and Cleaning Services,,0,,0
SC548555,RECRUITMENT SOLUTIONS ALBA LTD,252,18946319,0.346,0.346,,Large,10/25/2016 00:00:00,,recruitmentalba.com,ML3 0RA,Business Support Services,Business Support Services: Employment and Recruitment Services,,0,,1
08976511,MOORES COMMERCIAL CLEANING LTD,58,916262,1.041,1.041,,Medium,04/03/2014 00:00:00,"Moores commercial cleaning, covers colchester and surrounding areas, end of tenancy cleaning, oven cleaning, carpet cleaning, office cleaning, block cleaning",moorescommercialcleaning.co.uk,CO2 9SD,Business Support Services,Business Support Services: Landscaping and Cleaning Services,,0,,0
09975109,HM LEGAL SERVICES LIMITED,160,9299195,1.202,1.202,,Medium,01/28/2016 00:00:00,Hm3 legal's 6 new standards for doing law differently includes fixed fees and a no chase pledge for business legal services: hello@hm3legal.co.uk,hm3.legal,CH1 3EQ,Legal Services,"Legal Services: Tax & Finance, Legal Services: Intellectual Property, Legal Services: Business Structure and Regulation Advice",,0,,0
10447114,SELECTIVE RECRUITMENT SOLUTIONS LIMITED,1182,0,1.771,1.771,,Large,10/26/2016 00:00:00,,selective-group.com,EC3R 5AR,Business Support Services,Business Support Services: Employment and Recruitment Services,,0,,0
09485687,IPEOPLE SOLUTIONS LIMITED,42,3426067,0.207,0.207,,Small,03/12/2015 00:00:00,We can help you find a new social work role with the right organisation for you or fill job roles across the uk.,ipeoplesolutions.co.uk,NN1 5JF,Business Support Services,Business Support Services: Employment and Recruitment Services,,0,,0
07214262,SAFEFLOW VENTILATION LTD,31,501748,0.219,0.219,,Small,04/07/2010 00:00:00,"Specialist ductwork, extraction & ventilation cleaning services. fire damper maintenance & smoke damper inspections. operating nationwide. all our operatives are fully certified.",safeflowventilation.co.uk,CH44 5TN,Business Support Services,Business Support Services: Landscaping and Cleaning Services,,0,,0
09977822,GUARDING NATIONWIDE LTD,114,3301307,0.839,0.839,,Medium,01/29/2016 00:00:00,A birmingham based private security company. qualified security guards to carry out a full construction site guarding plan to keep your property safe.,guardingnationwide.co.uk,B12 0NS,Business Support Services,Business Support Services: Security Services,,0,,0
10408776,H&A PROTECTION SERVICES LIMITED,202,5845142,1.375,1.375,,Medium,10/04/2016 00:00:00,"Sia acs approved security services provider - providing manned guarding, crowd management & canine support services across the uk.",haprotectionservices.co.uk,PR1 8UQ,Business Support Services,Business Support Services: Security Services,,0,,0
07799562,VISUALISATION ONE (LONDON) LIMITED,71,1986756,0.517,0.517,,Medium,10/06/2011 00:00:00,,v1.co.uk,CH1 1QX,Research and Consulting - Physical Sciences and Engineering,Research and Consulting - Physical Sciences and Engineering: Architectural Research,,0,,0
04514520,WADSWORTHS SOLICITORS LTD,62,3610795,0.202,0.202,,Medium,08/19/2002 00:00:00,"Wadsworth solicitors are a family run business based in solihull, shirley, henley in arden & tamworth expert solicitors providing a range of services.",wadsworthslaw.co.uk,B90 3BL,Legal Services,"Legal Services: Wills, trusts, probate and estate administration, Legal Services: General",,0,,0
08102215,MULTI TRADES RECRUITMENT LTD,40,3224579,0.236,0.236,,Small,06/12/2012 00:00:00,Mtr is the uk's most trusted national brand in the recruitment sector. flexible transparent pricing for clients and efficient placement for candidates.,multitradesrec.co.uk,BL7 9RP,Business Support Services,Business Support Services: Employment and Recruitment Services,,0,,0
09177000,QUICK PEST CONTROL LONDON LTD,35,106344,0.728,0.728,,Small,08/15/2014 00:00:00,Quick pest control provide tailor-made pest control services dependent on your circumstances and budget.,qpcl.co.uk,W12 0PT,Business Support Services,Business Support Services: Landscaping and Cleaning Services,,0,,0
06686884,DCA SECURITY SYSTEMS LIMITED,21,1394310,0.26,0.26,,Small,09/02/2008 00:00:00,"Dca security systems supply and install cctv systems, intruder alarm / burglar alarm systems, door entry systems, access control systems, & fire alarm & detection systems, to protect your home & business.",dcasecurity.co.uk,HP2 7DW,Business Support Services,Business Support Services: Security Services,,0,,0
10707546,DELFI SERVICES LTD,67,17841434,0.266,0.266,,Medium,04/04/2017 00:00:00,,delfisecurity.co.uk,WS11 0EL,Business Support Services,Business Support Services: Security Services,,0,,0
07317266,AMULET (CHURCHILL SECURITY SOLUTIONS) LIMITED,1729,81936098,0.259,0.244,0.274,Large,07/16/2010 00:00:00,"Amulet is an intelligence-led business that delivers multi-faceted security solutions to the construction, healthcare and other sectors throughout the uk.",amulet.co.uk,LU1 3LU,Business Support Services,Business Support Services: Security Services,,0,,0
04395264,WESTGATE CLEANING SERVICES LTD,286,4428857,0.146,0.146,,Large,03/14/2002 00:00:00,Wide range of cleaning services and experienced cleaners who genuinely ... we typically provide cleaning services within the greater london and m25 area.,westgatecleaning.com,BR1 4DZ,Business Support Services,Business Support Services: Landscaping and Cleaning Services,,0,,1
09765797,CIPHER MEDICAL CONSULTANCY LIMITED,496,15502648,0.617,0.617,,Large,09/07/2015 00:00:00,"Our professional team of medical experts can provide the top-quality training, medical event support, and clinical services that you need.",ciphermedical.com,TS18 2LS,Research and Consulting - Physical Sciences and Engineering,Research and Consulting - Physical Sciences and Engineering: Physical Sciences Consulting,,0,,1
07111275,MAY HARRIS MULTI SERVICES LTD,1161,17942620,0.263,0.263,,Large,12/22/2009 00:00:00,A kent contract cleaning and maintenance company. commercial services include school and office cleaning. call ☎ 0800 587 0811 today for a quote.,mayharriscleaning.co.uk,TN15 6NL,Business Support Services,Business Support Services: Landscaping and Cleaning Services,,0,,0
07981593,SONIC DRILLING & PILING PLANTHIRE LIMITED,36,541009,0.41,0.41,,Small,03/08/2012 00:00:00,Just another wordpress site,sonicplanthire.com,WA6 0AR,Business Support Services,Business Support Services: Machinery Rental Services,,0,,0
04192399,WIRELESS CCTV LIMITED,260,40557795,0.279,0.285,0.273,Large,04/02/2001 00:00:00,"Wireless cctv (wcctv) is the market-leading supplier of redeployable cctv, site security solutions, body worn video cameras and time lapse video.",wcctv.co.uk,OL16 4NW,Business Support Services,Business Support Services: Security Services,,0,,0
11519136,ENIGMA FACILITIES MANAGEMENT LTD,88,2533498,4.916,4.916,,Medium,08/15/2018 00:00:00,,enigma-ltd.com,ME14 1PS,Business Support Services,Business Support Services: Security Services,,0,,0
06256238,CAR CALL (U.K.) LTD,45,1759222,0.218,0.218,,Small,05/23/2007 00:00:00,Car call provide accident assistance for drivers involved in non-fault road accidents as an alternative to a claim on a vehicle insurance policy.,carcalluk.com,PO7 7SE,Legal Services,Legal Services: Injury,,0,,0
10649496,MKS GROUNDCARE LTD,24,845152,0.274,0.274,,Small,03/02/2017 00:00:00,Mks groundcare ltd offers a range of grounds maintenance services to customers across the east midlands & surrounding areas - find out more,mksgroundcare.com,DN21 5TJ,Business Support Services,Business Support Services: Landscaping and Cleaning Services,,0,,0
12043598,TALENTSHED GROUP LTD,29,1049880,0.372,0.372,,Small,06/11/2019 00:00:00,"Talentshed, recruitment done differently.",talentshed.co.uk,TR4 9LF,Business Support Services,Business Support Services: Employment and Recruitment Services,,0,,0
08387618,ADVANCED DEEP CLEAN LIMITED,33,1322396,0.446,0.446,,Small,02/04/2013 00:00:00,"Our expert bolton cleaners provide services to homes, schools, offices, kitchens and many more domestic and commercial properties. we have over 13 years experience of cleaning bolton and surrounding areas.",advanceddeepclean.co.uk,BL2 2JZ,Business Support Services,Business Support Services: Landscaping and Cleaning Services,,0,,0
11716362,ASTON COMMERCIAL CLEANING LTD,106,1693996,0.537,0.537,,Medium,12/07/2018 00:00:00,Aston commercial cleaning ltd - a fresh approach to cleaning. professional contract cleaning,astonclean.co.uk,HP22 5JY,Business Support Services,Business Support Services: Landscaping and Cleaning Services,,0,,1
11426885,CURTIS LAW SOLICITORS LIMITED,93,5387547,0.749,0.749,,Medium,06/21/2018 00:00:00,"We are one of the uk's most accomplished and rapidly expanding law firms. we specialise in domestic & commercial cases, in manchester, blackburn & lancashire.",curtislaw.co.uk,BB1 2QE,Legal Services,"Legal Services: Injury, Legal Services: General, Legal Services: Consumer or Trading issues",,0,,1
03916451,RADIANT FINANCIAL PLANNING LIMITED,235,4593525,0.359,0.359,,Medium,01/31/2000 00:00:00,"Radiant financial planning is an independently owned, award winning group of companies, our financial planners specialise in financial planning for life.",radiantfinancial.co.uk,LE16 7QU,Legal Services,Legal Services: Tax & Finance,,0,2020-11-01,0
08610400,ALSTERS KELLEY SOLICITORS LIMITED,80,4650295,-0.036,-0.036,,Medium,07/15/2013 00:00:00,"At alsters kelley solicitors, we provide quality legal advice in a straightforward and practical manner to people in coventry, leamington spa, nuneaton, southam and stratford-upon-avon.",alsterskelley.com,CV32 4LY,Legal Services,"Legal Services: Wills, trusts, probate and estate administration, Legal Services: Family",,0,,1
11961009,LCWM LIMITED,105,62691,2.24,2.24,,Medium,04/24/2019 00:00:00,"Car hire hebrides specialise in providing brand new, high-quality car and van rental throughout the outer hebrides. we have branches conveniently located at stornoway airport, stornoway ferry terminal, tarbert, and benbecula airport. book online today!",carhire-hebrides.co.uk,NW2 6QT,Business Support Services,Business Support Services: Vehicle Rental Services,,0,,0
10632568,MARINE PEOPLE LIMITED,27,756508,0.297,0.297,,Small,02/22/2017 00:00:00,International shipbuilding recruitment specialists connecting highly skilled maritime talent with specialist shipbuilders learn more search for your new maritime career today search by title or keywords: international shipbuilding recruitment specialists connecting highly skilled maritime talent with specialist shipbuilders search jobs we are marine people for over 20 years we have been successfully connecting highly skilled […],marinepeople.com,PO15 5TH,"Marine and Maritime, Business Support Services","Marine and Maritime: Professional services, Business Support Services: Employment and Recruitment Services",,0,,1
03901757,1-1 RECRUITMENT LIMITED,482,0,3.01,3.01,,Large,01/04/2000 00:00:00,"Hiring in pharmaceutical, healthcare, animal health and nursing & clinical.",1-1recruitment.co.uk,SO53 3TY,Business Support Services,Business Support Services: Employment and Recruitment Services,,0,,0
10810157,HENNAH HAYWOOD LAW LTD,153,3016211,0.545,0.545,,Medium,06/08/2017 00:00:00,,hh-law.uk,NP20 4PB,Legal Services,"Legal Services: General, Legal Services: Family, Legal Services: Divorce",,0,,0
05731764,MOBIUS INDUSTRIES LIMITED,62,2916233,0.256,0.256,,Medium,03/06/2006 00:00:00,"Mobius is a pr, marketing, distribution and printing agency for the performing arts and entertainment, with a specialism in theatre, comedy, film and dance, working in london off west end, touring and the edinburgh fringe. mobius has a wide range of marketing and pr consultancy clients including lift festival, shubbak, sherman theatre, fever pitch, fuel theatre, china plate, 1927, john agard, rashdash, protein, how to win against history, camden people’s theatre, theatre ad infinitum, leicester square theatre, bloomsbury theatre, shit faced shakespeare, rose bruford college, mark thomas, complicite, lift and more.",mobiusindustries.com,WC1A 2HR,"Business Support Services, Digital Creative Industries, Agency Market","Business Support Services: Office Support Services, Digital Creative Industries: Visual and Performing arts, Agency Market: Public Relations",,0,,0
12132545,TOWER STREET FINANCE LIMITED,38,1445017,0.453,0.453,,Small,07/31/2019 00:00:00,"Access inheritance sooner with our unique no-risk products for beneficiaries & executors, to help them while waiting for the probate process.",towerstreetfinance.co.uk,HG1 1HS,Legal Services,"Legal Services: Wills, trusts, probate and estate administration",,50,2024-05-01,0
10905289,QUICK FORCE LIMITED,52,12188,0.719,0.719,,Medium,08/08/2017 00:00:00,,quickforcelimited.com,SM4 5BT,Business Support Services,Business Support Services: Security Services,,0,,0
06476067,LABORATORY SOLUTIONS RECRUITMENT LTD,192,15563745,0.867,0.867,,Medium,01/17/2008 00:00:00,We are specialists in scientific and engineering recruitment with client companies uk wide,lab-sol.co.uk,HP4 1EF,Business Support Services,Business Support Services: Employment and Recruitment Services,,0,,1
09960870,LAURUS LAW LIMITED,113,6589637,0.331,0.331,,Medium,01/20/2016 00:00:00,"Make your next property move, look after your family and protect your assets for the future – all in one place. we are here to de-stress your legal life by placing our expertise at your fingertips, exactly when you need it.",lauruslaw.co.uk,EC3A 7LP,Legal Services,"Legal Services: Wills, trusts, probate and estate administration, Legal Services: Family",,0,,0
10267076,TRINITY HARPER CLEANING LTD,206,3277128,0.558,0.558,,Medium,07/07/2016 00:00:00,"Providing high standard commercial and domestic cleaning services in cambridge. offering a range of services for home, office and other industries",trinityharpercleaning.co.uk,CB4 1TG,Business Support Services,Business Support Services: Landscaping and Cleaning Services,,0,,1
09189773,CONSUMER DISPUTE RESOLUTION LIMITED,60,611285,0.458,0.458,,Medium,08/28/2014 00:00:00,Retailadr specialises in resolving consumer and retail complaints. retailadr can help with retail or shop disputes online or in-store. retailadr can also help with furniture complaints. contact us today for more information about retail complaints and disputes.,retailadr.org.uk,MK12 5TW,Legal Services,Legal Services: Consumer or Trading issues,,0,,0
11852618,CJ CLEANING SERVICES (OXFORD) LTD,30,482946,0.231,0.231,,Small,02/28/2019 00:00:00,Cj cleaning provides professional end of tenancy and commercial cleaning services in oxford and the surrounding area.,cjcleaninglimited.co.uk,OX28 4BE,Business Support Services,Business Support Services: Landscaping and Cleaning Services,,0,,0
10230715,SUZIE'S DEEDS CLEANERS LIMITED,68,1092639,0.435,0.435,,Medium,06/14/2016 00:00:00,"Commercial cleaners sheffield reliable professional highly trained staff, police-checked staff reasonable prices office cleans house cleaning communal buildings",suziesdeedscleaners.com,S26 4QA,Business Support Services,Business Support Services: Landscaping and Cleaning Services,,0,,1
06279690,NORTON JONES GROUP LIMITED,612,0,0.319,0.319,,Large,06/14/2007 00:00:00,"Norton jones group - commercial cleaning companies, flood repair water ingress solutions, commercial cleaning services",nortonjones.com,MK11 3JB,Business Support Services,Business Support Services: Landscaping and Cleaning Services,,0,,0
10365255,THE OPPORTUNITY GROUP LTD,82,3006218,1.319,1.319,,Medium,09/08/2016 00:00:00,"Emerald publishing is one of the world's leading digital-first publishers, commissioning, curating and showcasing research that can make a real difference.",emeraldgrouppublishing.com,NN1 5JF,"Media and Publishing, Research and Consulting - Physical Sciences and Engineering","Media and Publishing: Publishing Services, Research and Consulting - Physical Sciences and Engineering: Physical Sciences Research",,0,,0
07136902,THE WILL ASSOCIATES ASSET MANAGEMENT LTD,33,554512,0.252,0.252,,Small,01/26/2010 00:00:00,"Find out why you need to get a will, a trust and an lpa now. pete m - i recently had a living trust made and i'm glad i did. two weeks later my wife...",willassociates.co.uk,TF9 1PH,Legal Services,"Legal Services: Wills, trusts, probate and estate administration",,0,,0
SC595386,THOMAS BRADLEY & CO (SCOTLAND) LTD,43,5771313,0.342,0.342,,Small,04/25/2018 00:00:00,"We’ll help you sort your will, power of attorney, trusts, funeral plan and everything in-between - so you can focus on enjoying your life.",thomasbradleylegal.co.uk,G74 4LY,Legal Services,"Legal Services: Wills, trusts, probate and estate administration",,0,,0
07654907,THOMAS PLANT HIRE LIMITED,430,67845109,3.0095,5.767,0.252,Large,06/01/2011 00:00:00,"Established in 2000, thomas plant hire provide outstanding customer service built on years of industry experience and product knowledge. our specialist delivery and support teams operate 24 hours a day, 7 days a week nationwide.",thomasplanthire.co.uk,CH7 5BL,Business Support Services,Business Support Services: Machinery Rental Services,,0,,0
07792598,DISTRICT WINDOWS & OFFICE CLEANING SERVICES LIMITED,21,1018445,0.29500000000000004,0.186,0.404,Small,09/30/2011 00:00:00,,districtcleaning.co.uk,AL5 2JD,Business Support Services,Business Support Services: Landscaping and Cleaning Services,,0,,0
08303712,INDEX L.P LIMITED,42,3142491,0.547,0.547,,Small,11/22/2012 00:00:00,,ion-search.com,L3 9LQ,Business Support Services,Business Support Services: Employment and Recruitment Services,,0,,0
06000601,VENTURE SECURITY MANAGEMENT LIMITED,103,2970563,0.207,0.207,,Medium,11/16/2006 00:00:00,"Corporate, residential and event security services company, providing security solutions across hampshire, wiltshire, berkshire, surrey and dorset.",venturesec.co.uk,SP10 5NY,Business Support Services,Business Support Services: Security Services,,0,,0
01880826,CHAMPION EMPLOYMENT LIMITED,1850,11101350,1.2575,2.615,-0.1,Large,01/28/1985 00:00:00,"The champion group. expertise to deliver a recruitment service for clients and candidates alike which is professional, flexible and tailor made to suitable individual needs",www.champion.co.uk,PR9 0JP,Business Support Services,Business Support Services: Employment and Recruitment Services,,0,,0
10806895,CHIC CLEANING SERVICES LIMITED,43,679405,0.254,0.254,,Small,06/07/2017 00:00:00,,chic-cleaning.co.uk,S43 4TD,Business Support Services,Business Support Services: Landscaping and Cleaning Services,,0,,1
11814003,AMPLA FINANCE HOLDINGS LIMITED,20,4212500,1.7349999999999999,0.256,3.214,Small,02/07/2019 00:00:00,"Ampla finance covers legal costs for a range of legal proceedings, including divorce, contentious probate and other civil litigation.",ampla.finance,WC1V 7PB,Legal Services,"Legal Services: Wills, trusts, probate and estate administration, Legal Services: Family, Legal Services: Divorce",,0,,0
09634781,AQUEOUS MANAGEMENT LIMITED,26,6654054,0.20850000000000002,0.165,0.252,Small,06/11/2015 00:00:00,,aqueousuw.com,E14 5HU,Legal Services,Legal Services: Consumer or Trading issues,,0,,0
09182402,FUTURE RECRUITS (MIDLANDS) LIMITED,23,645280,0.205,0.205,,Small,08/19/2014 00:00:00,,futurerecruits.co.uk,B11 2AA,Business Support Services,Business Support Services: Employment and Recruitment Services,,0,,1
04441318,NIGEL THOMAS PLANT HIRE LIMITED,33,2924539,0.23,0.23,,Small,05/17/2002 00:00:00,"Established in 2000, thomas plant hire provide outstanding customer service built on years of industry experience and product knowledge. our specialist delivery and support teams operate 24 hours a day, 7 days a week nationwide.",thomasplanthire.co.uk,SA6 6NX,Business Support Services,Business Support Services: Machinery Rental Services,,0,,0
10319630,JOB SOLUTIONS LTD,311,12296370,0.414,0.414,,Large,08/09/2016 00:00:00,,job-solutions.co.uk,TA6 3BW,Business Support Services,Business Support Services: Employment and Recruitment Services,,0,,0
08856339,BRILLIANT COMMERCIAL & INDUSTRIAL CLEANING GROUP LTD,77,0,0.202,0.202,,Medium,01/22/2014 00:00:00,"Brilliant hygiene services ltd provide commercial and industrial cleaning services spanning accross the midlands. our award wininng services include office cleaning, carpet cleaning, industrial deep cleans and grounds maintenance services. click on brilliantnow.co.uk to see how we can help your business.",brilliantnow.co.uk,DE65 5UA,Business Support Services,Business Support Services: Landscaping and Cleaning Services,,0,,0
11464329,JAY SECURITY & EVENTS LTD,80,2316341,1.297,1.297,,Medium,07/13/2018 00:00:00,"Security services for businesses & events “the primary objective of jay security & events limited is the protection of life, the protection of property & premises, the prevention of loss and waste and the prevention and deterring of crime. we will endeavour to implement our quality objectives in our goal to offer the best service […]",jaysecurityandevents.co.uk,CV11 6RX,Business Support Services,Business Support Services: Security Services,,0,,0
03922690,LEXUS SECURITY MANAGEMENT LIMITED,24,680515,0.212,0.212,,Small,02/09/2000 00:00:00,Lexus security provide security services & equipment's in london and throughout the uk. our security staff are sia trained & offer a service second to none,lexussecurity.com,EC2A 4NE,Business Support Services,Business Support Services: Security Services,,0,,0
10289430,PRIME RECRUITMENT LIMITED,52,4227460,0.473,0.473,,Medium,07/21/2016 00:00:00,Recruitment agency for temporary staffing. variety of jobs from healthcare to cleaning.,prime-recruitmentltd.com,BN21 4RU,Business Support Services,Business Support Services: Employment and Recruitment Services,,0,,0
05538981,EXECUTIVE SECURITY SOLUTIONS LIMITED,41,1175254,0.353,0.353,,Small,08/17/2005 00:00:00,We provide bespoke risk and cost mitigation security services to private & commercial clients. choose a security partner with a proven track record!,executivesecuritysolutions.co.uk,NN11 0QB,Business Support Services,Business Support Services: Security Services,,0,,0
