Companynumber,Companyname,BestEstimateCurrentEmployees,BestEstimateCurrentTurnover,BestEstimateGrowthPercentagePerYear,BestEstimateEmployeeGrowthPercentagePerYear,BestEstimateTurnoverGrowthPercentagePerYear,CompanyGrowthStage,SortableIncorporationDate,Description,URLs,Registeredpostcode,RTICs,RTICsubsectors,TotalInnovateUKFunding,TotalDealroomFundingMillionPounds,LastKnownDealroomFunding,WomenFounded
07582523,AFE RECRUITMENT LIMITED,32,2593341,0.205,0.205,,Small,03/29/2011 00:00:00,"Temporary and permanent staffing solutions for many industries including transport and logistics, warehousing and building and construction.",aferecruitment.co.uk,EN6 1AQ,Business Support Services,Business Support Services: Employment and Recruitment Services,,0,,0
05897519,DYNAMIC RESOURCING SERVICES LIMITED,57,4287354,0.276,0.276,,Medium,08/07/2006 00:00:00,,dynamicresourcing.co.uk,SL1 7JP,Business Support Services,Business Support Services: Employment and Recruitment Services,,0,,1
06514001,ECO PERSONNEL (UK) LIMITED,69,1822416,0.309,0.309,,Medium,02/26/2008 00:00:00,"If you are looking to recruit people for your business, then eco personnel can provide high levels of recruitment and selection services for companies in the mansfield and nottingham area",ecopersonnel.co.uk,NG18 2AH,Business Support Services,Business Support Services: Employment and Recruitment Services,,0,,1
07915403,TOMASZDYL PR LTD,85,601539,0.614,0.614,,Medium,01/19/2012 00:00:00,Gottabe! ethnic are an ethnic marketing agency that specialise in multicultural marketing campaigns and helping companies target ethnic minorities.,gottabeethnic.co.uk,SO15 2FE,"Business Support Services, Digital Creative Industries","Business Support Services: Office Support Services, Digital Creative Industries: Advertising",,0,,0
05692701,BESPOKE COMMERCIAL CLEANING SERVICES LTD,22,335975,0.293,0.293,,Small,01/31/2006 00:00:00,Bespoke cleaning services ltd,bespokecleaning.co.uk,SK8 3QG,Business Support Services,Business Support Services: Landscaping and Cleaning Services,,0,,0
09502646,DAYTIME HEALTHCARE RECRUITMENT LIMITED,40,3043595,0.202,0.202,,Small,03/20/2015 00:00:00,"At daytime healthcare, our nurses break the mould by preferring to work the day shifts. we provide a 24 hour service with an emphasis on making sure that our clients have adequate staffing on the day shift.",daytimehealthcare.com,SW19 1QT,Business Support Services,Business Support Services: Employment and Recruitment Services,,0,,0
11498417,WEST HILL GARDEN & LANDSCAPING SERVICES LTD,21,714657,0.211,0.211,,Small,08/03/2018 00:00:00,"West hill garden & landscaping services offer a range of landscaping & garden services across somerset from trained, experienced and skilled team members.",westhillgardenservices.co.uk,BA5 1EY,Business Support Services,Business Support Services: Landscaping and Cleaning Services,,0,,1
03880628,CONFLICT MANAGEMENT PLUS LIMITED,35,1276179,0.208,0.208,,Small,11/19/1999 00:00:00,"Cmp have over 30 years’ experience in helping businesses manage conflict at work. we build stronger relationships for a happier, more productive workplace.",cmpsolutions.com,SG8 5NT,Legal Services,Legal Services: Employment,,0,,1
08607020,CORE PEOPLE LTD,98,21192114,0.8705,1.647,0.094,Medium,07/12/2013 00:00:00,"Embedded in the construction industry for more than twenty five years, corepeople has become the market leader for provision of staff across three core sectors; civil engineering, building and housing. our solid history and close connections with organisations in these arenas means we have a matured experience of industry activities and a well-developed, responsible approach... read more »",corepeople.com,GU5 9QE,Business Support Services,Business Support Services: Employment and Recruitment Services,,0,,0
08803952,UK RECRUITING LIMITED,20,3043240,0.206,0.206,,Small,12/05/2013 00:00:00,"Ukr work as top construction recruitment agencies in london for providing job solution in construction, civil engineering, rail & utilities and logistic management. visit us to know more.",ukrgroup.co.uk,W4 4AU,Business Support Services,Business Support Services: Employment and Recruitment Services,,0,,0
10257462,URBAN INITIATIVES LIMITED,29,2042723,0.262,0.262,,Small,06/29/2016 00:00:00,West of borough strategic concept london borough of hounslow grays town centre framework thurrock council the talbot projects the talbot villages principals board dublin docklands dublin docklands development corporation camden character study london borough of camden urban initiatives studio is an award winning urban design and planning consultancy. we are passionate about places and people […],uistudio.co.uk,NR6 6BB,Research and Consulting - Physical Sciences and Engineering,Research and Consulting - Physical Sciences and Engineering: Architectural Research,,0,,0
07211128,PRS RECRUITMENT SOLUTIONS LIMITED,625,0,0.995,0.995,,Large,04/01/2010 00:00:00,"Prs recruitment | leading multi-sector recruiter, specialising in: facilities management, industrial, hospitality, mechanical engineering, trades & labou...",prsjobs.com,CR0 0YN,Business Support Services,Business Support Services: Employment and Recruitment Services,,0,,0
04921416,HYDRO WASH LIMITED,46,6080857,0.301,0.301,,Small,10/03/2003 00:00:00,"Hydrowash provide professional commercial bin cleaning services to businesses, local authorities, nhs and the catering & hospitality industry.",hydrowash.co.uk,BD4 9AW,Business Support Services,Business Support Services: Landscaping and Cleaning Services,,0,,0
11154476,BLUE BREEZE CLEANING LIMITED,37,593932,0.273,0.273,,Small,01/17/2018 00:00:00,Professional and reliable office and commercial cleaning services in cardiff. delivering quality cleaning services in cardiff and its area.,blue-breeze.co.uk,CF11 9LJ,Business Support Services,Business Support Services: Landscaping and Cleaning Services,,0,,1
11876722,THE IMMACULATE GROUP SW LTD,45,3355072,0.574,0.574,,Small,03/12/2019 00:00:00,The immaculate group offers a range of specialist cleaning services in cornwall & devon including covid cleaning & commercial cleaning.,theimmaculategroup.uk,PL14 5QG,Business Support Services,Business Support Services: Landscaping and Cleaning Services,,0,,1
09663858,SMARTHEART PROFESSIONALS LIMITED,18,1563993,0.205,0.205,,Small,06/30/2015 00:00:00,"Specialist healthcare staffing solutions, including overseas nurse recruitment, temporary and permanent staffing. catering to private clients since 2015.",smartheartpro.co.uk,RH6 9NQ,Business Support Services,Business Support Services: Employment and Recruitment Services,,0,,1
09290624,START PEOPLE LIMITED,1319,0,0.507,0.507,,Large,10/31/2014 00:00:00,"Start people is a group of passionate recruiters who deliver a broad range of talent and labour solutions across the manufacturing, engineering and automotive industries.",startpeopleltd.co.uk,DH7 8PN,Business Support Services,Business Support Services: Employment and Recruitment Services,,0,,1
07321069,CHILWORTH PARTNERSHIP LTD,43,1192464,0.301,0.301,,Small,07/21/2010 00:00:00,,chilworthpartnership.co.uk,SO16 7QJ,Business Support Services,Business Support Services: Employment and Recruitment Services,,0,,0
SC423054,DASAN SOLUTIONS LIMITED,56,1193069,0.344,0.344,,Medium,04/30/2012 00:00:00,"Dsl grounds maintenance & landscaping, based in stornoway, isle of lewis, is a supplier of quality commercial and domestic horticultural services throughout the outer hebrides.",dslgroundsandgardens.co.uk,HS1 2JF,Business Support Services,Business Support Services: Landscaping and Cleaning Services,,0,,0
09732988,MAINSTAY RECRUITMENT SOLUTIONS LTD,59,4815588,0.561,0.561,,Medium,08/14/2015 00:00:00,"Providing expert support for your recruitment needs. here at mainstay recruitment, ensuring we find you the best talent is our priority.",mainstayrecruitment.co.uk,WS4 2LA,Business Support Services,Business Support Services: Employment and Recruitment Services,,0,,0
04083397,TWENTY FOUR SEVEN RECRUITMENT SERVICES LIMITED,7370,70999818,0.3565,0.771,-0.058,Large,10/04/2000 00:00:00,"Recruitment agency, 24-7,job portal,job",24-7recruitment.net,LL13 9UG,Business Support Services,Business Support Services: Employment and Recruitment Services,,0,,0
11625769,ARCHWAY GREEN LTD,248,8591715,0.726,0.726,,Medium,10/16/2018 00:00:00,,archwaygreen.co.uk,PO20 2FR,Business Support Services,Business Support Services: Landscaping and Cleaning Services,,0,,0
00381534,BOSTONAIR LIMITED,178,37616938,0.265,0.179,0.351,Large,07/05/1943 00:00:00,"Welcome to bostonair. our services span three key areas in the aviation industry and several key areas in the energy industry. we provide recruitment, line maintenance and technical training services to the aviation industry.",bostonair.co.uk,HU17 9ET,Business Support Services,Business Support Services: Employment and Recruitment Services,,0,,0
09183113,360 COMMERCIAL CLEANING SERVICES LIMITED,95,1506443,0.389,0.389,,Medium,08/20/2014 00:00:00,,360commercialcleaning.co.uk,NG17 2HU,Business Support Services,Business Support Services: Landscaping and Cleaning Services,,0,,1
07378820,FEEL THE SPARKLE LTD.,56,899777,0.295,0.295,,Medium,09/16/2010 00:00:00,"Based in southampton, feel the sparkle pride ourselves on providing a professional cleaning service for the domestic sector, whether that is a regular clean, a one off clean, holiday lets cleans or ironing and laundry.",feelthesparkle.co.uk,SO30 3DR,Business Support Services,Business Support Services: Landscaping and Cleaning Services,,0,,0
05634887,THE WORK SHOP RESOURCING LIMITED,94,2598490,0.155,0.155,,Medium,11/24/2005 00:00:00,"We are “recruiters who care”! we know that’s an easy thing to say but we do and we would like to prove to you, whether you are a client looking for staff or a job seeker looking for your next step, that we are not like pretty much any other recruitment agency you have spoken […]",thework-shop.co.uk,BH24 1DY,Business Support Services,Business Support Services: Employment and Recruitment Services,,0,,1
SC451687,PERFECT CLEAN EDINBURGH LTD,134,2140137,0.257,0.257,,Medium,06/05/2013 00:00:00,We’re an expert commercial cleaning team in scotland. we clean almost everything with a goal to deliver high-quality cleaning services at affordable rates.,perfectcleanltd.co.uk,EH25 9RE,Business Support Services,Business Support Services: Landscaping and Cleaning Services,,0,,1
06263326,FIRST RESPONSE GROUP LTD,745,72111800,0.345,0.293,0.397,Large,05/30/2007 00:00:00,We are a leading security services company offering a full range of comprehensive security solutions including cctv and manned security guards.,firstresponsegroup.com,LS7 3JB,Business Support Services,Business Support Services: Security Services,,0,,0
08924622,VENATU CONSULTING LTD,122,9931160,0.257,0.257,,Medium,03/05/2014 00:00:00,"Independent recruitment specialists with offices in doncaster & leeds, for recruitment with a difference call us to see how we can help you",venatu.co.uk,DN4 5NU,Business Support Services,Business Support Services: Employment and Recruitment Services,,0,,0
07869826,ASSETWATCH LTD,50,1445431,0.269,0.269,,Small,12/02/2011 00:00:00,"Looking for uk security services from a leading uk security company? comprised of highly trained ex-military personnel, private security professionals and health and safety experts, assetwatch provides uk security services at the highest standard at a reasonable cost.",assetwatchltd.co.uk,NE63 8UJ,Business Support Services,Business Support Services: Security Services,,0,,1
08047449,DAMSONS ESTATE ADMINISTRATION LIMITED,25,1000000,0.826,0.826,,Small,04/26/2012 00:00:00,"Whether you need a will, a funeral plan, estate administration, a trust or a lasting power of attorney, we have a service to help you.",registereddocuments.co.uk,PR7 5PA,Legal Services,"Legal Services: Wills, trusts, probate and estate administration",,0,,0
02322815,WHITE KNIGHT RECRUITMENT LIMITED,1148,0,6.575,6.575,,Large,11/29/1988 00:00:00,"Welcome to white knight recruitment, where our job is finding your next great job in health & social care and the nhs.",whiteknightrecruitment.com,SO53 3TY,Business Support Services,Business Support Services: Employment and Recruitment Services,,0,,0
07158432,UNIVERSAL SECURITY GUARDS (GB) LTD,102,2948899,0.616,0.616,,Medium,02/16/2010 00:00:00,,universalsecurityguards.co.uk,M22 4JT,Business Support Services,Business Support Services: Security Services,,0,,0
06746739,ESIFT LIMITED,57,1586841,0.38,0.38,,Medium,11/11/2008 00:00:00,"Hello we are esift. for over 13 years, we've been pioneering agile recruitment solutions that put you in control. we are the recruitment business that thinks differently, working in partnership with aspiring tech companies and established commercial businesses.",esift.co.uk,GU14 7NA,Business Support Services,Business Support Services: Employment and Recruitment Services,,0,,0
NI638479,PULSE SECURITY MANAGEMENT LTD,120,3474512,0.771,0.771,,Medium,05/16/2016 00:00:00,"Pulse security offer you a wide range of security services for events and corporates throughout ireland and northern ireland, learn more now.",pulsesecurity.ie,BT48 0LY,Business Support Services,Business Support Services: Security Services,,0,,0
11524609,ALBANY BECK WORLDWIDE LIMITED,342,37095652,1.7205,1.89,1.551,Large,08/20/2018 00:00:00,"Interquest group’s human capital management business is an award-winning specialist staffing, executive search and talent solutions provider.",interquestgroup.com,HP4 2DF,Business Support Services,Business Support Services: Employment and Recruitment Services,,0,,0
10276870,BELMONT RECRUITMENT LIMITED,31,2299992,0.341,0.341,,Small,07/13/2016 00:00:00,,belmontrecruitment.co.uk,PR2 2XU,"Business Support Services, Life Sciences","Business Support Services: Employment and Recruitment Services, Life Sciences: Human Health Services",,0,,0
OC310031,BMS PROGRESS LLP,35,0,0.254,0.254,,Small,11/17/2004 00:00:00,"Bms performance is a recruitment agency for sales, marketing, engineering & it professionals. visit us for the latest jobs, recruitment services & training",bmsperformance.com,WA5 7XR,Business Support Services,Business Support Services: Employment and Recruitment Services,,0,,0
08693584,MONARCH SOLICITORS LTD,49,2857791,0.495,0.495,,Small,09/17/2013 00:00:00,Monarch solicitors are a leading law firm and solicitors in manchester and london providing expert legal advice & assistance.,monarchsolicitors.com,M3 6BF,Legal Services,"Legal Services: General, Legal Services: Business Structure and Regulation Advice",,0,,1
07037768,RED CHILLI RECRUITMENT LIMITED,83,6743836,1.13,1.13,,Medium,10/12/2009 00:00:00,"Red chilli recruitment specialises in engineering, technical and commercial roles across the south coast and uk wide. contact us today on 023 8084 8475.",redchillirecruitment.com,SO45 6EB,Business Support Services,Business Support Services: Employment and Recruitment Services,,0,,1
10755389,RICKLEAN LTD,75,1195125,0.369,0.369,,Medium,05/05/2017 00:00:00,,ricklean.com,N20 0RA,Business Support Services,Business Support Services: Landscaping and Cleaning Services,,0,,1
05330604,ARCADIAN LIVING LIMITED,90,1447110,0.342,0.342,,Medium,01/12/2005 00:00:00,,arcadianliving.co.uk,EC2Y 5AU,Business Support Services,Business Support Services: Landscaping and Cleaning Services,,0,,1
SC312103,CONTACT SECURITY SERVICES  LIMITED,18,1181453,0.21,0.21,,Small,11/17/2006 00:00:00,"The uk's highest rated security company. burglar alarm systems, cctv systems, access and fire control systems installed all over scotland. unbeatable value.",contactsecurityservices.co.uk,ML6 6GX,Business Support Services,Business Support Services: Security Services,,0,,0
04546820,SANDERSON GOVERNMENT AND DEFENCE LIMITED,67,74371285,0.21000000000000002,0.218,0.202,Large,09/26/2002 00:00:00,"We're partners. by taking the time to really understand your needs, we find you exactly what you're looking for, time after time.",sandersonplc.com,BS8 2NH,Business Support Services,Business Support Services: Employment and Recruitment Services,,0,,0
10729748,COUNTING LTD,124,9309846,0.528,0.528,,Medium,04/19/2017 00:00:00,Save time and money by automating your accounting with trustpilot's most highly rated business current account.,countingup.com,N1 7GU,"FinTech, Legal Services","FinTech: Digital Payments, FinTech: Tech for Enterprise, FinTech: Digital Banks, Legal Services: Business Structure and Regulation Advice",,0,,0
05620693,BRIDGEHOUSE COMPANY SECRETARIES LIMITED,29,2180423,0.39,0.39,,Small,11/11/2005 00:00:00,"Governance is our passion! our knowledgeable and experienced team of qualified lawyers and chartered company secretaries work in partnership with businesses in all sectors, providing valuable support.",bhcsecretaries.co.uk,EC4V 4EG,Legal Services,Legal Services: Business Structure and Regulation Advice,,0,,1
11994824,BELL CLEANING SERVICES LTD,205,3266675,0.956,0.956,,Medium,05/14/2019 00:00:00,,bellcleaningservices.com,NP19 0HT,Business Support Services,Business Support Services: Landscaping and Cleaning Services,,0,,0
09961973,DORSET HIRE SERVICES LIMITED,22,1645360,0.294,0.294,,Small,01/21/2016 00:00:00,"We have a large range of tools, plant and equipment available to hire at low prices. open to both the trade and public.",dorsethire.co.uk,BA11 4RW,Business Support Services,Business Support Services: Machinery Rental Services,,0,,0
12209824,NOVUM PERSONNEL LTD,17,478174,0.076,0.076,,Small,09/16/2019 00:00:00,"Novum personnel are a middlesbrough based job recruitment agency, specialising in offering the very best candidates to businesses across the country.",novumpersonnel.com,HU1 2PS,Business Support Services,Business Support Services: Employment and Recruitment Services,,0,,0
05160876,COMPLETELY CARE RECRUITMENT CONSULTANTS LIMITED,37,1472762,0.332,0.332,,Small,06/23/2004 00:00:00,"Recruitment consultants based in oxfordshire, buckinghamshire, wiltshire and south wales. specialise in recruitment for the social care, child care, nursing, health care and education sectors - completely care",completelycare.co.uk,OX9 2DW,Business Support Services,Business Support Services: Employment and Recruitment Services,,0,,0
05077475,TONIC LIFE COMMUNICATIONS LIMITED,18,4038957,0.189,0.192,0.186,Small,03/18/2004 00:00:00,"Inizio is a strategic partner for health and life sciences with a full suite of medical, marketing, advisory and engagement services throughout the drug lifecycle.",inizio.health,WC2A 1AN,Research and Consulting - Physical Sciences and Engineering,Research and Consulting - Physical Sciences and Engineering: Physical Sciences Consulting,,0,2009-07-01,0
12177752,AMBER RESOURCING LIMITED,74,206000,0.573,0.573,,Medium,08/28/2019 00:00:00,"We're partners. by taking the time to really understand your needs, we find you exactly what you're looking for, time after time.",sandersonplc.com,BS8 2NH,Business Support Services,Business Support Services: Employment and Recruitment Services,,0,,0
10980984,COMPLEX RECRUITMENT LTD,29,1050974,0.254,0.254,,Small,09/26/2017 00:00:00,,complexrecruitment.co.uk,N18 2PG,Business Support Services,Business Support Services: Employment and Recruitment Services,,0,,0
08775425,CLEANING OPERATIONS UK LIMITED,285,4534570,0.247,0.247,,Large,11/14/2013 00:00:00,Builders clean,cleaningoperationsuk.com,SO31 7GA,Business Support Services,Business Support Services: Landscaping and Cleaning Services,,0,,1
09935685,PROFESSIONAL CANINE AND SECURITY LIMITED,23,658400,0.315,0.315,,Small,01/05/2016 00:00:00,,procands.co.uk,ME10 3HZ,Business Support Services,Business Support Services: Security Services,,0,,0
SC531039,INVICTA SCOTLAND LIMITED,29,1143973,0.268,0.268,,Small,03/30/2016 00:00:00,"Welcome to invicta exterior cleaning. delivering the highest standards of professional window cleaning & exterior cleaning in dundee, perth, pitlochry and covering scotland.",invictascotland.co.uk,DD2 3FU,Business Support Services,Business Support Services: Landscaping and Cleaning Services,,0,,0
09981110,ROWDEN TECHNOLOGIES LTD.,106,1044845,0.434,0.434,,Medium,02/01/2016 00:00:00,"Engineering innovation at pace, with purpose. solving complex government problems with advanced technology.",rowdentech.com,BS34 6FE,"Robotics and Autonomous systems, Research and Consulting - Physical Sciences and Engineering","Robotics and Autonomous systems: Energy: Oil Gas ,Grid & Other, Research and Consulting - Physical Sciences and Engineering: Engineering Research",,0.41,2019-04-01,0
11178019,EXEDE LTD,20,1521553,0.264,0.264,,Small,01/30/2018 00:00:00,,xede.co.uk,TR1 2SF,Business Support Services,Business Support Services: Employment and Recruitment Services,,0,,0
12487650,INIZIO GROUP LIMITED,19014,3226894532,0.764,0.7,0.828,Large,02/27/2020 00:00:00,"Inizio is a strategic partner for health and life sciences with a full suite of medical, marketing, advisory and engagement services throughout the drug lifecycle.",inizio.health,WC2A 1AN,Research and Consulting - Physical Sciences and Engineering,Research and Consulting - Physical Sciences and Engineering: Physical Sciences Consulting,,0,,0
07084219,FENKLEEN HYGIENE LTD,30,2374840,0.23,0.23,,Small,11/23/2009 00:00:00,With fully trained personnel and 25 years’ experience and expertise we are able to ensure […],fenkleen.com,PE30 2JG,Business Support Services,Business Support Services: Landscaping and Cleaning Services,,0,,1
09857523,FIRST RESPONSE HOLDINGS LIMITED,894,75253621,0.3925,0.382,0.403,Large,11/05/2015 00:00:00,We are a leading security services company offering a full range of comprehensive security solutions including cctv and manned security guards.,firstresponsegroup.com,LS7 3JB,Business Support Services,Business Support Services: Security Services,,0,,0
11260966,MINERVA ANALYTICS LIMITED,98,7391669,0.239,0.239,,Medium,03/16/2018 00:00:00,Minerva - manifest: over 25 years of excellence in proxy voting and esg data - where sustainability and customisation come as standard.,manifest.co.uk,CM8 2BL,ESG,ESG: ESG Consultants,,0,2023-01-01,1
10879272,AUTUMNA LIMITED,43,1634161,0.606,0.606,,Small,07/24/2017 00:00:00,"Find the right elderly care & retirement living options with free expert advice and the most detailed searchable directory of care homes, nursing homes, retirement homes, retirement villages, home care, & live-in care services in the uk.",development.autumna.org.uk,TN2 5ET,Legal Services,Legal Services: SEN,,0,,1
09906488,KINGSGUARD LEGAL LTD,29,1674723,0.386,0.386,,Small,12/08/2015 00:00:00,,kingsguardlegal.co.uk,N1 7GU,Legal Services,"Legal Services: Wills, trusts, probate and estate administration",,0,,0
10972051,MATRIX WORKPLACE SERVICES LTD,175,0,0.845,0.845,,Medium,09/20/2017 00:00:00,,matrixws.co.uk,CF35 5LJ,Business Support Services,Business Support Services: Landscaping and Cleaning Services,,0,,1
09573656,NECS (SCOT) LTD,45,721138,0.293,0.293,,Small,05/05/2015 00:00:00,"Necs is a leading uk provider of iso 9001, iso 14001, iso 45001, and bicsc certified commercial cleaning services and facility management.",necscleaning.co.uk,NE23 7BF,Business Support Services,Business Support Services: Landscaping and Cleaning Services,,0,,1
09521878,BOXTREE RECRUITMENT LTD,30,833250,0.448,0.448,,Small,04/01/2015 00:00:00,,boxtree-recruitment.co.uk,BL9 0ED,Business Support Services,Business Support Services: Employment and Recruitment Services,,0,,1
10068952,CANDOUR TALENT LIMITED,43,1199370,0.401,0.401,,Small,03/17/2016 00:00:00,,candourtalent.co.uk,NP23 5SD,Business Support Services,Business Support Services: Employment and Recruitment Services,,0,,0
10484468,TILE HILL INTERIM & EXECUTIVE LIMITED,58,1597062,1.151,1.151,,Medium,11/17/2016 00:00:00,Tile hill specialises in providing interim managers and executive search to help the public sector cope with business challenges and better deliver change an...,tile-hill.co.uk,SG6 9BL,Business Support Services,Business Support Services: Employment and Recruitment Services,,0,,0
06883988,PHIL FRANKLIN LANDSCAPES LTD,25,2215288,0.324,0.324,,Small,04/21/2009 00:00:00,"Phil franklin landscapes are an established maintenance and landscaping company based in waltham forest, london. we provide garden and grounds maintenance services to commercial and domestic clients in east london and the surrounding areas.",philfranklinlandscapes.com,E11 1JX,Business Support Services,Business Support Services: Landscaping and Cleaning Services,,0,,0
OC430032,MONAN GOZZETT LLP,25,0,0.291,0.291,,Small,12/17/2019 00:00:00,"Monan gozzett provides a unique service in crime, false allegation, defence, family, commercial, regulatory & private law. our expert team are your legal partners.",monangozzett.com,BN11 1QR,Legal Services,"Legal Services: Family, Legal Services: Divorce",,0,,1
11153103,PARALLEL SECURITY LIMITED,137,5429379,0.728,0.728,,Medium,01/16/2018 00:00:00,"Parallel security provides professional manned guarding, event security, mobile patrol, alarm response, door supervision, key holding, commercial cleaning, security training, temporary cctv and waking watch security services in north wales, cheshire, the north west and coventry for a wide range of organisations in the public and private sectors. asset protection",parallelsecurity.co.uk,CH7 1XP,Business Support Services,Business Support Services: Security Services,,0,,0
10318270,VENIAN RECRUITMENT LIMITED,27,2058877,0.355,0.355,,Small,08/08/2016 00:00:00,,venianrecruitment.co.uk,S11 9PS,Business Support Services,Business Support Services: Employment and Recruitment Services,,0,,0
12901745,ACORN CLEANING MANCHESTER LIMITED,38,609864,0.472,0.472,,Small,09/24/2020 00:00:00,"Acorn commercial cleaning services, cleaning contractors, manchester, washroom service, office cleaners, window cleaning, facilities cleaning",acorncleaningmanchester.co.uk,M24 6UQ,Business Support Services,Business Support Services: Landscaping and Cleaning Services,,0,,0
