Companynumber,Companyname,BestEstimateCurrentEmployees,BestEstimateCurrentTurnover,BestEstimateGrowthPercentagePerYear,BestEstimateEmployeeGrowthPercentagePerYear,BestEstimateTurnoverGrowthPercentagePerYear,CompanyGrowthStage,SortableIncorporationDate,Description,URLs,Registeredpostcode,RTICs,RTICsubsectors,TotalInnovateUKFunding,TotalDealroomFundingMillionPounds,LastKnownDealroomFunding,WomenFounded
09588207,EVEROZE PARTNERS LIMITED,191,17065269,0.439,0.439,,Medium,05/13/2015 00:00:00,,everoze.com,BS1 4ND,Net Zero,"Net Zero: Renewables, Net Zero: Renewable Energy Planning Database",0,0,2021-04-01,0
07450294,EVORA GLOBAL LIMITED,248,9018652,0.464,0.464,,Medium,11/24/2010 00:00:00,Evora global provides an exceptional level of sustainability consultancy and esg software to many of europe's leading firms.,evoraglobal.com,SE1 1TQ,"ESG, Net Zero","ESG: ESG Consultants, Net Zero: Low Carbon Consultancy, Advisory & Offsetting Services",,0,2022-10-01,0
05386932,GREEN ELEMENT LIMITED,58,186307,0.556,0.556,,Medium,03/09/2005 00:00:00,A forward-thinking environmental management consultancy helping organisations worldwide become sustainable business forces for the future.,greenelement.co.uk,PE27 5BH,"ESG, Life Sciences, Net Zero","ESG: ESG Consultants, Life Sciences: Environmental Sciences Products and Services, Net Zero: Low Carbon Consultancy, Advisory & Offsetting Services, Net Zero: Green Finance",,0,,0
09067185,EDEN SUSTAINABLE LTD,43,1809213,0.525,0.525,,Small,06/02/2014 00:00:00,Eden sustainable are solar rooftop experts providing market leading solutions to save your organisation money and carbon. zero capital solutions reducing your electricity rates by up to 35%.,edensustainable.co.uk,EC4R 1BB,"Net Zero, Energy Generation","Net Zero: Renewable Energy Planning Database, Energy Generation: Solar",,75,2024-04-01,0
09444791,BLINK CHARGING HOLDINGS UK LIMITED,122,11004107,1.0295,0.709,1.35,Medium,02/17/2015 00:00:00,"We’re a leading, independently-owned provider of electric vehicle charging and sustainable energy solutions and technologies.",www.ebcharging.co.uk,AL1 3AW,Net Zero,Net Zero: Low Emission Vehicles,80123,0,,0
11549836,TAE POWER SOLUTIONS ENGINEERING LIMITED,210,10811850,1.098,1.098,,Medium,09/03/2018 00:00:00,"Redefining low-carbon technologies through innovation - “at sprint power, we aspire to be a global technology company recognised for its innovative thinking in creating a better future. we strive to help forward-thinking entrepreneurs and companies take the lead in industry disruption, rather than be led by it.”",sprint-power.com,SN3 3LL,Energy Storage,Energy Storage: Batteries,6695583.390000001,0,2021-08-01,0
09002413,MER FLEET SERVICES LIMITED,175,10843762,0.5265,0.582,0.471,Medium,04/17/2014 00:00:00,Mer provides electric car charging for businesses and public spaces. we are proud to be one of the most sustainable choices for ev charging.,uk.mer.eco,EC2N 4BQ,Net Zero,Net Zero: Low Emission Vehicles,285557,1.5,2022-01-01,0
08305253,POWER ROLL LIMITED,47,50000,0.266,0.266,,Small,11/23/2012 00:00:00,"Power roll has reinvented solar to generate energy anywhere and everywhere, using any surface.",powerroll.solar,SR5 3NZ,"Digital Creative Industries, Net Zero, Energy Generation","Digital Creative Industries: Film/TV, Net Zero: Renewables, Net Zero: Renewable Energy Planning Database, Energy Generation: Solar",2418796.99,19.21,2023-07-01,0
11978158,INNOVA RENEWABLES DEVELOPMENTS LIMITED,62,8016902,1.537,0.857,2.217,Medium,05/03/2019 00:00:00,,novus-rs.co.uk,GL50 3LG,"CleanTech, Net Zero, Energy Generation","CleanTech: Energy Production, Management and Storage, Net Zero: Low Carbon Energy Generation, Net Zero: Renewables, Net Zero: Renewable Energy Planning Database, Energy Generation: Solar",,0,,0
10501719,MOLTEX ENERGY LIMITED,53,4190202,0.6940000000000001,0.462,0.926,Medium,11/29/2016 00:00:00,"We have the technology to transform the energy landscape, ushering in a new age of clean, low-cost energy for all. our design is smaller, simpler and inherently safe, making it low-cost to build and operate. we recycle waste from existing nuclear power stations, and use it to produce more clean energy. we can store energy […]",moltexenergy.com,CV37 9NP,"Net Zero, Energy Generation","Net Zero: Low Carbon Energy Generation, Net Zero: Renewables, Net Zero: Renewable Energy Planning Database, Energy Generation: Nuclear, Energy Generation: Nuclear Fusion",6736,0,,0
08556605,SIFI NETWORKS AMERICA LIMITED,110,8283782,1.009,1.009,,Medium,06/05/2013 00:00:00,"Learn more about how sifi networks is funding, building and operating open access fiber networks across the us.",sifinetworks.com,WC1X 8UE,"Telecommunications, Net Zero","Telecommunications: Wireless Connectivity, Telecommunications: 5G Radio Access Network, Net Zero: Building Technologies",,0,,0
08830217,RIDGE CLEAN ENERGY LTD,40,2059400,0.595,0.595,,Small,01/02/2014 00:00:00,,ridgecleanenergy.com,OX7 3PL,"CleanTech, Net Zero","CleanTech: Energy Production, Management and Storage, Net Zero: Low Carbon Energy Generation, Net Zero: Renewables, Net Zero: Renewable Energy Planning Database",,0,,1
12187537,AMPX LIMITED,48,3323668,0.414,0.414,,Small,09/03/2019 00:00:00,Amp x - delivering a disruptive grid edge digital energy platform,ampx.energy,SW1H 0BL,"Energy Management, Artificial Intelligence, Net Zero, Internet of Things","Energy Management: Energy Management Systems, Artificial Intelligence: Green Tech, Net Zero: Grid, Net Zero: Renewables, Net Zero: Renewable Energy Planning Database, Internet of Things: Energy Management & Smart Buildings",,0,,0
06071914,GEOWARMTH HEAT PUMPS LIMITED,26,1708784,0.204,0.204,,Small,01/29/2007 00:00:00,Renewable energy solutions from mcs accredited north east based installer providing air and geothermal ground source heat pumps solar panels photovoltaic pv solar thermal biomass combined heat and power covering counties including tyne and wear northumberland cumbria durham teeside yorkshire lancashire dumfries scottish borders,geowarmth.co.uk,NE29 7UW,"Energy Storage, Net Zero, Energy Generation","Energy Storage: Thermal, Net Zero: Heating, Net Zero: Building Technologies, Net Zero: Renewables, Net Zero: Renewable Energy Planning Database, Energy Generation: Renewable Thermal, Energy Generation: Solar",,0,2024-04-01,0
11118507,BRGP LTD,33,1875282,0.228,0.228,,Small,12/19/2017 00:00:00,M&e contractor based in north wales.,brgp.org.uk,M1 4PB,Net Zero,Net Zero: Renewable Energy Planning Database,,0,,0
09853253,WOOD THILSTED PARTNERS LIMITED,179,22373817,0.48350000000000004,0.786,0.181,Medium,11/03/2015 00:00:00,,woodthilsted.com,SE1 7AB,"Net Zero, Energy Generation","Net Zero: Low Carbon Energy Generation, Net Zero: Renewables, Net Zero: Renewable Energy Planning Database, Energy Generation: Onshore Wind, Energy Generation: Offshore Wind",,0,2023-05-01,0
07826017,ADVANCED RENEWABLE POWER LTD,47,17449145,0.375,0.375,,Small,10/27/2011 00:00:00,Arpower is a truly passionate renewable energy company. we design and fit solar and renewable energy solutions for your home and business. get a quote now!,arpower.co.uk,NE37 1EZ,"Net Zero, Energy Generation","Net Zero: Energy Storage, Net Zero: Renewables, Net Zero: Renewable Energy Planning Database, Energy Generation: Solar",,0,,1
12686337,ARUP PERU LIMITED,60,25480000,0.904,0.78,1.028,Medium,06/20/2020 00:00:00,,arup.com,W1T 4BJ,"Research and Consulting - Physical Sciences and Engineering, Net Zero","Research and Consulting - Physical Sciences and Engineering: Engineering Consulting, Research and Consulting - Physical Sciences and Engineering: Engineering Research, Net Zero: Building Technologies",,0,,0
09805175,EFFECTIVE ENERGY GROUP LTD,728,101200326,0.312,0.434,0.19,Large,10/02/2015 00:00:00,"Effective energy group help energy companies, home owners & local authorities deliver their sustainability obligations through customer service & installations.",effective-energy.co.uk,LE4 1AA,"Energy Management, Net Zero","Energy Management: Energy Management Systems, Net Zero: Renewable Energy Planning Database",,0,,0
SC331604,ATMOS CONSULTING LIMITED,78,5871236,0.237,0.237,,Medium,09/28/2007 00:00:00,"Atmos are a leading town planning & environmental consultancy with office in edinburgh, inverness & mold north wales",atmosconsulting.co.uk,EH3 8EG,"Life Sciences, Net Zero","Life Sciences: Environmental Sciences Products and Services, Net Zero: Low Carbon Consultancy, Advisory & Offsetting Services, Net Zero: Renewable Energy Planning Database",,0,,0
12449759,MER CHARGING UK LIMITED,65,2700765,1.6110000000000002,0.494,2.728,Medium,02/07/2020 00:00:00,Mer provides electric car charging for businesses and public spaces. we are proud to be one of the most sustainable choices for ev charging.,uk.mer.eco,EC2N 4BQ,Net Zero,Net Zero: Low Emission Vehicles,553140,0,,0
00123550,GE ENERGY (UK) LIMITED,629,54594973,0.2865,0.418,0.155,Large,08/01/1912 00:00:00,"Ge rises to the challenge of building a world that works. learn how our leading technologies & reach helps the world work more efficiently, reliably & safely.",ge.com,WA14 2DT,Net Zero,Net Zero: Renewable Energy Planning Database,19176,0,,0
10286500,CLEAN POWER HYDROGEN GROUP LIMITED,79,28000,0.581,0.581,,Medium,07/19/2016 00:00:00,,cph2.com,DN2 4BL,"Net Zero, Energy Generation","Net Zero: Low Carbon Energy Generation, Energy Generation: Hydrogen",470581,0,,0
09467305,SENNEN TECH LTD,53,2525801,0.521,0.521,,Medium,03/03/2015 00:00:00,Cutting edge software from sennen tech. for market leaders in renewables who put data at the heart of their asset management strategy.,sennen.tech,W1D 1NN,Net Zero,Net Zero: Renewables,,0.78,2023-12-01,0
10220472,BRILL POWER LIMITED,63,4357329,0.463,0.463,,Medium,06/08/2016 00:00:00,"The brill power battery management system (bms) improves batteries with novel, intelligent control technology developed at oxford university.",brillpower.com,OX9 3EZ,"CleanTech, Energy Storage, Net Zero","CleanTech: Energy Production, Management and Storage, Energy Storage: Batteries, Net Zero: Energy Storage, Net Zero: Low Emission Vehicles",1535425.19,10.33,2023-09-01,0
08050130,IMPACT RENEWABLE ENERGY LIMITED,54,3042254,0.545,0.545,,Medium,04/30/2012 00:00:00,"Providing award-winning renewable energy, air conditioning, mechanical ventilation and refrigeration technology at competitive prices. mcs accredited.",www.impact-services.co.uk,NR7 8SG,Net Zero,"Net Zero: Renewables, Net Zero: Renewable Energy Planning Database",,0,,0
11001894,VORTEX IOT LIMITED,75,5334479,0.402,0.402,,Medium,10/09/2017 00:00:00,"The company builds environmental sensors, networks and data solutions to support decarbonisation efforts globally. experts in the latest iot, ai, 5g and…",vortexiot.com,SA11 1NJ,"Space Economy, AgriTech, Net Zero, Internet of Things","Space Economy: Mapping, AgriTech: Remote Sensing, Net Zero: Building Technologies, Net Zero: Pollution Control and Mitigation, Internet of Things: Smart Cities and Transport",1528566,1.68,2022-01-01,0
01885075,TRANSENSE TECHNOLOGIES PLC,15,8822500,1.0825,-0.135,2.3,Small,02/11/1985 00:00:00,"Transense develops, manufactures and licences advanced surface acoustic wave (saw) wireless and passive sensor systems to measure torque, force, pressure…",transense.com,OX25 3SX,"Marine and Maritime, Autonomy and Robotics, In-Orbit Servicing and Manufacturing, Sensors, CleanTech, Electronics Manufacturing","Marine and Maritime: Autonomy & Robotics, Autonomy and Robotics: Sensing and Perception, In-Orbit Servicing and Manufacturing: Assembly, Sensors: Autonomous vehicles, Sensors: Mobility, Sensors: Medical, Sensors: Industry 4.0, Sensors: Image and Video Analysis, Sensors: Environmental Monitoring, CleanTech: Environmental Protection and Monitoring, Electronics Manufacturing: Measuring and metrology devices",547103.2,0,,0
10521347,RESERO CONSULTANTS LIMITED,23,848737,0.294,0.294,,Small,12/12/2016 00:00:00,Evora global provides an exceptional level of sustainability consultancy and esg software to many of europe's leading firms.,evoraglobal.com,SY1 2DP,"ESG, Net Zero","ESG: ESG Consultants, Net Zero: Low Carbon Consultancy, Advisory & Offsetting Services",,0,,0
09444771,BLINK CHARGING UK LIMITED,102,7697535,0.445,0.445,,Medium,02/17/2015 00:00:00,"We’re a leading, independently-owned provider of electric vehicle charging and sustainable energy solutions and technologies.",ebcharging.co.uk,AL1 3AW,Net Zero,Net Zero: Low Emission Vehicles,762881.0900000001,0,2022-04-01,0
11294189,AESG LIMITED,62,61305,0.783,0.783,,Medium,04/05/2018 00:00:00,"Aesg is an award-winnning specialist consultancy headquartered in london, dubai and singapore with global expertise in sustainable design, fire and life safety, façade engineering, environmental consultancy, commissioning, acoustics, waste management and carbon management.",aesg.com,EC4V 3DS,"ESG, Research and Consulting - Physical Sciences and Engineering","ESG: ESG Consultants, Research and Consulting - Physical Sciences and Engineering: Engineering Consulting, Research and Consulting - Physical Sciences and Engineering: Engineering Research",,0,,0
09128244,GOOD ENERGY SOLAR (SOUTH WEST) LIMITED,23,1884555,0.21,0.21,,Small,07/14/2014 00:00:00,"Mutli award winning installer wessex ecoenergy - solar, battery storage, and electric vehicle chargers in dorset, devon, somerset, wilstshire & hampshire.",wessexecoenergy.com,DT1 3AZ,"Net Zero, Energy Generation","Net Zero: Energy Storage, Net Zero: Renewables, Net Zero: Renewable Energy Planning Database, Net Zero: Low Emission Vehicles, Energy Generation: Solar",,0,2023-06-01,0
07343391,EMPOWER ENERGY LIMITED,63,11265248,0.438,0.438,,Medium,08/11/2010 00:00:00,Empower energy has continued to go from strength to strength. drawing on 14 years’ experience within the electrical engineering sector.,empowerenergy.co.uk,BH22 9PH,"Net Zero, Energy Generation","Net Zero: Energy Storage, Net Zero: Renewables, Net Zero: Renewable Energy Planning Database, Energy Generation: Solar",,0,,0
08811056,ENGENERA RENEWABLES LIMITED,32,2070593,0.29,0.29,,Small,12/11/2013 00:00:00,"At engenera renewables group, we believe energy efficiency is for everyone. this is why we implement renewable energy strategies, to reduce energy costs and environmental impact.",engenera.com,NE11 0HW,Net Zero,"Net Zero: Renewables, Net Zero: Renewable Energy Planning Database",,0,,0
11926768,CARBON REWIND LTD,115,7531120,1.036,1.036,,Medium,04/04/2019 00:00:00,,carbonrewind.com,WD24 4YW,Net Zero,Net Zero: Renewable Energy Planning Database,,0,,0
08881891,NOVA PANGAEA TECHNOLOGIES (UK) LIMITED,36,8993,0.34,0.34,,Small,02/07/2014 00:00:00,"We’re a cleantech business that’s created a revolutionary and proprietary patented process, called refnova®. our refnova process enables our customers to convert woody and agricultural plant residues into high-value sustainable biocarbons, biopolymers, biochemicals and advanced biofuels.",novapangaea.com,TS10 4RG,"CleanTech, Research and Consulting - Physical Sciences and Engineering","CleanTech: Environmental Protection and Monitoring, Research and Consulting - Physical Sciences and Engineering: Engineering Research",409943,30.53,2023-11-01,0
09679187,BABCOCK & WILCOX VØLUND LIMITED,78,32192926,0.2155,0.057,0.374,Medium,07/09/2015 00:00:00,"B&w's clean power technologies include decarbonization, hydrogen production, solar, energy storage, wte, emissions control and steam generation.",babcock.com,EC4N 6AF,"CleanTech, Electronics Manufacturing, Net Zero, Energy Generation","CleanTech: Energy Production, Management and Storage, Electronics Manufacturing: Energy generation or distribution tech, Net Zero: Low Carbon Energy Generation, Net Zero: Renewable Energy Planning Database, Energy Generation: Bioenergy",,0,,0
10867030,CONRAD ENERGY GROUP LIMITED,319,648010000,2.091,0.532,3.65,Large,07/14/2017 00:00:00,"Conrad energy is a full-service independent power producer (ipp), delivering fast and flexible power generation supporting the national grid",conradenergy.co.uk,OX14 1SY,"CleanTech, Energy Storage, Energy Management, Net Zero, Energy Generation","CleanTech: Energy Production, Management and Storage, Energy Storage: Batteries, Energy Storage: Hydrogen, Energy Management: Energy Management Systems, Net Zero: Low Carbon Energy Generation, Net Zero: Energy Storage, Net Zero: Grid, Net Zero: Renewables, Net Zero: Renewable Energy Planning Database, Energy Generation: Fossil Fuels",,0,,0
09099184,ENFINIUM PARC ADFER OPERATIONS LIMITED,44,22357664,0.5375,0.196,0.879,Medium,06/24/2014 00:00:00,"The u.k’s largest pure-play waste-to-energy operator, we transform waste into energy to help power homes, businesses and the circular economy.",enfinium.co.uk,SW1E 6DE,Net Zero,Net Zero: Renewable Energy Planning Database,,0,,0
SC084742,AES LIMITED,43,6123225,0.195,0.195,,Small,09/26/1983 00:00:00,Experts in solar panels for home and business. we are the only thermal panel manufacturer in scotland and the longest established solar company in europe. more than 40 years of experience in solar and renewable energy technology.,aessolar.co.uk,IV36 1AU,"Net Zero, Energy Generation","Net Zero: Renewables, Net Zero: Renewable Energy Planning Database, Energy Generation: Solar",52485,0,,0
03782443,E.ON NEXT ENERGY LIMITED,6985,22747500000,1.4329999999999998,1.029,1.837,Large,06/04/1999 00:00:00,"If you have an npower billing or payment query and are not an e.on next customer, you can get information here.",eonnext.com,CV4 8LG,Energy Management,Energy Management: Energy Management Systems,,0,,0
11040368,CONSULTIV UTILITIES LIMITED,205,8103240,0.857,0.857,,Medium,10/31/2017 00:00:00,"In a complex and volatile market like energy, your business needs an experienced and credible partner. at consultiv utilities we pride ourselves on our reputation as experts in our field and an honest voice in the utilities sector.",consultivutilities.com,NE31 2EX,Energy Management,Energy Management: Energy Management Systems,,0,,0
11706258,GREYPARROT.AI LTD,65,3085505,0.755,0.755,,Medium,11/30/2018 00:00:00,The leading ai waste analytics platform for the circular economy | increasing transparency in waste management to unlock the financial value of waste,greyparrot.ai,SE16 4DG,"Robotics and Autonomous systems, CleanTech, Net Zero","Robotics and Autonomous systems: Energy: Recycling, CleanTech: Adapted Goods, Net Zero: Waste Management and Recycling, Net Zero: Diversion of Biodegradable Waste from Landfill",1604181.34,0,,0
06718635,ELECTRACOM PROJECTS (UK) LTD,86,21905565,0.24,0.229,0.251,Medium,10/08/2008 00:00:00,Providing intelligent automation,electracomprojects.com,SL1 8DF,"Net Zero, Internet of Things","Net Zero: Building Technologies, Internet of Things: Energy Management & Smart Buildings",,0,,0
09923011,PLASTIC ENERGY LIMITED,197,3015190,0.3355,0.539,0.132,Medium,12/18/2015 00:00:00,"Plastic energy offers a global and sustainable solution to help prevent plastic pollution, by transforming previously unrecyclable plastic waste into a valuable resource.",plasticenergy.com,EC4V 5DY,"CleanTech, Net Zero","CleanTech: Adapted Goods, Net Zero: Low Carbon Energy Generation",,0,,0
12327570,OPTIMISED GROUP LIMITED,158,19671367,0.2015,0.158,0.245,Medium,11/21/2019 00:00:00,"Optimised group are an award-winning energy consultancy which optimises clients business energy from supply to energy management and facility usage, to help them reduce costs whilst on their journey towards net-zero.",optimised.net,FY4 2RP,"Energy Management, Net Zero, Internet of Things","Energy Management: Energy Management Systems, Net Zero: Building Technologies, Internet of Things: Energy Management & Smart Buildings",,0,,0
SC547728,TROJAN ENERGY LIMITED,115,0,0.951,0.951,,Medium,10/13/2016 00:00:00,Convenient on street ev charging without permanent pavement clutter and tending to residents without access to driveways or off street parking.,trojan.energy,AB12 3LE,Net Zero,Net Zero: Low Emission Vehicles,2838153.0999999996,35.59,2024-01-01,0
10870739,UK ECO ENERGY SOLUTIONS LTD,80,3157141,0.507,0.507,,Medium,07/18/2017 00:00:00,"Solar panel & heat pump experts based in lincoln, lincolnshire, we are a renewable energy solutions provider, working in partnership with solax power, lg lifes good, stiebel eltron, q cells & lux power tek. all of our installations are signed off under our",ukecoenergy.com,LN1 2XG,"Net Zero, Energy Generation","Net Zero: Heating, Net Zero: Renewables, Net Zero: Renewable Energy Planning Database, Energy Generation: Renewable Thermal, Energy Generation: Solar",,0,,0
09860235,ENFINIUM K3 CHP OPERATIONS LIMITED,55,55996403,0.5695,0.083,1.056,Large,11/06/2015 00:00:00,"The u.k’s largest pure-play waste-to-energy operator, we transform waste into energy to help power homes, businesses and the circular economy.",enfinium.co.uk,SW1E 6DE,Net Zero,Net Zero: Renewable Energy Planning Database,,0,,0
09941394,BRADWELL POWER GENERATION COMPANY LIMITED,56,2213426,0.344,0.344,,Medium,01/07/2016 00:00:00,,bradwellb.co.uk,SW1Y 4PE,"Net Zero, Energy Generation","Net Zero: Renewables, Energy Generation: Nuclear",,0,,0
11892886,POLLINATION CAPITAL PARTNERS LIMITED,75,10669102,0.917,1.093,0.741,Medium,03/20/2019 00:00:00,"Pollination is a specialist climate change investment and advisory firm, accelerating the transition to a net zero, nature positive future.",pollinationgroup.com,W1T 4HD,Net Zero,"Net Zero: Low Carbon Consultancy, Advisory & Offsetting Services, Net Zero: Green Finance",,45.7,2022-03-01,0
05158885,SIRIUS CIVIL ENGINEERING LIMITED,70,31945144,0.258,0.258,,Medium,06/21/2004 00:00:00,"Consulting engineers, contractors and remediation specialists for successful brownfield developments - bringing tangible business value to our clients",thesiriusgroup.com,DH7 8HJ,"Land Remediation, Net Zero","Land Remediation: Brownfield Regeneration, Land Remediation: Remediation Services, Net Zero: Renewable Energy Planning Database",,0,,0
11982528,SKOOT ECO GROUP LTD,5,341739,-0.043,-0.043,,Micro,05/07/2019 00:00:00,"The skoot climate platform helps businesses achieve their goal of being net-zero by providing them tools to calculate their carbon emissions, offset their carbon, and purchase trees.",skoot.eco,EC2A 4NE,Net Zero,Net Zero: Green Finance,71764,3.43,2021-07-01,0
09847538,TECHNOLOGY ENHANCED OPERATIONS LIMITED,51,6953475,0.2595,0.496,0.023,Medium,10/29/2015 00:00:00,"A clean technology-centric ecosystem, beam provides funding for environmentally-aligned businesses and services across the investment themes of clean energy, sustainability and financial innovation",beam.earth,EC2M 5PS,CleanTech,CleanTech: Environmental Protection and Monitoring,,0,,0
08522956,ECO2 MANAGEMENT SERVICES LIMITED,84,6336100,0.205,0.205,,Medium,05/09/2013 00:00:00,"Eco2 is an experienced renewable energy asset manager, developing and managing biomass, wind, solar and anaerobic digestion plants",eco2uk.com,CF23 8RS,"Net Zero, Energy Generation","Net Zero: Low Carbon Energy Generation, Net Zero: Renewables, Net Zero: Renewable Energy Planning Database, Energy Generation: Bioenergy",,0,2022-07-01,0
03726622,JMG LIMITED,18,672076,0.173,0.173,,Small,03/04/1999 00:00:00,"Jmg limited is an integrated solution provider in nigeria, ivory-coast, ghana and iraq that offers fg wilson perkins generators, legrand electrical, mitsubishi generator, kaeser air compressors, abb transformers, tk elevator and trane hvac products and after-sales.",jmglimited.com,IP7 6RD,"Electronics Manufacturing, Energy Storage","Electronics Manufacturing: Energy generation or distribution tech, Energy Storage: Uninterruptible power supply",,0,,1
10276420,WIND 2 LIMITED,62,0,0.804,0.804,,Medium,07/13/2016 00:00:00,"Wind 2 is a specialist onshore wind energy developer. onshore wind farms are now amongst the lowest cost forms of electricity generation of any kind, they…",wind2.co.uk,CH7 1XP,"Net Zero, Energy Generation","Net Zero: Low Carbon Energy Generation, Net Zero: Energy Cooperatives, Net Zero: Renewables, Net Zero: Renewable Energy Planning Database, Energy Generation: Onshore Wind",,0,,1
06735175,YONDER LTD,52,1470696,0.204,0.204,,Medium,10/28/2008 00:00:00,We help you deliver zero carbon and save moneyit pays to do the right thing.find out morewe help you enhance your esg credentialsdemonstrate your esg through,yonderconsulting.co.uk,YO1 9RN,"ESG, Energy Management, Net Zero","ESG: ESG Consultants, Energy Management: Energy Management Systems, Net Zero: Building Technologies",,0,,0
11595551,ENERGISE ENERGY SOLUTIONS LTD,382,13531072,0.692,0.692,,Large,09/29/2018 00:00:00,"Specialising in ev chargers, smart and renewable energy. easee, pod point, eo, ohme, wallbox, zappi & more!",energise.energy,DN9 3QZ,Net Zero,Net Zero: Low Emission Vehicles,,0,,0
07593865,ENFINIUM LIMITED,108,29239855,0.372,0.372,,Medium,04/06/2011 00:00:00,"The u.k’s largest pure-play waste-to-energy operator, we transform waste into energy to help power homes, businesses and the circular economy.",enfinium.co.uk,SW1E 6DE,Net Zero,Net Zero: Renewable Energy Planning Database,,0,,0
11892654,POLLINATION GLOBAL HOLDINGS LIMITED,278,55837600,0.8759999999999999,0.709,1.043,Large,03/19/2019 00:00:00,"Pollination is a specialist climate change investment and advisory firm, accelerating the transition to a net zero, nature positive future.",pollinationgroup.com,W1T 4HD,Net Zero,"Net Zero: Low Carbon Consultancy, Advisory & Offsetting Services, Net Zero: Green Finance",,0,,0
11375414,THINK HIRE LTD,60,302104,0.741,0.741,,Medium,05/22/2018 00:00:00,"Trusted, innovative solutions for relocatable renewable energy, along with everything you need for your site.",thinkhire.co.uk,OL9 8EU,Net Zero,Net Zero: Renewable Energy Planning Database,,0,2022-12-01,0
