Companynumber,Companyname,BestEstimateCurrentEmployees,BestEstimateCurrentTurnover,BestEstimateGrowthPercentagePerYear,BestEstimateEmployeeGrowthPercentagePerYear,BestEstimateTurnoverGrowthPercentagePerYear,CompanyGrowthStage,SortableIncorporationDate,Description,URLs,Registeredpostcode,RTICs,RTICsubsectors,TotalInnovateUKFunding,TotalDealroomFundingMillionPounds,LastKnownDealroomFunding,WomenFounded
12290122,NADDER HOLDINGS LIMITED,83,21634319,0.20650000000000002,0.214,0.199,Medium,10/30/2019 00:00:00,"Wiltshire, hampshire & dorset packaging company, helping businesses switch to eco-friendly packaging supplies, solutions and integrating an end to end warehouse packing systems",testvalleypkg.co.uk,SP10 3RU,CleanTech,CleanTech: Adapted Goods,,0,,0
06711038,ANAERGIA LIMITED,46,3478645,0.388,0.388,,Small,09/30/2008 00:00:00,,anaergia.com,LN6 3RU,"CleanTech, Net Zero, Energy Generation","CleanTech: Environmental Protection and Monitoring, Net Zero: Waste Management and Recycling, Net Zero: Renewable Energy Planning Database, Energy Generation: Bioenergy",,0,,0
11014226,NATIONAL GRID ELECTRICITY SYSTEM OPERATOR LIMITED,1508,4860284000,0.243,0.21,0.276,Large,10/16/2017 00:00:00,At national grid eso we make sure that great britain has the essential energy it needs by making sure supply meets demand every second of every day. find out more about what we do and how we keep the lights on for great britain.,nationalgrideso.com,WC2N 5EH,"Energy Management, Net Zero","Energy Management: Smart Grid, Net Zero: Grid, Net Zero: Renewable Energy Planning Database",142706,0,,0
10431108,BATTERIES AND SOLAR LTD,21,1742236,0.244,0.244,,Small,10/17/2016 00:00:00,The largest supplier of off grid power solutions and battery performance management in plymouth and the south west. call us on 01752 656270,batteriesandsolar.co.uk,PL6 8LH,Energy Generation,Energy Generation: Solar,,0,,0
02415498,TOTAL WASTE MANAGEMENT LIMITED,103,122473538,0.24,0.126,0.354,Large,08/22/1989 00:00:00,,twm.co.uk,SS13 1EB,Net Zero,Net Zero: Waste Management and Recycling,,0,,0
09145944,EV METALS GROUP PLC,198,5225384,1.019,1.019,,Medium,07/24/2014 00:00:00,Evm is building a global battery materials and technology business for a clean energy future.,evmetalsgroup.com,EC2M 5PS,Energy Storage,Energy Storage: Batteries,,0,,0
11875702,XIEL LTD,38,1292735,0.32,0.32,,Small,03/12/2019 00:00:00,Suppliers of nuclear medicine & radiotherapy equipment & consumables for public or private healthcare organisations; providing quality products with training.,xiel.co.uk,BA4 4JT,Energy Generation,Energy Generation: Nuclear,,0,,1
NI638705,INOV8 SYSTEMS LIMITED,33,4864504,0.36,0.36,,Small,05/26/2016 00:00:00,"Offering the most robust & reliable online oil in water measurement products, inov8 develops solutions for customers, across a broad spectrum of industries.",inov8s.com,BT3 9JQ,"CleanTech, Net Zero","CleanTech: Environmental Protection and Monitoring, Net Zero: Pollution Control and Mitigation",173137,0,,0
09377661,SOLARPORT SYSTEMS LIMITED,62,12434678,0.755,0.755,,Medium,01/07/2015 00:00:00,"Solarport systems is the leading uk designer and manufacturer of utility-scale solar mounting structures. designed and manufactured in the uk, driven by innovation, quality engineering and customer service, solarport are the experts in cost-effective mounting systems that are easy to install.",solarportsystems.com,DT6 3FH,Energy Generation,Energy Generation: Solar,,0,,1
09742877,ROVCO LIMITED,172,13653711,0.399,0.399,,Medium,08/21/2015 00:00:00,Rov and hydrographic survey services providing the world’s highest quality data. contact us for efficient operations using 3d and ai to lower cost of inspection.,rovco.com,BS1 6BX,"Marine and Maritime, Robotics and Autonomous systems, Artificial Intelligence, Energy Generation","Marine and Maritime: Autonomy & Robotics, Robotics and Autonomous systems: Energy: Renewables, Robotics and Autonomous systems: Mobility: Maritime, Artificial Intelligence: Image Processing, Energy Generation: Offshore Wind",2549045.6,22.78,2022-04-01,0
13118500,FARGROUP LIMITED,68,38421851,0.231,0.007,0.455,Large,01/06/2021 00:00:00,"Fargro are industry leaders in products and solutions for horticultural businesses. we support growers, nurseries and garden centres with everything from sundries to state-of-the-art automation systems. our solutions can",fargro.co.uk,BN18 9PY,CleanTech,CleanTech: Adapted Goods,,0,,0
07921860,INSTITUTIONAL INVESTORS GROUP ON CLIMATE CHANGE LIMITED,68,9742237,0.532,0.548,0.516,Medium,01/24/2012 00:00:00,,iigcc.org,WC2B 6SR,Net Zero,"Net Zero: Low Carbon Consultancy, Advisory & Offsetting Services, Net Zero: Green Finance",,0,,0
09847877,CHARGE CARS LTD,128,156327,1.378,1.378,,Medium,10/29/2015 00:00:00,A technology company that creates brand new electric cars.,charge.cars,WC2N 6NJ,Net Zero,Net Zero: Low Emission Vehicles,,0,,0
05784955,GAS FAST LIMITED,130,8513440,1.278,1.278,,Medium,04/19/2006 00:00:00,Solar panels save you money on energy bills. uk solar panel installation is easy and quick. save with solar energy. save with solar fast.,solarfast.co.uk,WD24 4JL,"Net Zero, Energy Generation","Net Zero: Energy Storage, Net Zero: Renewables, Net Zero: Renewable Energy Planning Database, Energy Generation: Solar",,0,,0
09101765,THE GOOD ECONOMY PARTNERSHIP LIMITED,32,1658691,0.419,0.419,,Small,06/25/2014 00:00:00,The good economy is a leading social advisory firm and specialist in impact measurement and management.,thegoodeconomy.co.uk,TW1 2HH,ESG,ESG: ESG Consultants,,0,,1
09090821,TAMAR RENEWABLE POWER (HODDESDON) LIMITED,10,9837676,0.253,,0.253,Small,06/18/2014 00:00:00,Biogen is the uk's leading operator of anaerobic digestion plants with over 20 years of working in the food waste recycling industry.,biogen.co.uk,MK44 1YU,"Net Zero, Energy Generation","Net Zero: Waste Management and Recycling, Net Zero: Diversion of Biodegradable Waste from Landfill, Energy Generation: Bioenergy",,0,,0
SC467672,GREENER ENERGY GROUP LTD,172,12931710,0.567,0.567,,Medium,01/17/2014 00:00:00,We install energy efficient solutions in your home + save you money. do you qualify for up to 70% off your energy bill? get our free home suitability survey,greenerenergygroup.co.uk,PA3 4EF,"Net Zero, Energy Generation","Net Zero: Heating, Energy Generation: Renewable Thermal",,0,,1
11929303,TELCOSS LTD,130,15545163,2.039,2.039,,Medium,04/05/2019 00:00:00,,telcoss.co.uk,TS10 4RG,Net Zero,"Net Zero: Waste Management and Recycling, Net Zero: Diversion of Biodegradable Waste from Landfill",,0,,1
12625314,ISOMETRIX SOFTWARE UK LTD,48,2261559,0.387,0.387,,Small,05/27/2020 00:00:00,We are one of the world’s leading developers of software solutions for integrated risk management,isometrix.com,EC2R 7HJ,ESG,ESG: ESG Consultants,,0,,0
04688350,ALFA ENERGY LIMITED,462,13869852,0.2785,0.508,0.049,Large,03/06/2003 00:00:00,Our aim is to keep business energy users informed about net zero emissions targets and sustainability.,netzerocarbon.com,W3 7DA,Net Zero,"Net Zero: Low Carbon Consultancy, Advisory & Offsetting Services, Net Zero: Renewable Energy Planning Database",,0,2022-10-01,0
12382318,SYLVERA LTD,205,9639820,2.697,2.697,,Medium,01/02/2020 00:00:00,"Sylvera delivers independent and in-depth carbon offset ratings. we enable corporate sustainability leaders, traders and exchanges to discover high quality offsets and deliver on their net zero commitments.",sylvera.com,N1 7SR,"CleanTech, Net Zero","CleanTech: Environmental Protection and Monitoring, Net Zero: Carbon Capture, Net Zero: Green Finance",2053779,74.79,2023-07-01,0
SC567068,H2TEC LIMITED,68,9748106,0.623,0.623,,Medium,05/25/2017 00:00:00,"At h2tec, we are enabling an ultra-low and zero-emission transport future that is ultra-low and zero-emission. we offer tailored solutions that provide on-site hydrogen refuelling for vehicle fleets leading to an immediate reduction of carbon emissions and increase in air quality. we have developed",h2tec.co.uk,EH21 8QJ,"Energy Storage, Net Zero, Energy Generation","Energy Storage: Hydrogen, Net Zero: Low Carbon Energy Generation, Energy Generation: Hydrogen, Energy Generation: Fossil Fuels",9784.6,0,,0
04250990,GLOBELEQ AFRICA LIMITED,56,9044349,0.3325,0.029,0.636,Medium,07/12/2001 00:00:00,,globeleq.com,EC3V 9LJ,"Net Zero, Energy Generation","Net Zero: Renewables, Net Zero: Renewable Energy Planning Database, Energy Generation: Solar",,0,,0
07361156,HAFOD RENEWABLE ENERGY LTD,25,2173460,0.242,0.242,,Small,08/31/2010 00:00:00,"Installing solar pv future-proofs you against on-going increases to energy costs, and reduces your reliance on fossil fuels.",hafodrenewables.co.uk,WA3 6GR,"Photonics, Net Zero, Energy Generation","Photonics: Photovoltaics, Net Zero: Heating, Net Zero: Renewables, Net Zero: Renewable Energy Planning Database, Energy Generation: Renewable Thermal, Energy Generation: Solar",,0,,0
04766468,R.F. & P.M. TAYLOR LIMITED,25,1629614,0.288,0.288,,Small,05/15/2003 00:00:00,"Rf & pm taylor ltd - as one of the leading oil burner engineers and air source heat pump and ground souce heat pump installers in lincolnshire, our services include oil boiler servicing, breakdown callout, boiler commissioning, oil tanks - renewables, lincolnshire",rfpmtaylor.co.uk,PE11 3YR,"Net Zero, Energy Generation","Net Zero: Heating, Energy Generation: Renewable Thermal",,0,,0
SC557385,CRAFT PROSPECT LTD,64,7574878,0.572,0.572,,Medium,02/13/2017 00:00:00,"Craft prospect is a newspace company providing ai-enabled space technologies, quantum encryption services and mission systems consultancy.",craftprospect.com,G1 3NQ,"Space Energy, Quantum Technology, In-Orbit Servicing and Manufacturing, Space Economy, Photonics, Quantum Economy","Space Energy: Space Infrastructure, Quantum Technology: Quantum Communication, In-Orbit Servicing and Manufacturing: Debris, In-Orbit Servicing and Manufacturing: Space Software, Space Economy: Space Ecosystem, Space Economy: Cyber Security and Encryption, Space Economy: Geospatial Analytics, Space Economy: Hardware, Photonics: Quantum Tech, Quantum Economy: Photonics",655846,1.76,2022-10-01,0
03872602,CRJ SERVICES LIMITED,75,44931742,0.23500000000000001,0.127,0.343,Large,11/08/1999 00:00:00,,crjservices.co.uk,WA16 9LU,Net Zero,Net Zero: Waste Management and Recycling,,0,,0
07233019,ETERNITY TECHNOLOGIES LIMITED,180,43108443,0.53,0.897,0.163,Large,04/23/2010 00:00:00,The global industrial market requires constant innovation and excellence as technology adapts to ever-changing demanding requirements.,eternitytechnologies.com,M17 1SN,"Energy Storage, Net Zero, Energy Generation","Energy Storage: Batteries, Net Zero: Renewables, Energy Generation: Solar",,0,,0
05845046,ENCYCLIS LIMITED,358,122098867,1.3384999999999998,1.293,1.384,Large,06/13/2006 00:00:00,,covanta.com,WC1H 9LT,Energy Generation,Energy Generation: Bioenergy,,0,,0
11193856,CARBON UNDERWRITING LIMITED,85,7979111,1.08,1.08,,Medium,02/07/2018 00:00:00,"Carbon bringing elemental transformation to the global coverholder marketplace find out more about us insights bringing elemental transformation to the global coverholder marketplace learn more about us carbon underwriting, a new approach for the market carbon underwriting limited (carbon) is a specialist, independent, class agnostic managing general underwriter (mgu) writing to a mix of third party capacity and its own syndicate cbn 4747. carbon set out in 2018 with a mission to transform the world of delegated underwriting and with a vision to set a global benchmark. we are a dynamic company and recognise the importance of embracing modern technology to deeply enrich our offering. we have pioneered a game-changing, bespoke approach using an open underwriting model where data drives improved underwriting performance creating superior analysis and fluidity of portfolio management. this is administered through our in-house technology ecosystem, graphene. learn more about us latest insights carbon news july 1, 2021 leadership transition as carbon underwriting positions for further growth nick tye, currently active underwriter syndicate 4747 and director carbon underwriting, is also promoted to ceo of carbon, while current ceo … carbon news january 12, 2021 enhancements, expansions and evolution – it’s all happening in insurance carbon underwriting founder […]",carbonuw.com,EC3V 0BG,"Advanced Materials, CleanTech","Advanced Materials: Carbon-Based, CleanTech: Environmental Protection and Monitoring",,0,2023-07-01,0
03671995,SMARTLOUVRE TECHNOLOGY LIMITED,22,3587245,0.201,0.201,,Small,11/23/1998 00:00:00,"Smartlouvre manufacture the unique material microlouvre. a high-performance metal fabric, for numerous applications including solar shading and lighting solutions.",smartlouvre.com,PO9 1JB,Energy Generation,Energy Generation: Solar,,0,,0
09989395,AC ELECTRICAL SERVICES GROUP LIMITED,102,18192359,1.475,1.475,,Medium,02/05/2016 00:00:00,"Ac electrical services (nw) ltd, providing electrical contracting services to commercial and domestic customers alike, throughout the uk.",ac-elec.co.uk,FY4 2RP,Net Zero,Net Zero: Low Emission Vehicles,,0,,0
06961283,MG WASTE MANAGEMENT LTD,23,3090439,0.253,0.253,,Small,07/14/2009 00:00:00,Welcome to mg waste management,mgwastemanagement.co.uk,M12 5BT,Net Zero,"Net Zero: Waste Management and Recycling, Net Zero: Diversion of Biodegradable Waste from Landfill",,0,,0
SC407753,BRIGHT ASCENSION LIMITED,49,3662289,0.281,0.281,,Small,09/20/2011 00:00:00,Bright ascension offers mission ready software in space and on the ground. our integrated software is perfect for any satellite mission.,brightascension.com,DD3 6JA,"Marine and Maritime, Space Energy, In-Orbit Servicing and Manufacturing, Space Economy","Marine and Maritime: Autonomy & Robotics, Space Energy: Space Infrastructure, In-Orbit Servicing and Manufacturing: Servicing, In-Orbit Servicing and Manufacturing: Space Software, In-Orbit Servicing and Manufacturing: Assembly, Space Economy: Software, Space Economy: Space Ecosystem",8000,3.75,2024-04-01,0
11260436,ENVIRO SKIP HIRE GROUP LTD,145,9898530,1.154,2.255,0.053,Medium,03/16/2018 00:00:00,Enviro skip hire is a family run skip hire and aggregate company servicing staffordshire. check out our wide range of skip sizes and aggregates.,enviroskiphire.co.uk,CW1 6EA,Net Zero,Net Zero: Waste Management and Recycling,,0,,0
10992234,SYLVAGEN LIMITED,49,42707308,0.2115,0.301,0.122,Large,10/03/2017 00:00:00,"Recovery and recycling solutions to suit your business from collection and disposal to conversion and distribution, sylvagen is here to help.",sylvagen.co.uk,TN3 8LA,Net Zero,"Net Zero: Waste Management and Recycling, Net Zero: Renewable Energy Planning Database",,0,,0
10186928,GNEISS ENERGY LIMITED,26,929741,0.215,0.215,,Small,05/18/2016 00:00:00,We are a specialist climate risk management consultancy and work with businesses to help them understand climate risk and the oppurtunities in the future.,acastarisk.com,W1K 7DA,ESG,ESG: ESG Consultants,,0,,1
11248144,COLLARD ENVIRONMENTAL LIMITED,88,40891635,0.259,,0.259,Large,03/10/2018 00:00:00,,chiltonskips.com,RG27 0PZ,Net Zero,Net Zero: Waste Management and Recycling,,0,,0
12020505,ACORN BIOENERGY LIMITED,50,1976400,0.969,0.969,,Medium,05/28/2019 00:00:00,,acornbioenergy.com,W1U 5HT,"Net Zero, Energy Generation","Net Zero: Low Carbon Energy Generation, Net Zero: Renewable Energy Planning Database, Energy Generation: Bioenergy",,0,2022-09-01,0
06855656,MARCHES BIOGAS LIMITED,39,2948279,0.252,0.252,,Small,03/23/2009 00:00:00,"Anaerobic digestion excellence in design,manufacture,installation, and operation and maintenance from years of working within the industry.",marchesbiogas.com,SY8 4DS,Energy Generation,Energy Generation: Bioenergy,,0,,0
06228208,URENCO CHEMPLANTS LIMITED,234,59132500,1.6615,0.145,3.178,Large,04/26/2007 00:00:00,"Urenco is an international supplier of enrichment services and fuel cycle products for the civil nuclear industry, serving utility customers worldwide who provide low carbon electricity through nuclear generation.",urenco.com,CH1 6ER,Energy Generation,Energy Generation: Nuclear,,0,,0
10383183,ENERGY ANGELS GROUP LTD,47,3535443,0.424,0.424,,Small,09/19/2016 00:00:00,Energy angels provides energy cost savings including energy switching for homes and businesses to more focused energy saving services for social landlords.,energyangels.co.uk,WV2 4AT,"Energy Management, Net Zero","Energy Management: Energy Management Systems, Net Zero: Low Carbon Energy Generation, Net Zero: Renewable Energy Planning Database",,0,,1
06884353,NRS WASTE CARE LIMITED,44,11402832,0.213,0.179,0.247,Medium,04/22/2009 00:00:00,"We are a leading supplier of construction materials, recycling of building waste & inert land filling.",nrs.ltd,CV7 7LG,Net Zero,Net Zero: Waste Management and Recycling,,0,,0
OC424270,IMPALA ENERGY HOLDINGS LLP,88,29085850,2.116,0.542,3.69,Medium,09/27/2018 00:00:00,Impala energy is a power development company focused on small-to-medium sized natural gaspower projects in ssa.,impalaenergy.com,WC2H 9LL,"Net Zero, Energy Generation","Net Zero: Low Carbon Energy Generation, Net Zero: Renewable Energy Planning Database, Energy Generation: Fossil Fuels",,0,,0
OC433946,CERES RURAL LLP,85,0,0.758,0.758,,Medium,10/26/2020 00:00:00,"Ceres rural offers you a full scope of experience-led farming consultancy, technical support and business management. you are provided with independent advice and services from qualified professionals, tailoring unique solutions […]",ceresrural.co.uk,CB11 4ER,"Food Tech, AgriTech, Net Zero","Food Tech: Agri Tech, AgriTech: Remote Sensing, AgriTech: Precision Farming, AgriTech: Management Platforms, AgriTech: AgSciences, AgriTech: Automation, Net Zero: Agritech",,0,,0
11790834,TRITILITY LIMITED,205,0,0.396,0.396,,Medium,01/28/2019 00:00:00,"Tritility offers business energy procurement, consultancy, and utility management that will save money and reduce your carbon emissions. enquire today",tritility.com,NE32 3DP,Energy Management,Energy Management: Energy Management Systems,,0,,0
SC626120,UTOPI LTD,80,5564936,0.776,0.776,,Medium,03/29/2019 00:00:00,,utopi.co.uk,G2 4SQ,ESG,ESG: ESG Consultants,,5,2023-03-01,0
08844718,CENTRECO (UK) LIMITED,114,23406495,0.544,0.544,,Medium,01/14/2014 00:00:00,Are you looking for solar panels for businesses and landlords throughout the united kingdom? centreco is one of the best commercial solar energy companies.,centreco.co.uk,WA3 6GR,"Net Zero, Energy Generation","Net Zero: Renewables, Net Zero: Renewable Energy Planning Database, Energy Generation: Solar",,0,2023-09-01,0
07101190,OCEAN WINDS UK LIMITED,163,0,0.205,0.205,,Medium,12/10/2009 00:00:00,"Generating the future of offshore wind energy generating the future of offshore wind energy this is how the first windenergy brand was born. play video about ocean winds ocean winds is the result of a 50-50 joint venture by edp renewables (edpr) and engie. a company made by the wind, empowered by its clean and […]",oceanwinds.com,EC2V 6AA,"Net Zero, Energy Generation","Net Zero: Renewables, Net Zero: Renewable Energy Planning Database, Energy Generation: Hydropower, Energy Generation: Offshore Wind",,0,,0
06583508,INNOVATIVE ENVIRONMENTAL SOLUTIONS UK LTD,41,48330000,0.76,0.225,1.295,Large,05/02/2008 00:00:00,Welcome to emr. we're one of the world's leading metal recyclers with locations across the globe. contact our uk head office on +44 (0) 1925 715400,uk.emrgroup.com,WA5 7NS,Net Zero,"Net Zero: Waste Management and Recycling, Net Zero: Renewable Energy Planning Database",,0,,0
13356797,LOW CARBON LIMITED,302,3876953,0.399,0.886,-0.088,Large,04/26/2021 00:00:00,Powering tomorrow,lowcarbon.com,SW1Y 5AD,Net Zero,"Net Zero: Low Carbon Energy Generation, Net Zero: Low Carbon Consultancy, Advisory & Offsetting Services, Net Zero: Green Finance, Net Zero: Renewables, Net Zero: Renewable Energy Planning Database",,710,2024-06-01,0
11393390,UBITRICITY DISTRIBUTED ENERGY SYSTEMS UK LIMITED,48,15665680,0.7355,0.782,0.689,Medium,06/01/2018 00:00:00,"Ubitricity provide fully funded lamppost, fast and rapid ev charging solutions for local authorities. expand your ev infrastructure today!",ubitricity.com,SE1 7NA,Net Zero,Net Zero: Low Emission Vehicles,219749,0,,0
08715583,OMNIA ENVIRONMENTAL CONSULTING (SOUTH) LTD,55,2850106,0.276,0.276,,Medium,10/02/2013 00:00:00,"Omnia consulting provide technical expertise and innovative solutions to complex and challenging environmental issues. based in portsmouth and covering the uk, we provide support to our clients across a wide range of sectors and disciplines including construction, residential and infrastructure as well as planning and support services.",omnia-consulting.co.uk,PO6 3TH,"Life Sciences, Net Zero","Life Sciences: Environmental Sciences Products and Services, Net Zero: Pollution Control and Mitigation",,0,,0
NI653904,FSM FOOD LTD,47,1345947,0.373,0.373,,Small,06/21/2018 00:00:00,About food surplus management limited. fsm is an irish owned company who specialise in recovery and recycling of short dated and out of date products.,fsm.ie,BT36 4GN,"Net Zero, Energy Generation","Net Zero: Waste Management and Recycling, Energy Generation: Bioenergy",,0,,0
05110505,EN-TECH (ENERGY TECHNOLOGIES) LTD,38,1977024,0.2,0.2,,Small,04/23/2004 00:00:00,,ibtcontrols.co.uk,SK6 2SD,Net Zero,Net Zero: Building Technologies,,0,,0
11941440,PMB BATTERY TECHNOLOGIES UK LTD,35,4515804,0.3375,0.4,0.275,Small,04/11/2019 00:00:00,,pmbbt.co.uk,M3 5GS,Energy Storage,Energy Storage: Batteries,,0,,0
05695937,BEYONDLY GLOBAL LIMITED,63,160915184,0.27149999999999996,0.196,0.347,Large,02/02/2006 00:00:00,"Iso 14001 consultancy, waste material collections and weee collections - your waste solutions with comply direct...",wwwplydirect.com,PR2 2YH,Net Zero,"Net Zero: Low Carbon Consultancy, Advisory & Offsetting Services",,0,,0
07960658,DATA CENTRE RESPONSE LIMITED,102,13096658,0.3365,0.508,0.165,Medium,02/22/2012 00:00:00,"Dcresponse offer ups, generator & maintenance services to a broad spectrum of industries & sectors. call us now on 01993 708855.",dcresponse.co.uk,SN6 8TY,"Data Infrastructure, Energy Storage","Data Infrastructure: Data Infrastructure Hardware, Data Infrastructure: Data Centres, Energy Storage: Uninterruptible power supply",,0,,0
09789541,EURO RECYCLING BROKERS LIMITED,24,75522092,0.34950000000000003,0.168,0.531,Large,09/22/2015 00:00:00,"Euro recycling brokers ltd provide transfer station waste disposal, waste management supply chain solutions including final disposal options for waste companies throughout the uk.",eurorecyclingbrokers.co.uk,M1 4PB,Net Zero,"Net Zero: Waste Management and Recycling, Net Zero: Diversion of Biodegradable Waste from Landfill",,0,,0
12261508,EVERO ENERGY SERVICES LIMITED,298,35435694,0.31,0.475,0.145,Large,10/14/2019 00:00:00,,bioenergyinfrastructure.co.uk,EC2N 2QQ,Energy Generation,Energy Generation: Bioenergy,,0,,0
08070020,ALBUS ENVIRONMENTAL LIMITED,54,10241422,0.315,0.315,,Medium,05/15/2012 00:00:00,"Clinical waste disposal specialists in providing healthcare waste management service to doctor's surgeries, dental practices, nursing homes & vets.",albusenvironmental.com,DA2 8AH,"CleanTech, Net Zero","CleanTech: Environmental Protection and Monitoring, Net Zero: Low Carbon Consultancy, Advisory & Offsetting Services, Net Zero: Waste Management and Recycling, Net Zero: Renewable Energy Planning Database, Net Zero: Diversion of Biodegradable Waste from Landfill",,0,,0
07586196,JOULE HOT WATER SYSTEMS UK LTD,361,91650635,0.362,0.4,0.324,Large,03/31/2011 00:00:00,A combined 30 years experience in manufacturing and engineering sectors providing domestic and commercial hot water cylinders.,jouleuk.co.uk,WF8 4PS,Energy Generation,Energy Generation: Renewable Thermal,,0,,0
04097099,ECUS LIMITED,231,9778400,0.201,0.201,,Medium,10/26/2000 00:00:00,"With over 30 years of experience working across the environmental consultancy sector, ecus has a proven track record of exceptional delivery.",ecusltd.co.uk,S61 2DW,"Life Sciences, Net Zero","Life Sciences: Environmental Sciences Products and Services, Net Zero: Low Carbon Consultancy, Advisory & Offsetting Services",,0,,0
07837119,WYNSDALE WASTE MANAGEMENT LTD,54,6514139,0.539,0.539,,Medium,11/07/2011 00:00:00,"Wynsdale: a complete waste & environmental management service for commercial and domestic clients. specialist cleaning, infection control, pest control.",wynsdale.co.uk,ME13 9LG,"Business Support Services, Net Zero","Business Support Services: Landscaping and Cleaning Services, Net Zero: Waste Management and Recycling, Net Zero: Diversion of Biodegradable Waste from Landfill",,0,,1
10760856,ALLIANCE ENVIRONMENTAL SERVICES LTD,262,17361346,0.20350000000000001,0.21,0.197,Large,05/09/2017 00:00:00,Home page for ansa environmental services and ansa transport,ansa.co.uk,CW10 0JR,"Life Sciences, Net Zero","Life Sciences: Environmental Sciences Products and Services, Net Zero: Low Carbon Consultancy, Advisory & Offsetting Services, Net Zero: Waste Management and Recycling",,0,,0
09597220,SOUTH POLE GROUP UK LIMITED,169,16138572,0.5015000000000001,0.461,0.542,Medium,05/19/2015 00:00:00,Our team of experts guide you towards innovative solutions to both mitigate risk and achieve your sustainability goals.,southpole.com,EC2A 2DU,Net Zero,"Net Zero: Low Carbon Consultancy, Advisory & Offsetting Services, Net Zero: Green Finance",11082,0,,0
SC386715,ALL RENEWABLE ENERGY LIMITED,34,2309196,0.345,0.345,,Small,10/08/2010 00:00:00,,allrenewableenergy.co.uk,PH2 8BB,"Net Zero, Energy Generation","Net Zero: Heating, Net Zero: Renewables, Net Zero: Renewable Energy Planning Database, Energy Generation: Renewable Thermal, Energy Generation: Solar",,0,,0
