Title,ID,Website URL,Sectors,Simplified Sector Mapping,Endorsed,Provider type 1,Provider type 2,Lead provider,Growth hub / Catapult,DEAD,Regions,Type of programme,One to watch,Support available,Programme costs,Offerings,Other delivery partners,Public funded,Year programme started,Lead contact name,Lead contact email,Thumbnail image,Filter,Categories,Themes,Copy,Locations_map_point_address,Locations_map_point_street_name,Locations_map_point_street_short_name,Locations_map_point_city,Locations_map_point_state,Locations_map_point_state_short,Locations_map_point_post_code,Locations_map_point_country,Co-ordinates
Grow London Global,15436,https://www.grow.london/global,Environmental Science & Technology|Finance|Life Sciences & Biotech|Creative,Creative Industries,1,Provider type>Public/hybrid mix,,Grow London,,,London,ScaleUp Institute Endorsed/One to Watch,,Support to enter international markets,Free,Programme,London & Partners,Public/ Hybrid,2016,,,https://v2-scaleup-institute.pantheonsite.io/wp-content/uploads/2024/03/Grow-London-Global-Logo.png,Support Offer,,Access to markets,"In 2023, the Mayor of London’s International Business Programme (MBIP) rebranded as Grow London Global. Grow London Global is a free 12-month programme open to London-based scaleups with an annual turnover greater than £1m and less than £40m, or those that have secured £1m of external equity investment, and that employ between 10 and 250 people.

Over the past seven years the programme has helped more than 1,400 ambitious London scaleups to expand their businesses internationally. Participants span sectors including fintech, cyber and enterprise tech, life sciences and sustainability with alumni scaleup businesses including household names such as Bloom & Wild, Monzo and Revolut.

To meet the needs of the current economic and geopolitical environment, Grow London Global is an evolution of the MIBP programme with increased capacity to support more companies go global each year.  They also benefit from additional dedicated account managers with specialist sectoral expertise, and an even greater breadth of partners and connections whose knowledge and skills they can leverage. Grow London Global also offers a greater number of events and trade missions and carefully tailored programme content designed to meet the specific needs of each participating scaleup.

Trade missions introduce scaleups to global corporates and investors. They have helped more 1,000 London companies win trade deals worth more than £300m and raise more than £6.5bn of investment. Missions in the past year have included a <strong>Sustainability for Cities</strong> mission encompassing Rotterdam, Cologne and Berlin with participants meeting representatives from key companies including Bosch, Eurostar and Arcadis along with global real estate specialists Urban Land Institute and CBRE. A <strong>RetailTech</strong> mission in Paris involved BNP Paribas, Leroy Merlin and leading French luxury groups LVMH and Kering.

Two US trade missions took place in the latter part of 2022. A <strong>FinTech</strong> mission to New York included JP Morgan, Morgan Stanley and BMO while a <strong>US Life Sciences</strong> targeted the New York, New Jersey and Philadelphia markets with participating scaleups meeting with IBM, AT&T, Audible and Rutgers University.

During Birmingham Tech Week 2023, a new collaboration between the investment promotion agencies of the West Midlands and London was announced, with the aim of helping the region’s high-growth tech companies to achieve their global ambitions. The new partnership agreement, in collaboration with the West Midlands Growth Company (WMGC), will see the programme extended beyond London for the first time, with 10 high-growth tech companies from the West Midlands offered exclusive spaces.
<blockquote>“The programme was integral in introducing us to advisors and stakeholders that helped GripAble build our American market entry strategy, and back it up with investors, ultimately leading to our US launch and in closing of an investment round”</blockquote>
GripAble
<blockquote>“Fiskl would not have made as much progress had it not been part of the programme. Remarkable to see so many potential banking partners within a four-day online trade mission. Outside of the programme it can take up to 6 months to secure meetings with large banks and then another 18 months to develop the contract. Being part of the programme dramatically reduced this timeline”</blockquote>
Fiskl
<blockquote>“The programme was a worthwhile experience and has produced incredible results for Enferm. We will continue to remain involved as an alumni as we progress our US expansion”</blockquote>
Enferm",,Union Street,,,England,England,SE1 0LL,United Kingdom,"51.50362,-0.09859"
Lazaridis ScaleUp Program,15438,https://lazaridisinstitute.wlu.ca/programs/index.html,Technology & Communications,Technology,1,[Unclear online],,Lazaridis Institute,,1,International,ScaleUp Institute Endorsed/One to Watch,,Access to corporate collaboration|Access to peer networks|Leadership development/capacity building|Skills training|Support for R&D and/or innovation|Support to access public/private sector procurement,Free,Service,,,,,,https://v2-scaleup-institute.pantheonsite.io/wp-content/uploads/2021/10/Lazaridis.png,,,Leadership,"Canada’s Lazaridis ScaleUp Programme is a 12-month programme of education, peer networking and mentorship. Based at Wilfrid Laurier University, it brings together the most promising scaleup tech companies from across Canada and connects them with a network of senior talent from successful firms.

Customised engagement is designed to help them to scale and compete globally while remaining domiciled in Canada. Cohorts of the most promising companies are selected from a diverse range of sectors including AI, medtech, fintech, agritech, tech-enabled retailers and oil and gas. Support is extended to the wider executive teams of scaleups rather than focusing solely on founders; this includes access to function-oriented peer groups.

Lazaridis runs all-cohort events to further expand trusted peer networks with speakers drawn from globally successful companies. The ScaleUp programme has been delivered on a hybrid model since the pandemic, allowing to complement and enrich in-person events with the best of virtual learning practices. In 2023, the current cohort participants were brought to Palo Alto and New York, in both cities, scaleups took advantage of the visit to book time with customers, partners, and potential investors.

Since its launch in 2016, Lazaridis has supported 829 executives and 83 scaling companies that have raised more than CA$2.2bn in new funding and created 4,285 jobs. Now on its eighth cohort, the programme has a strong impact on scaleups. Scaleups show an average annualised growth rate of 53% in employment and 114% in revenues, while all participating scaleups reported increased confidence or leadership capacity. Additionally, 89 per cent of the participating scaleups have now  identified new markets, , 67 per cent have now started exporting, and 78 per cent have accessed new markets including Europe, Asia, Middle East, UAE and USA.

In October 2022, Lazaridis also hosted its first in-person all-cohort event since 2019. Supported by serial entrepreneur Marnie Walker, the event gave more than 50 scaleups the opportunity to share experiences and learn from Lazaridis mentors and industry luminaries.

The programme’s commitment to diversity is a key priority with 46 percent of founders being from an under-represented group. Cleantech and greentech companies and social enterprises represent 20 percent of Lazaridis scaleups.
<blockquote>“One of the most valuable aspects of Lazaridis ScaleUp is the network that you create with your peers. Everyone is an absolute rock star!”</blockquote>
Marnee Brick, President and Co-Founder, TinyEYE Therapy Services
<blockquote>“I find the opportunity to interact with our cohort colleagues to be the most valuable part of the Lazaridis program. I had good conversations with several peers and gained insights and ideas about what we can implement in our company.”</blockquote>
Jesse Smith, VP of Product, Agency Analytics",,,,,,,nan,,
Match-Maker Ventures,15443,https://www.match-maker.ventures/,Finance,Fintech,,Provider type>Private sector,,Match-Maker Ventures,,,International,ScaleUp Institute Endorsed/One to Watch,1,Support to enter international markets,Delivered for a fee,Product,,,2015,,,https://v2-scaleup-institute.pantheonsite.io/wp-content/uploads/2019/11/MMV-2.png,Support Offer,,Access to markets,"Match-Maker Ventures (MMV) aims to build a world where business collaboration has no borders.  To achieve this, MMV matches growing businesses with established telecom corporations, accelerating the process of collaboration.

MMV’s approach is powered by robust networks and deep telecom industry knowledge. It leverages its network members who have executive experience in the telecom industry – called “Match-Makers” – to match scaling businesses with large corporates, managing the collaboration process from end to end. In the last year, MMV shifted its portfolio focus further on to scaleups to promote significant collaborations with corporate customers and continue to grow. Its ‘Lead Identification and Account Management’ function uses sophisticated analytical tools to identify business opportunities for its scaleup portfolio. To date these tools have mapped over 150,000 connections and MMV further increases scaleups’ visibility using its marketing channels. 

To manage the fact that selling to large corporates is not a direct process, participating companies are offered a phased programme. Scaling businesses are initially offered a market strategy and sales preparation that examines their business model, agrees on a sales approach and identifies the profile of the right target customer. They are also assigned a solution manager to support the joint activities. In the second phase, the network of Match-Makers then approaches priority companies, future partners, customers and resellers, to open doors and offer hands-on support to the company’s sales activities, from first discussions all the way to contract signature and scaling of the joint activities. 

MMV’s global network has a global footprint and is continuing to broaden its network especially in the telecom industry. It is also continuing to develop its presence in key strategic growth areas in Latin America and the Middle East. 

In 2022 MMV hosted 15+ deep dive sessions to support its portfolio of scaleups alongside their Deep Dive Festival aiming to facilitate business opportunities by giving scaleups the platform to share their value propositions and key business insights with industry experts to augment and accelerate business impact.",|,|,|,Vienna|,Vienna|,Vienna|,,Austria|Austria,AT|AT
North East Create Growth Programme,17996,https://www.wearecreative.uk/support/regional-growth-programmes/north-east-cgp/,"Creative, Digital, Film, Games & Media",Creative Industries,,Provider type>Public/hybrid mix,,Creative UK,,,North East,Scaling firm focus,,Access to peer networks|Leadership development/capacity building,Free,Programme,"North of Tyne Combined Authority, Durham County Council, Gateshead Council, Newcastle City Council, North Tyneside Council, Northumberland County Council, South Tyneside Council, Sunderland City Council, Generator, Sunderland Software City, North East Screen, New Writing North, Creative Fuse and North East Local Enterprise Partnership|DCMS",1,2022,,northeast@wearecreative.uk,https://v2-scaleup-institute.pantheonsite.io/wp-content/uploads/2024/04/North-East-Create-Growth-Programme.png,Support Offer,,Leadership,"The North East Create Growth Programme delivers a bespoke business development and growth package tailored to the specific needs of high-growth potential creative businesses, with the aim of building businesses’ management skills and understanding of different finance routes to support business growth.",,,,,,,nan,,
Natwest Venture & Growth Finance,,https://www.natwest.com/corporates/financing/specialist-finance/venture-and-growth-finance.html,TECHNOLOGY & COMMUNICATIONS,Fintech,1,Provider type>Private sector,,Natwest,,,UK,ScaleUp Institute Endorsed/One to Watch,,Financial support/access,Delivered for a fee,Service,,,,Kit Maclaren,kit.maclaren@natwest.com,,Financier,REVENUE GROWTH FOR BUSINESSES,Finance and Risk Capital,"NatWest’s Venture Debt product is flexible debt finance of between £4m to £15 million for up to 4 years, targeted towards the specific needs of high-growth UK technology companies at the scale-up stage, which have already secured the backing of institutional Venture Capital investors.",EH2 2YB,London,,,,,nan,,
Innovation Accelerator Service,,https://www.gov.uk/government/publications/innovation-accelerator,"HEALTHCARE, LIFE SCIENCES & BIOTECH",Life Sciences,,Provider type>Public/hybrid mix,,WMCA,,,UK,Scaling firm focus,,"Skills training, Support for R&D and/or innovation",Free,Programme,DSIT,,,,,,Ecosystem,"REVENUE GROWTH FOR BUSINESSES, REGIONAL GROWTH",Infrastructure,,,,,,,,nan,,
ASCEND Scale Up Programme,,https://www.businessgrowthhub.com/programmes/ascend-scale-up/,Sector agnostic,Professional Services,,Provider type>Public/hybrid mix,,GM Business Growth Hub,,,North West,Scaling firm focus,,Leadership development/capacity building,Free,Programme,KPMG,,,,,,Ecosystem,REGIONAL GROWTH,Leadership,"The ASCEND Scale Up Programme is a 6-month programme tailored for local founders of high-growth businesses in Greater Manchester and help them rapidly scale. It includes workshops, personalised coaching and mentoring, funding opportunities and more. ",M1 5JW,Manchester,,,,,nan,,
Beyond,,https://gatherlcr.com/beyond,"CREATIVE, DIGITAL, FILM, GAMES & MEDIA",Creative Industries,1,Provider type>Public/hybrid mix,,Gather,,,North West,ScaleUp Institute Endorsed/One to Watch,,Leadership development/capacity building,Free,Programme,,,,,,,Ecosystem,REGIONAL GROWTH,Leadership,"Beyond is a bespoke scaleup support programme delivering consultancy and executive coaching across 6 months.  

Beyond's objective is to accelerate growth ambitions by catering to digital, creative, and tech firms in  the Liverpool City Region with 10+ employees. The programme has supported 45 companies to date, including some of the region's fastest-growing  scaleups, including Milexa Group, Redwigwam and SupplyWell. 

Beyond is a pivotal component of Gather - a comprehensive business support and ecosystem development initiative. To date, Gather has supported over 180 digital, creative, and tech businesses  across the Liverpool City Region. 

As of 2024, 45 scaling businesses have been supported so far by Beyond, with 579 jobs created. Scaling businesses who have participated in the programme report an average 65% turnover growth and 50% of participating businesses reported an increase in headcount. 

Moving forward, 89% of participating businesses anticipate 20%+ growth over the next 5 years. 
.“Beyond is an excellent program, because it was bespoke to our specific business needs we were able to get  started on implementing plans and finding out what our strengths and weaknesses are almost straight away.  We had a lot of anxiety about the future after the Pandemic and had a challenging year, but being part of this program helped us look forward and plan what we wanted the future to look like and how to get there. The  sessions brought so many ideas and ways of working that we have chosen to keep working with consultant  and coach.” 
Jen Fenner, MD, DefProc 
“Beyond has been a really high quality business support to us at an exciting time in our business growth. It has  given me confidence in the values of my organisation and my ability to plan a future vision.” 
Su Stringfellow, Founder, Harrison Stringfellow 
“Thank you to the Gather team, who through the Beyond programme connected Hi-impact with Susanna. Her  experience and advice has supported hi-impact to implement key strategic objectives and realign the business'  vision and steps for growth.” 
Kylie Reid, MD, Hi Impact 
“Being part of Beyond has been significant for us and the success of our business. The attention to detail the  team gives to carefully select your growth consultant meant that we were matched with someone who aligned  with what support we needed and our business values.” 
Chelsea Slater, Founder, InnovateHer 
",,,,,,,nan,,
Minerva,,https://minerva.uk.net/,"TECHNOLOGY & COMMUNICATIONS, HEALTHCARE, ENVIRONMENTAL SCIENCE & TECHNOLOGY",Technology,1,Provider type>University/Business School,,Minerva Business Angels,,,UK,ScaleUp Institute Endorsed/One to Watch,,"Financial support/access, Leadership development/capacity building",Delivered in exchange for equity,Service,,,1994,,,,Financier,REGIONAL GROWTH,Finance and Risk Capital,"Minerva Business Angels, part of the University of Warwick Science Park, is a well-established angel network providing significant support to early-stage companies across the UK. Operating since 1994, it focuses on sectors such as technology, healthcare, and green technology, targeting businesses with strong growth potential. Minerva connects entrepreneurs with investors through its ten investment groups located in the Midlands, London, and the North West. The programme's close collaboration with academic institutions like Aston and Birmingham universities provides portfolio companies with access to cutting-edge research and resources, further aiding their innovation journey.

Minerva has facilitated investments totalling £63 million since 2010, with an additional £35 million through co-investment opportunities. These funds typically support companies at the seed, venture, and growth stages, with investment amounts ranging from £1 million to £5 million per company. Its geographical focus lies primarily within the UK, where it has backed over 100 businesses, helping them scale and thrive in competitive sectors. The network's flexibility allows for a broad investment range, fostering innovation within a diverse portfolio of companies in cities like Birmingham, Coventry, and London.

Beyond financial support, Minerva offers strategic mentorship and regional resources through partnerships with Sci-Tech Daresbury and Black Country Growth Hub. Minerva has a strong track record of nurturing scaleups, including repeat investments in several visible scaleup companies, such as We Are Group, which experienced significant job growth under Minerva’s guidance. Through its investments, Minerva fosters sustainable growth, often seeing companies exit successfully, including acquisitions and increased revenue, as seen with Econotherm, which achieved a remarkable revenue boost post-investment.",,Coventry,,,,,nan,,
24 Haymarket,,https://24haymarket.com/,Sector agnostic,Professional Services,1,Provider type>Private sector,,24 Haymarket,,,UK,ScaleUp Institute Endorsed/One to Watch,,Financial support/access,Delivered in exchange for equity,Service,,,,,,,Financier,REGIONAL GROWTH,Finance and Risk Capital,"24 Haymarket is a private investment firm specialising in growth equity and venture capital, headquartered in London, with a strategic focus on supporting high-growth companies in the UK. Since its inception, the firm has established a strong network of over 100 seasoned private investors, allowing it to leverage collective expertise across various sectors, particularly technology, healthcare, and cybersecurity.

The firm adopts a hands-on approach, often taking board seats in its portfolio companies to ensure strategic alignment and support growth initiatives. This involvement not only facilitates access to capital but also fosters a comprehensive growth environment that includes talent recruitment, market expansion strategies, and exit planning.

24 Haymarket primarily focuses on equity investments in UK-based businesses at the venture and growth stages. It targets companies that have demonstrated initial commercial traction, ensuring that investments are made in firms poised for significant growth. The firm typically invests between £1 million and £5 million per company and aims to secure an average equity stake of 18%. This strategy reflects 24 Haymarket's commitment to nurturing high-potential investments while allowing for co-investment opportunities without imposing a matched funding requirement.

24 Haymarket's investments have led to notable achievements in job creation and revenue growth among its portfolio companies. For example, DrDoctor, which received an initial £1.5 million investment in September 2020, expanded its employee count from 44 to 144 by 2023, averaging a remarkable 49% annual growth rate in personnel. Similarly, YASA Motors, another recipient of follow-on investments, saw its turnover rise from £4.1 million in 2017 to £9.2 million by 2020, marking an average growth of 35% per annum.

“24 Haymarket became our partners on day one and have been on the journey with us ever since. They have supported us in many ways including commercial introductions, market insight, training, and helping us raise our game as business leaders. Having a great investment partner has been the most important factor in our growth to date.”
— Tom McDonnell, CEO Monterosa
",,London,,,,,nan,,
Wealth Club,,https://www.wealthclub.co.uk/,Sector agnostic,Professional Services,1,Provider type>Private sector,,Wealth Club,,,UK,ScaleUp Institute Endorsed/One to Watch,,"Financial support/access, Leadership development/capacity building",Delivered in exchange for equity,Service,,,2016,,,,Financier,REVENUE GROWTH FOR BUSINESSES,Finance and Risk Capital,"Launched in 2016 by former Hargreaves Lansdown executives, Wealth Club is an angel network designed to support high-net-worth individuals in making strategic investments. With a focus on early-stage ventures, the programme facilitates access to both single company and portfolio-based investments, including Growth Capital, Management Buyouts, and debt financing. Members benefit from a diverse range of pre-vetted deals, typically around 25 to 30 annually, and have the opportunity to co-invest alongside venture capital firms and corporate finance entities.

Beyond financial investment, Wealth Club provides invaluable resources to its portfolio companies. This includes access to a wealth of free materials—such as guides, articles, and videos—alongside the opportunity for board-level support and connections to experienced non-executive directors.. Such resources are instrumental in fostering sustainable growth and navigating the complexities of scaling businesses.

Wealth Club’s impact is evidenced through several key metrics: A substantial job growth in their scale-up portfolio, exemplified by Acamar Films, which grew from 31 employees in 2018 to 95 employees by 2023, demonstrating an average growth rate of 34% per annum. The Ralph veterinary clinic exemplified impressive revenue growth, with figures surging from £32,800 in 2018 to £15.3 million in 2023.

""Wealth Club sits in a totally unique space: it's not small-scale crowdfunding and it's not a private equity house, which is perfect for a fast-growing technology business like Pavegen. I was really impressed with their level of diligence beforehand and the deal cadence once we went live on their platform.""
— Laurence Kemball-Cook, Founder and CEO, Pavegen

""We have enjoyed working with the highly professional Wealth Club team on this important fundraising. Their extensive network of high net worth and experienced investors means that we were able to present the opportunity to a large number of potential investors and clients.""
— Simon Merchant, Co-Founder and CEO, Flagstone

""I have only great things to say about Gayle and the rest of the team at Wealth Club. They consistently overdelivered, which is a dream scenario when you are raising capital.""
— Sabrina Del Prete, Founder and CEO, KORE
",BS8 1BA,Bristol,,,,,nan,,
