Title,ID,Website URL,Sectors,Simplified Sector Mapping,Endorsed,Provider type 1,Provider type 2,Lead provider,Growth hub / Catapult,DEAD,Regions,Type of programme,One to watch,Support available,Programme costs,Offerings,Other delivery partners,Public funded,Year programme started,Lead contact name,Lead contact email,Thumbnail image,Filter,Categories,Themes,Copy,Locations_map_point_address,Locations_map_point_street_name,Locations_map_point_street_short_name,Locations_map_point_city,Locations_map_point_state,Locations_map_point_state_short,Locations_map_point_post_code,Locations_map_point_country,Co-ordinates
British Patient Capital,2477,https://www.britishpatientcapital.co.uk/,Finance|Healthcare|Life Sciences & Biotech|Technology & Communications,Fintech,,Provider type>British Business Bank ,,British Business Bank,,,UK,Scaling firm focus,,Financial support/access,Delivered in exchange for equity,Service,,1,2018,,,https://v2-scaleup-institute.pantheonsite.io/wp-content/uploads/2019/11/British-Patient-Capital.jpg,Ecosystem,,Finance,"British Patient Capital's mission is to enable long-term investment in innovative companies across the UK led by ambitious entrepreneurs who want to build successful, world-class businesses.

The UK provides a fertile ground for innovation to thrive and British Patient Capital will enable greater availability of this type of long-term finance and will help build the UK’s innovation economy.",,,,,England,England,S1 2GQ,United Kingdom,"53.38221,-1.47242"
Creative Enterprise,2482,https://www.wearecreative.uk/support/creative-enterprise/,"Creative, digital, film, games & media",Creative Industries,,Provider type>Public/hybrid mix,,Creative UK,,,UK,Scaling firm focus,,Access to peer networks|Financial support/access|Leadership development/capacity building|Skills training,Free,Service,National Lottery,1,2021,Haley Edwards,creativeenterprise@creativeengland.co.uk,https://v2-scaleup-institute.pantheonsite.io/wp-content/uploads/2019/11/Creative-UK-logo.png,Support Offer,,Leadership,"Creative Enterprise aims to bring together companies who work in moving image for storytelling, spanning film and television, games and technology, to build meaningful connections and create opportunities for business growth. It provides a network and training for business leaders through events and bespoke workshops led by industry leaders and mentors. Creative Enterprise has been developed with National Lottery funding from the BFI, to make the moving image sector sustainable through creating new business opportunities through training and building of networks, whilst growing and scaling existing businesses.",|,|Victoria Street,|,|,England|England,England|England,M50 2AB,United Kingdom|United Kingdom,"53.47368,-2.30176"
E Factor Group,2484,http://www.e-factor.co.uk,Engineering / Advanced Engineering|Environmental Science & Technology|Food & Drink|Healthcare|Transport & Logistics,Advanced Manufacturing,,Provider type>Private sector,,E-Factor Business,,,East Midlands,Scaling firm focus,,Leadership development/capacity building|Skills training,Free,Service,,,,Tim Maddinson,info@e-factor.co.uk,https://v2-scaleup-institute.pantheonsite.io/wp-content/uploads/2019/11/efactors.png,Ecosystem,,Leadership,"E-Factor Business has worked with thousands of businesses, from micro companies through to large established firms employing hundreds of people. Their success is entirely down to them and the actions they take, but we have been able to offer them professional, objective qualified advice based on the years of experience our Advisors have gained working with thousands of real businesses. The advice and support you get from E-Factor is always free, completely independent, entirely confidential and most of all, delivered by people who understand business.",,Prince Albert Gardens,,,England,England,DN31 3AG,United Kingdom,"53.57409,-0.07633"
Future Fifty,2495,https://technation.io/programmes/future-fifty/,Technology & Communications,Technology,,Provider type>Private sector,,Tech Nation,,,UK,Scaling firm focus,,Access to peer networks|Leadership development/capacity building|Skills training,Free,Service,,,,Johnny Mayo,johnnymayo@technation.io,https://v2-scaleup-institute.pantheonsite.io/wp-content/uploads/2019/12/Tech-Nation-web-logo.png,Support Offer,,Leadership,"Future Fifty aim to deliver a programme that enables you to develop your leadership skills, learn from others in the Future Fifty community, and apply those learnings in your workplace straight away. Companies selected to join the Future Fifty programme will receive; recognition as one of the UK’s most successful digital businesses, peer-to-peer networks, masterclass workshops led by global experts, access to government through sessions with key officials and exclusive ministerial roundtables and access to a dedicated Tech Nation Visa team.",|,Finsbury Avenue|Hardman Street,|,|,England|England,England|England,EC2M 2PA,United Kingdom|United Kingdom,"51.51964,-0.08408"
Techstart Ventures,2536,https://www.techstart.vc/,Technology & Communications,Technology,,Provider type>Private sector,,Techstart,,,"Northern Ireland, Scotland",Scaling firm focus,,Financial support/access,Delivered in exchange for equity,Service,,,,,northernireland@techstart.vc,https://v2-scaleup-institute.pantheonsite.io/wp-content/uploads/2019/11/techstart.png,Financier,,Finance,"Techstart provide startup and early stage seed capital for ambitious founders. Working with great teams to build successful companies in exciting markets, we invest capital to prove out business ideas and fuel early growth.",,Talbot Street,,,Northern Ireland,Northern Ireland,BT1 2LD,United Kingdom,"54.60250,-5.92783"
Creative Growth Finance,2550,https://www.wearecreative.uk/support/creative-enterprise/investment/creativegrowthfinance/,,Creative Industries,,Provider type>Public/hybrid mix,,Creative UK,,,UK,Scaling firm focus,,Financial support/access,Delivered for a fee,Service,,,2019,Tim Evans,tim.evans@wearecreative.uk,https://v2-scaleup-institute.pantheonsite.io/wp-content/uploads/2019/11/Creative-UK-logo.png,Financier,,Finance,"The Creative Growth Finance  is a partnership between Creative England and Triodos Bank UK offering loans of £100,000 to £1m that will help businesses to grow.

Finance is directed to post-revenue creative businesses presenting promising growth potential and who:
<ul>
 	<li>Bring change, disruption and new IP to the creative industries</li>
 	<li>Harness creativity with technologies and supporting businesses</li>
 	<li>Are talent led</li>
</ul>",|,|Victoria Street,|,|,England|England,England|England,M50 2AB,United Kingdom|United Kingdom,"53.47368,-2.30176"
EM3 Growth Hub,2554,https://www.enterprisem3growthhub.co.uk/,Defence & Security|Engineering / Advanced Engineering|Life Sciences & Biotech|Technology & Communications,Advanced Manufacturing,,Provider type>Public/hybrid mix,,EM3 Growth Hub,1,1,South East,Scaling firm focus,,Access to corporate collaboration|Access to talent and skills|Financial support/access|Leadership development/capacity building|Skills training|Support for R&D and/or innovation|Support to enter international markets,Free,Service,,,,,info@enterprisem3.org.uk,https://v2-scaleup-institute.pantheonsite.io/wp-content/uploads/2019/11/enterprisem3.png,Ecosystem,,Leadership,"The Enterprise M3 Growth Hub is an expert advice and resource network which helps businesses achieve results quickly through a free personal, tailored service focused on Growth, aimed at businesses looking to succeed in the Enterprise M3 area. Delivered by UMi with its expert partners, SETsquared, Business South and the County Councils of Hampshire and Surrey, the Enterprise M3 Growth Hub is driving impact by working in new ways based on what businesses tell us they need, to help them fulfil their potential.",,,,,England,England,RG21 4HG,United Kingdom,"51.26805,-1.07419"
Global Business Innovation Programme,2560,https://www.innovateukedge.ukri.org/gbip,Technology & Communications,Technology,,Provider type>Innovate UK,,Innovate UK,,,UK,Scaling firm focus,,Support for R&D and/or innovation|Support to enter international markets,Free,Programme,,,,,,https://v2-scaleup-institute.pantheonsite.io/wp-content/uploads/2021/11/UKRI_IUK_EDGE_HORIZONTAL_LOGO_RGB-scaled-1.jpeg,Ecosystem,,Access to markets,"The Global Business Innovation Programme helps ambitious businesses build collaborations and partnerships in new markets, accelerating business growth.

Typically, up to 15 high-growth innovative businesses are supported to explore and exploit the opportunities that exist in specific markets and technology and innovation areas. The Global Business Innovation Programme (GBIP) provides the sort of detailed market knowledge, introductions and cultural insight that small companies would find difficult to generate themselves. The Programme is designed to help companies find partners, build collaborations and explore R&D and innovation opportunities.",||,||,||,||Stoke Gifford,England|England|England,England|England|England,SN2 1FL,United Kingdom|United Kingdom|United Kingdom,"51.56673,-1.78476"
Lloyds Bank Social Entrepreneurs Scale Up Programme,2576,https://www.the-sse.org/courses/lloyds-bank-scale-up-programme-2018/,Impact Ventures / Social Impact,Professional Services,,Provider type>Private sector,,LLoyds Bank,,,UK,Scaling firm focus,,Financial support/access|Leadership development/capacity building|Skills training,Free,Programme,,,,,,https://v2-scaleup-institute.pantheonsite.io/wp-content/uploads/2019/11/lloysbank.png,Financier,,Leadership,"Lloyds Bank Social Entrepreneurs Scale Up Programme is for established social enterprises, with plans to significantly scale up their social impact. The programme helps social entrepreneurs to increase their resilience, develop different income streams and different remote and flexible working patterns. Scaling social businesses are further are supported with:
<ul>
 	<li>Up to £7,000 Trade Back grant</li>
 	<li>Free learning programme (14 days spread over a year) focused on recovery, rebuilding, resilience and managing change</li>
 	<li>A support network</li>
 	<li>A mentor</li>
</ul>",,,,,England,England,EC2N 3AH,United Kingdom,"51.51533,-0.08281"
Raise,2587,https://www.pwc.co.uk/private-business-private-clients/raise/programme-supporting-high-growth-scale-ups-series-a.html,Technology & Communications,Technology,,Provider type>Private sector,,PWC,,,UK,Scaling firm focus,,Access to corporate collaboration|Financial support/access|Skills training,Delivered for a fee,Service,,,,Thomas Hudson,,https://v2-scaleup-institute.pantheonsite.io/wp-content/uploads/2019/11/pwc.png,Financier,,Finance,"The objective of Raise is to make the fundraising process for entrepreneurs and investors as efficient as possible, and minimise the high levels of disruption typically associated with a fundraise for the management team. Split into three parts it covers intensive workshops, investor engagement and ongoing negotiation support.",,Embankment Place,,,England,England,WC2N 6RH,United Kingdom,"51.50799,-0.12469"
STEP INto Healthcare,2601,https://www.businessgrowthhub.com/step-into-healthcare,Healthcare|Life Sciences & Biotech,Life Sciences,,Provider type>Public/hybrid mix,,Health Innovation Manchester,,,North West,Scaling firm focus,,Access to corporate collaboration|Access to peer networks|Support for R&D and/or innovation|Support to access public/private sector procurement,Free,Programme,,,,,IN@healthinnovationmanchester.com,https://v2-scaleup-institute.pantheonsite.io/wp-content/uploads/2019/11/businessgrowthhub.png,Ecosystem,,Access to markets,"The STEP INto Healthcare programme, in partnership with TRUSTECH and Health Innovation Manchester, will help you improve your pitch to potential investors and customers, and increase your chances of success in the life sciences market.

Designed for businesses in the life sciences sector with aspirations to scale-up, the programme provides access to networks, strategic knowledge and market opportunities, through one-to-one support and a number of workshops with leading industry experts.",,,,,England,England,M13 9NQ,United Kingdom,"53.46223,-2.22848"
Invest to Grow,2603,https://www.derby.ac.uk/business-services/funding-services-and-support/access-to-funding/,Building & Construction|Engineering / Advanced Engineering|Environmental Science & Technology|Life Sciences & Biotech|Manufacturing / Advanced Manufacturing|Technology & Communications,Advanced Manufacturing,,Provider type>University/Business School,,University of Derby,,,East Midlands,Scaling firm focus,,Financial support/access,Delivered for a fee,Product,,,,,,https://v2-scaleup-institute.pantheonsite.io/wp-content/uploads/2019/11/derbyuni.png,Support Offer,,Finance,"The University of Derby's Invest to Grow programme provides grants and loans of between £15,000 and £250,000 to support private-sector businesses across the East Midlands to innovate, grow and create jobs.",,,,,England,England,DE22 1GB,United Kingdom,"52.93847,-1.49668"
Alliance Manchester Business School: Scale-up Forum,2614,Scale-Up Forum: Applications of AI | Alliance MBS (manchester.ac.uk),AI,Technology,,Provider type>University/Business School,,Alliance Manchester Business School,,,North West,Scaling firm focus,,Access to talent and skills|Leadership development/capacity building|Skills training|Support for R&D and/or innovation|Support to enter international markets,Free,Service,,,2018,,,https://v2-scaleup-institute.pantheonsite.io/wp-content/uploads/2019/11/alliance-manchester-business-school-1.png,Support Offer,,Leadership,"Alliance Manchester Business School – based at Manchester University - supports the business ecosystem across the North West. In 2018 it launched its Scale-Up Forum to boost scaleup growth through a peer-to-peer initiative supported by the university’s recognised talent, skills and knowledge.

Growing businesses on all stages of their scaleup journey are encouraged to share their experiences as they explore common challenges and gain valuable insights into how different business leaders overcome them.",,,,,England,England,M15 6PB,United Kingdom,"53.46736,-2.23699"
The ScaleUp Accelerator,10661,The ScaleUp Accelerator – Prepare for Growth and Series A Funding | The ScaleUp Accelerator helps scaling tech UK companies prepare for strong growth and Series A funding.,Technology & Communications,Technology,,Provider type>Private sector,,The ScaleUp Accelerator,,,UK,Scaling firm focus,,Access to peer networks|Leadership development/capacity building,Delivered for a fee,Programme,,,,Clarelisa Camilleri,clarelisa@theacceleratornetwork.com,https://v2-scaleup-institute.pantheonsite.io/wp-content/uploads/2020/05/scaleupaccelerator.png,Support Offer,,Leadership,"The ScaleUp Accelerator is a 6-month programme for founders to develop a credible plan and investor proposition to raise Series A through training and mentoring, starting with 6 weekly day-long sprints followed by 1:1 support. The programme dives into key business areas with London’s scaleup experts and investors, plus 1:1 feedback on growth strategy, sales plans, marketing, legals and finance to scale and attract the necessary growth funding. Thereafter, guidance on business plans and financial models is provided, concluding with highly-curated investor presentations. Post-pitching is followed by comprehensive 1:1 support to help you structure and close your VC round.",,Borough High Street,,,England,England,SE1 1NP,United Kingdom,"51.50361,-0.09112"
Growing Global Champions,11335,http://www.scaleupgroup.co,Technology & Communications,Technology,,Provider type>Private sector,,Scale Up Group,,,International|UK,Scaling firm focus,,Access to peer networks|Access to talent and skills|Financial support/access|Leadership development/capacity building,Delivered for a fee,Service,,,,Barbara Ravens,barbara@scaleupgroup.co,https://v2-scaleup-institute.pantheonsite.io/wp-content/uploads/2020/09/scaleupgroup-2.png,Support Offer,,Finance,"ScaleUp Group’s “Growing Global Champions” programme provides ScaleUp CEOs with access to this “money couldn’t buy” ScaleUp experience to develop sustainable UK/Global growth plans (Go-to-market, financial, technology, people), get fully investor ready and raise growth (Series A) funding. To date, ScaleUp Group’s Global Champions have successfully raised over £30m in growth funding.",,,,,England,England,EC2V 7AF,United Kingdom,"51.51661,-0.09408"
Pioneer Group,,https://thepioneergroup.com/,Environmental Science & Technology|Healthcare|Life Sciences & Biotech,Life Sciences,,Provider type>Private sector,,BioCity Group,,,UK,Scaling firm focus,,Access to peer networks|Financial support/access|Leadership development/capacity building|Office space/hubs that focus on scaleups,Delivered for a fee,Product,,,2002,Lizzie,e.hasling@biocity.co.uk,https://v2-scaleup-institute.pantheonsite.io/wp-content/uploads/2024/03/Pioneer-Group-logo.png,Financier,,Infrastructure|Finance,"The Pioneer Group provide holistic business support to life science entrepreneurs at scaleup, growth and startup stages. The Group provide Accelerators, mentor network of 200+ industry experts, networking, seed and pre-seed investment and easy-in easy in flexible lab & office space specifically designed to support scaleups; located within enterprise zones.

They offer hubs in different locations across the UK including the BioCity Nottingham, Cherrywood Campus, Edinburgh Technopole, Kent Science Park, Victoria House, BioCity Glasgow, Cardiff Edge, Colworth Science Park, Hexagon Tower, MediCity Nottingham and Wilton Centre.",,,,,England,England,NG1 1GF,United Kingdom,"52.95105,-1.13730"
Boost Business Lancashire,12418,https://www.boostbusinesslancashire.co.uk/business-support/,,Professional Services,,Provider type>Public/hybrid mix,,Lancashire Growth Hub,1,,North West,Scaling firm focus,,Access to peer networks|Leadership development/capacity building|Skills training,Free,Service,,,,Amin Vepari,amin.vepari@lancashire.gov.uk,https://v2-scaleup-institute.pantheonsite.io/wp-content/uploads/2021/10/boost-logo.png,Ecosystem,,Leadership,"Boost Business Lancashire supports the local pipeline of growing and scaling businesses with the drive to achieve growth over 20% per annum. ‘Boost’ helps break down key barriers to scaling by supporting businesses to develop and build an effective senior management team, attract talent, and access new markets. Support is delivered through a blend of one-to-one coaching, peer learning, insights sharing and dedicated growth workshops.",,,,,England,England,PR1 8XJ,United Kingdom,"53.75427,-2.70837"
Gather,12428,https://gatherlcr.com/programmes,Technology & Communications,Technology,,Provider type>Public/hybrid mix,,Form,,,North West,Scaling firm focus,,Leadership development/capacity building,Delivered for a fee,,,,2020,,hello@gatherlcr.com,https://v2-scaleup-institute.pantheonsite.io/wp-content/uploads/2021/10/gather-logo.png,Ecosystem,,Leadership,"Gather is part of the Liverpool City Region Metro Mayor’s Business Growth Package. Launched in 2020, it delivers 1-2-1 support with dedicated growth consultants, a suite of events, activities and support programmes to digital, creative and tech-enabled businesses along with dedicated programmes for scaling businesses. It includres 3 programmes; Junction, Consult, Emerging Leaders.",,,,,England,England,L1 0AX,United Kingdom,"53.39599,-2.98213"
ScaleUp Berkshire,12444,https://scaleupberkshire.co.uk/,,Professional Services,,Provider type>Public/hybrid mix,,,,1,South East,Scaling firm focus,,Leadership development/capacity building,Free,,,,2018,,,https://v2-scaleup-institute.pantheonsite.io/wp-content/uploads/2021/10/GH-TVB-logo.jpg,,,Leadership,"ScaleUp Berkshire, launched in 2018, is helping scaleup business leaders understand what is available and working to connect them with the right programme of support, drawing on the wide range of scaleup services on offer. It is based on an account management model and targets high-growth businesses that have achieved turnover in excess of £1m, linking them with specialist support delivered through a range of private and public sector experts. ",,,,,,,nan,,
Harwell Science and Innovation Campus,12511,https://www.harwellcampus.com/,Engineering / Advanced Engineering|Healthcare|Life Sciences & Biotech|Manufacturing / Advanced Manufacturing|Technology & Communications,Life Sciences,,Provider type>Public/hybrid mix,,Harwell Campus,,,South East,Scaling firm focus,,Office space/hubs that focus on scaleups|Support for R&D and/or innovation,Delivered for a fee,Service,,,,,,https://v2-scaleup-institute.pantheonsite.io/wp-content/uploads/2021/11/harwell.png,Support Offer,,Infrastructure,"The Harwell Science and Innovation Campus offers facilities, support and infrastructure to scale and promote science, innovation and collaboration. It is a unique collaboration between government, academia and industry including publicly funded scientific infrastructure, innovative private sector organisations and teams from 30 UK universities. Harwell clusters in the Space, Energy, Health and from 2022 Quantum sectors offer scaling businesses access to a diverse network of 200+ organisations, where research, innovation and commercial know-how are fuelled by around £3 billion of public investment. Each cluster offers networking events and activities, as well as informal sharing of ideas and opportunities across organisations. Additional business support includes funding, technical partnerships, sector expertise and access to laboratories and accommodation. Additional guidance and support is available through the Harwell’s start-up incubator programme, an accelerator initiative and the Proof of Concept grant programme funded by the UK’s Science and Technology Facilities Council (STFC).

The Proof of Concept grant programme is providing grant funding at a total of £250k with up to £30k per project being awarded to support and accelerate innovative multidisciplinary collaborations across the three clusters at Harwell: HealthTec, Space and EnergyTec. Funding is targeted at collaborative research and development, with a multidisciplinary remit that encourages industry to engage with other organisations in short term innovative projects.",,,,,England,England,OX11 0DF,United Kingdom,"51.57993,-1.31649"
Sustainable Scale Up Cluster,12990,https://www.sustainablescaleupcluster.wales/,Food & Drink,Net Zero,,Provider type>Public/hybrid mix,,BIC Innovation,,,Wales,Scaling firm focus,,Leadership development/capacity building|Skills training,Free,Service,,,,,bwyd-food@bic-innovation.com,https://v2-scaleup-institute.pantheonsite.io/wp-content/uploads/2021/12/foodand-drink-scale-up-cluster.png,Support Offer,,Leadership,"Helping ambitious Welsh food and drink businesses scale up sustainably, the Sustainable Scale Up Cluster is supporting businesses to tackle the 4 key challenges to successful scale up:</p>
• CAPACITY to scale up
• Access to CAPITAL to scale up
• Access to the right COMPETENCIES and talent to scale up
• Having the CONFIDENCE to scale up and avoiding the overtrading trap",,Court Road,,,Wales,Wales,CF31 1BE,United Kingdom,"51.50654,-3.57631"
BetaDen,12992,https://www.beta-den.com/,Technology & Communications,Technology,,Provider type>Private sector,,BetaDen,,,West Midlands,Scaling firm focus,,Financial support/access|Leadership development/capacity building|Office space/hubs that focus on scaleups,Free,Service,,,,,info@beta-den.com,https://v2-scaleup-institute.pantheonsite.io/wp-content/uploads/2021/12/betaden.png,Ecosystem,,Infrastructure,"BetaDen offers entrepreneurs, start-ups and scaleups a package a package worth over £50,000 consisting of: free office space, expert mentorship and support, access to Worcestershire’s 5G testbed and a proof of concept grant worth £7,500.",,,,,England,England,WR14 3SZ,United Kingdom,"52.10482,-2.31190"
Business Cyber Centre,13139,https://www.bcc.co.uk/,Defence & Security,Technology,,Provider type>Public/hybrid mix,Provider type>University/Business School,Business Cyber Centre,,,South West,Scaling firm focus,,Access to corporate collaboration|Office space/hubs that focus on scaleups|Skills training|Support for R&D and/or innovation,Delivered for a fee,Service,,,,,hello@bcc.co.uk,https://v2-scaleup-institute.pantheonsite.io/wp-content/uploads/2024/03/bcc-Logo.png,Support Offer,SECTORAL DEVELOPMENT,Infrastructure,"The Business Cyber Centre - the first in the UK - aims to make all UK businesses more cyber secure and turn cyber complexity into cyber confidence. It is unique in its offering within the local and regional area, and seeks to be recognised as a national asset and leading SME partner, enabling a greater level of resilience to businesses and UK Plc.",Unit 7 Greenways Business Park,Chippenham,,,England,England,SN15 1BN,United Kingdom,"51.47335,-2.12295"
Accenture Fintech Lab,13141,https://www.fintechinnovationlab.com/regions/london/,Technology & Communications,Fintech,,Provider type>Private sector,,Accenture,,,International,Scaling firm focus,,Support for R&D and/or innovation,Free,Programme,,,2011,,fintechlondon@accenture.com,https://v2-scaleup-institute.pantheonsite.io/wp-content/uploads/2022/07/fintechinnovationlab-Logo-1.png,Support Offer,CONNECTING BUSINESSES WITH BUYERS OR CORPORATE/GOVERNMENT COLLABORATION,Access to Markets,"The FinTech Innovation Lab is a highly competitive, 12-week program that helps early to growth-stage enterprise technology companies refine and test their value proposition with the support of the world's leading financial service firms.",30 Fenchurch St,London,,,England,England,EC3M 3BD,United Kingdom,"51.51136,-0.08226"
