Title,ID,Website URL,Sectors,Simplified Sector Mapping,Endorsed,Provider type 1,Provider type 2,Lead provider,Growth hub / Catapult,DEAD,Regions,Type of programme,One to watch,Support available,Programme costs,Offerings,Other delivery partners,Public funded,Year programme started,Lead contact name,Lead contact email,Thumbnail image,Filter,Categories,Themes,Copy,Locations_map_point_address,Locations_map_point_street_name,Locations_map_point_street_short_name,Locations_map_point_city,Locations_map_point_state,Locations_map_point_state_short,Locations_map_point_post_code,Locations_map_point_country,Co-ordinates
Beringea,15343,https://www.beringea.com/,Environmental Science & Technology|Healthcare|Professional Services|Technology & Communications,Technology,1,Provider type>Private sector,,Beringea,,,International|UK,ScaleUp Institute Endorsed/One to Watch,,Financial support/access,Delivered in exchange for equity,Service,,,,,info@beringea.co.uk,https://v2-scaleup-institute.pantheonsite.io/wp-content/uploads/2019/11/Beringea.png,Financier,REVENUE GROWTH FOR BUSINESSES,Finance,"The firm invests in the UK, EU and USA, focusing on healthcare, cleantech, consumer, media, business services and technology. In the UK and EU, its typical initial investments are between £1-10m into companies with at least £1m turnover, tending to lead Series A or Series B rounds with further funding available for follow-on investments. <a href=""https://www.beringea.com/"">Beringea</a> manages more than $700m in funds in the UK and the US. In the UK, Beringea manages three VCTs, including ProVen VCT and ProVen Growth and Income VCT which together manage more than £300m.

Between January 2016 to June 2023 Beringea participated in 55 fundraisings, of which 16 were follow-on investments. All of them were growth stage investments at the time of fundraising. These include healthcare review platform <a href=""https://www.beringea.com/news/investments/doctify-secures-usd10m-growth-round-led-by-beringea-to-drive-global-growth"">Doctify</a> (alongside Amadeus Capital Partners), hardware brand <a href=""https://www.businessleader.co.uk/plank-hardware-co-founder-journey/"">Plank Hardware</a>, social impact measurement platform <a href=""https://www.beringea.com/news/investments/tech-for-good-platform-that-measures-social-impact-raises-gbp8-5m"">Social Value Portal</a>, and seltzer brand <a href=""https://www.beringea.com/news/investments/dash-water-raises-gbp8-7m-and-targets-european-expansion"">Dash Water</a>.

Other scaleups in its portfolio include the locum GP platform <a href=""https://lantum.com/"">Lantum</a>, psychometric test developers <a href=""https://www.arcticshores.com/"">Arctic Shores</a>, and fashion styling service <a href=""https://www.thread.com/gb/"">Thread</a>.

The average turnover of companies supported by Beringea in the period between January 2016 to June 2023 was £19.3m and the average number of employees was 69.

The firm runs its own Scaleup Academy, an annual programme of events and training to help the leadership teams of its portfolio companies overcome barriers to scale, and emphasises its capabilities in assisting the transatlantic expansion strategies of its portfolio companies.

It has also been a leading figure in the creation of an industry initiative – <a href=""https://www.esgvc.co.uk/"">ESG_VC</a> – to support early-stage companies to measure, monitor and maximise their performance against key ESG metrics. The firm has been accredited as a Level 2 firm in the <a href=""https://diversity.vc/diversity-vc-standard/"">Diversity VC Standard</a>, recognising it as developing and adopting best practice for diversity and inclusion throughout its operations as a VC firm. Currently, 42 per cent of Beringea’s UK investment team are women, as well as 40 per cent of its UK investment committee.",,55 Drury Lane,,,England,England,WC2B 5SQ,United Kingdom,"51.51390,-0.12087"
Cambridge Angels,15347,https://cambridgeangels.com/,Healthcare|Life Sciences & Biotech|Technology & Communications,Life Sciences,1,Provider type>Private sector,,Cambridge Angels,,,East of England,ScaleUp Institute Endorsed/One to Watch,,Financial support/access,Delivered in exchange for equity,Service,,,2001,,INFO@CAMBRIDGEANGELS.NET,https://v2-scaleup-institute.pantheonsite.io/wp-content/uploads/2022/11/Cambridge-Angels-Logo.png,Financier,REVENUE GROWTH FOR BUSINESSES,Finance,"<a href=""https://cambridgeangels.com/"">Cambridge Angels</a> is a group of more than 60 high-net worth investors who invest in and mentor high quality early-stage and scaling companies in Cambridge, London, Oxford and throughout the UK. In 2022, Cambridge Angels invested £71.2m in 58 companies.

Typical funding requirements that Cambridge Angels meet are in the range of £150k to £1.5m – although several portfolio companies have raised significant follow-on funding from its members and the network’s VC partners over several funding rounds. There is a particular focus on deep-tech, and tools and technologies supporting healthcare.

The network’s membership has founded, invested in and led a large number of successful Cambridge-based companies in recent years, such as <a href=""https://paragraf.com/"">Paragraf</a>, <a href=""https://arecor.com/"">Arecor</a>, <a href=""https://www.eaglegenomics.com/"">Eagle Genomics</a>, <a href=""https://www.privitar.com/"">Privitar</a> and <a href=""https://healx.ai/"">Healx</a>. In addition to providing funding, Cambridge Angels also offers expertise, contacts and directly relevant experience to early-stage and scaling companies – in what it terms “smart capital from entrepreneurs to entrepreneurs.”

Emphasis is placed upon leveraging the collective experience of the portfolio and the angels.  Sessions are hosted in which angels and a network of professionals and associates provide portfolio companies with education sessions on topics such as exits and building leadership teams.

Since inception in September 2001, Cambridge Angels has invested in excess of £150m in over 120 portfolio companies. 24 of the companies in the current portfolio are in the scaleup stage having received early-stage funding and support from Cambridge Angels at their seed stage and continuing to date.",,,,,England,England,CB4 0GF,United Kingdom,"52.23319,0.14792"
Alderley Park,15348,https://www.alderleypark.co.uk/,Life Sciences & Biotech,Life Sciences,1,Provider type>Private sector,,Bruntwood SciTech,,,North West,ScaleUp Institute Endorsed/One to Watch,,Access to peer networks|Financial support/access|Office space/hubs that focus on scaleups|Support for R&D and/or innovation,Delivered for a fee,Service,,,,,info@alderleypark.co.uk,https://v2-scaleup-institute.pantheonsite.io/wp-content/uploads/2019/11/Alderley-Park-web-copy-2.png,Support Offer,SECTORAL DEVELOPMENT,Infrastructure,"Bruntwood SciTech’s Alderley Park provides over 1m sq ft of state-of-the-art office and lab space to a vibrant and fast growing community of businesses in the life sciences and tech sector. Alderley Park supports over 250 companies from start-up to scaleup on site including national institutions such as Cancer Research UK and the Medicines Discovery Catapult.

As part of the Park’s £247m ongoing development plan, 2023 saw £3.8m invested into 35,000 sq ft of redeveloped workspace at the campus. This, alongside 2022’s £20m investment into 86,000 sq ft of new biology and chemistry labs, provides additional space for scaling companies.

Resident scaleups have access to Alderley Park’s flexible infrastructure and scientific services, providing the facilities to achieve their growth potential. Coworking laboratories provide access to specialised equipment operated by an experienced laboratory management team through an easy and low cost set up process. This includes access to highly specialised suites from surgery to level 2 containment and bio-imaging and dedicated vivarium space.

The campus’ accelerator offers commercial workshops,  personalised one-to-one support sessions and access to specialist expertise for scaleup entrepreneurs and leaders. Workshops include a focus on scaling challenges, leadership skills and development along with support accessing finance and international markets. 

In 2023, Bruntwood SciTech launched the Biospheric Network from Alderley Park to support the ongoing growth of onsite scaleups  This network sees established entrepreneurs and senior executives provide funded growth-oriented support - including access to finance, deep sector-specialised networking, and business consultancy - to some of the most promising businesses in the life science sector. 

In addition, scaling life sciences businesses on site and across the wider region can pitch for funding of between £50k to £2m from the Greater Manchester & Cheshire Life Science Fund run by Praetura and backed by Bruntwood SciTech, GMCA and Cheshire & Warrington LEP.",,Congleton Road,,,England,England,SK10 4TG,United Kingdom,"53.27755,-2.23007"
Cambridge Innovation Capital (CIC),15350,https://www.cic.vc/,Engineering / Advanced Engineering|Healthcare|Life Sciences & Biotech,Life Sciences,1,Provider type>Private sector,,Cambridge Innovation Capital,,,East of England,ScaleUp Institute Endorsed/One to Watch,,Financial support/access,Delivered in exchange for equity,Service,,,2013,,enquiries@cic.vc,https://v2-scaleup-institute.pantheonsite.io/wp-content/uploads/2022/11/CIC-logo.png,Financier,,Finance,"Cambridge Innovation Capital (CIC) backs world-leading life sciences and technology companies with an affiliation to Cambridge. It was founded in 2013 by the University of Cambridge to create a trusted local firm that would provide early stage capital to promising life sciences and technology businesses emerging from the university – for which it is a preferred investor – and the Cambridge ecosystem. It is an exemplar of how universities and financiers can collaborate to support their scaleup communities.

CIC currently manages over £500m and has invested in 31 companies. In the period from January 2016 to July 2023, CIC has supported 67 fundraisings of which 36 (54%) were follow-on investments. Eight in ten (84%) were growth stage investments at the time of fundraising.

Nearly eight in ten (77%) of CIC’s investments are outside of London. CIC invests in disruptive, deep-tech businesses in sectors including, but not limited to, artificial intelligence, internet of things, quantum technologies, autonomous systems, therapeutics, medtech/diagnostics, digital health and genomics/proteomics.

Notable scaleups that CIC has supported include CMR Surgical, Congenica, PragmatIC Semiconductor and Microbiotica.

CIC has worked closely with stakeholders in the ecosystem – such as the Babraham Research Campus, endorsed by the ScaleUp Institute – to establish new accelerators, such as Start Codon (founded in 2019) for life sciences and healthcare businesses which aims to speed up the process of going from “bench to product” and offers investment, mentoring and access to research infrastructure including laboratory space. CIC has also helped to establish, and co-owns, the Deeptech Labs accelerator for technology businesses, providing hands-on support to bridge the gap between translational research and ‘Series A’ ready businesses. In September 2022 Cambridge Innovation Capital, Cambridge Enterprise and the University of Cambridge launched , an initiative aiming to define an inclusive, ambitious, and broad-ranging innovation vision for the Greater Cambridge region.

Its team brings to its portfolio companies deep domain and operational expertise from its past experiences as entrepreneurs, scientists, operators and investors. The team takes a hands-on approach including board participation, business planning and development, executive recruitment, commercialisation and scaleup.",,,,,England,England,CB1 2JD,United Kingdom,"52.19443,0.13345"
Envestors,15356,https://www.envestors.co.uk/,Environmental Science & Technology|Finance|Food & Drink|Healthcare|Life Sciences & Biotech|Manufacturing / Advanced Manufacturing|Professional Services,Life Sciences,1,Provider type>Private sector,,Envestors,,,International|UK,ScaleUp Institute Endorsed/One to Watch,,Financial support/access,Delivered in exchange for equity,Service,,,2004,,,https://v2-scaleup-institute.pantheonsite.io/wp-content/uploads/2020/11/envestors-1.png,Financier,,Finance,"Established in 2004, <a href=""https://www.envestors.co.uk/"">Envestors</a> is an FCA regulated finance adviser in the UK which connects investors and scaleup businesses through its digital investment technology that provides a white label platform for accelerators, incubators and angel networks. It has facilitated over £100m of investment into more than 500 companies from its network.

In the period between January 2016 to June 2023, it supported 52 UK companies in 65 fundraisings. More than two in three (69%) were at a growth stage at the time of the investment. Scaleups currently supported by Envestors include <a href=""https://www.voxsmart.com/"">VoxSmart</a> and <a href=""https://spherefluidics.com/"">Sphere Fluidics</a>.

Its Envestry for Scaleups provides a Software as a Service (SaaS) platform which can be used to automate the application process for businesses seeking support, showcase investment opportunities to investors in a secure area and allow its investors to track opportunities and manage their portfolio.",|,Colombo Street|,|,|Saint Helier,England|St Helier,England|St Helier,SE1 8DP,United Kingdom|Jersey,"51.50570,-0.10507"
Frog Capital,15358,https://frogcapital.com/,Building & Construction|Defence & Security|Engineering / Advanced Engineering|Environmental Science & Technology|Finance|Fisheries & Forestry|Food & Drink|Healthcare|Impact Ventures / Social Impact|Technology & Communications|Transport & Logistics,Technology,1,Provider type>Private sector,,Frog Capital,,,International|UK,ScaleUp Institute Endorsed/One to Watch,,Financial support/access,Delivered in exchange for equity,Service,,,,,reception@frogcapital.com,https://v2-scaleup-institute.pantheonsite.io/wp-content/uploads/2022/11/frog-logo.png,Financier,,Finance,"<a href=""https://frogcapital.com/"">Frog Capital</a> is a scaleup stage investor focused on software-enabled businesses in Europe. It invests in companies in equity rounds of €5m to €20m in European software scaleups across two key themes – digital infrastructure and smart data – with annualised revenues of between €3m – €30m.

To date, it has invested in over 60 companies around Europe. Notable scaleups in its portfolio include <a href=""https://www.modulrfinance.com/"">Modulr</a> and <a href=""https://www.cluesoftware.com/about-us/"">Clue</a>. One recent exit was <a href=""https://www.evotix.com/"">Evotix</a>, which featured as a scaleup story in the ScaleUp Institute 2021 Annual Review.

Frog Capital was endorsed by the ScaleUp Institute in 2021 as an exemplar of a fund that is acting as “a scaleup partner,” tailoring its support to match the unique needs of each business, helping with senior-level recruitment and introducing portfolio CEOs to other investment partners from their network.

The firm’s website offers dedicated pages with scaleup insights, including thought leadership and toolkits to support and help scaleups on their growth journey. The firm has defined major elements which are essential for any CEO to succeed in the scaleup phase, and they provide expert guidance on execution, planning, strategy and resilience.",,Birkenhead Street,,,England,England,WC1H 8BA,United Kingdom,"51.53003,-0.12179"
IP Group,15360,https://www.ipgroupplc.com/,Life Sciences and Biotech l Technology and Communications,Life Sciences,1,Provider type>Private sector,,IP Group,,,UK,ScaleUp Institute Endorsed/One to Watch,,Financial support/access,Delivered in exchange for equity,Service,,,2001,,,https://v2-scaleup-institute.pantheonsite.io/wp-content/uploads/2019/11/IP-Group-web-2.png,Financier,,Finance,"The 22 year-old IP Group is an FTSE-250 listed IP commercialisation company which has helped to develop more than 500 companies. With a focus on life sciences, deeptech and cleantech, it invests in university spin-outs at seed, venture and growth stages and assists them with the commercialisation of their new products and services, with technology transfer, IP licensing and protection. It continues to invest in portfolio companies as they scale. 

It describes itself as “one of the largest investors in university and other research-based companies in the world; the most prolific investor in deeptech companies in the UK and the second most prolific in Europe.”

The firm has a long-term partnership model with UK universities and developed an approach to supporting businesses from “cradle to maturity,” including assistance with executive search and recruitment and raising growth stage capital from co-investors. It currently has partnerships with 17 UK universities, six US universities and nine universities in Australia and New Zealand. 

The company owns Parkwalk Advisors, an active EIS investor in university spin-outs of ‘hard science’ companies, and has stakes in Oxford Sciences Innovation and Cambridge Innovation Capital. Other UK scaleups in its portfolio include Ultraleap, Crescendo Biologics, First Light Fusion and Istesso.",,,,,England,England,N1C 4AG,United Kingdom,"51.53348,-0.12504"
Livingbridge,15364,https://www.livingbridge.com/,Healthcare|Technology & Communications,Technology,1,Provider type>Private sector,,Livingbridge,,,International|UK,ScaleUp Institute Endorsed/One to Watch,,Financial support/access,Delivered in exchange for equity,Service,,,1999,,,https://v2-scaleup-institute.pantheonsite.io/wp-content/uploads/2019/11/Livingbridge-Logo-300x189-2.jpg,Financier,,Finance,"<a href=""https://www.livingbridge.com/"">Livingbridge</a> is a 25-year-old private equity firm that has been investing in four sectors – healthcare and education, services, consumer and TMT – and has made more than 165 investments.

It typically makes investments between £5m to £100m, taking a flexible approach – it will provide growth capital, as well as funding management buy-outs and secondary buy-outs and replacement capital deals. It will invest in high-growth, entrepreneurial businesses with enterprise values of up to £300m.

The average size of its investment round into UK companies since 2016 is £12.1m. In the period between 2016 to June 2023, the firm invested a total of £206m in 29 UK companies in 33 fundraising rounds. The average turnover of those companies was £29.2m and their average number of employees was 343.

Scaleups in its portfolio include wellness brand <a href=""https://www.absolutecollagen.com/"">Absolute Collagen</a>, insurance brokers <a href=""https://www.livingbridge.com/jensten-group-acquisition-delivers-significant-presence-in-east-anglia/"">Jensten Group</a>, telecoms services provider <a href=""https://www.fluidone.com/"">FluidOne</a>, and circular economy pioneer <a href=""https://www.wob.com/en-gb"">World of Books</a>.

The firm has offices in London, Birmingham and Manchester and an Australian office in Melbourne to make primary investments in the UK, Australia and New Zealand. It has an office in Boston and a US industry advisory board to support expansion and M&A in the US.

To support the growth strategies of its portfolio companies, Livingbridge has developed its “growth accelerators,” which it describes as “core value creation capabilities designed to unlock a business’s potential.” Its in-house growth acceleration team is made up of market experts principally covering international growth, corporate development, customer acquisition and retention, talent and technology. Its managing partner, Wol Kolade, is a founder of The 10,000 Black Interns programme, which will offer paid work experience across a wide range of sectors, providing training and development opportunities and creating a sustainable cycle of mentorship and sponsorship for the black community.",||,Wood Street|Newhall Street|King Street,||,||,England|England|England,England|England|England,EC2V 7AN,United Kingdom|United Kingdom|United Kingdom,"51.51636,-0.09445"
MMC Ventures,15366,https://mmc.vc/,Technology & Communications,Technology,1,Provider type>Private sector,,MMC Ventures,,,UK,ScaleUp Institute Endorsed/One to Watch,,Financial support/access,Delivered in exchange for equity,Service,,,2000,,fundenquiries@mmc.vc,https://v2-scaleup-institute.pantheonsite.io/wp-content/uploads/2022/11/MMC-logo.png,Financier,,Finance,"<a href=""https://mmc.vc/"">MMC</a> has a strong track record in supporting scaleups. The firm manages funds for private individuals and institutions and has approximately $1bn under management. It backs “transformative” technology companies, investing approximately £30m per annum in new investments and follow-on capital. It was the first commercial venture capital firm in the UK to qualify as a B Corp.

Founded in 2000, MMC targets an initial investment of £1-5m and can support further growth of “knowledge intensive companies” with up to £20m. Its £100m Scale-Up Fund provides expansion capital to portfolio companies once they have grown beyond the limits of EIS investment, and can also participate in secondary transactions, offering liquidity to early MMC and third-party investors.

Notable scaleups it has backed to date include <a href=""https://www.scaleupinstitute.org.uk/stories/gousto/"">Gousto</a> and <a href=""https://www.bloomandwild.com/"">Bloom & Wild</a>, cash management platform <a href=""https://treasuryspring.com/"">TreasurySpring</a> and AI video creation platform <a href=""https://www.synthesia.io/"">Synthesia</a>.

Portfolio companies benefit from a peer learning network programme, where companies are paired with a relevant counterpart to meet/zoom for one hour each month for six months – and there is also the flexibility to tailor the relationship to suit their individual needs.

MMC also assists investee companies in areas including international expansion, senior hiring, access to potential clients, corporate governance, fundraising, bank finance and exit. Its research team works closely with investee company founders to help businesses grow. Themed events are hosted regularly and podcasts and videos are available on their website.",,High Holborn,,,England,England,WC1V 6AZ,United Kingdom,"51.51856,-0.11314"
Partech,15374,https://partechpartners.com/,Technology & Communications,Technology,1,Provider type>Private sector,,Partech,,,UK,ScaleUp Institute Endorsed/One to Watch,,Financial support/access,Delivered in exchange for equity,Service,,,1982,Emmanuel Delaveau,edelaveau@partechpartners.com,https://v2-scaleup-institute.pantheonsite.io/wp-content/uploads/2019/11/Partech-web-copy-2.jpeg,Financier,,Finance,"Partech makes equity investments at seed, venture and growth stage. Its Growth team invests in European scaleups, making initial investments from €20m to €60m.

With offices in San Francisco, Paris, Berlin and Dakar, Partech’s investment focus is on technology and digital businesses in the UK, US and Europe and is developing its presence in Asia and Africa. Its current portfolio is made up of 200+ companies in more than 30 countries.

In the period between January 2016 to June 2023, Partech supported 15 UK-based companies across 27 fundraising rounds, with three in four (73%) being at growth stage at the time of fundraising. The firm has backed UK scaleups such as payment processing platform <a href=""https://www.blinkpayment.co.uk/"">Blink</a>.

In support of its portfolio companies, Partech provides coaching on strategy, operations, executive hiring, board structure, as well as preparation for M&A and build-ups. The firm has launched Partech Shaker, a nine-story building in central Paris designed for tech startups and scaleups.",,,,Paris,Île-de-France,IDF,,France,FR
