Title,ID,Website URL,Sectors,Simplified Sector Mapping,Endorsed,Provider type 1,Provider type 2,Lead provider,Growth hub / Catapult,DEAD,Regions,Type of programme,One to watch,Support available,Programme costs,Offerings,Other delivery partners,Public funded,Year programme started,Lead contact name,Lead contact email,Thumbnail image,Filter,Categories,Themes,Copy,Locations_map_point_address,Locations_map_point_street_name,Locations_map_point_street_short_name,Locations_map_point_city,Locations_map_point_state,Locations_map_point_state_short,Locations_map_point_post_code,Locations_map_point_country,Co-ordinates
British Library: Get Ready for Business Growth,13199,https://www.bl.uk/bipc/,"CREATIVE, DIGITAL, FILM, GAMES & MEDIA",Creative Industries,1,Provider type>Public/hybrid mix,,British Library,,,East Midlands|East of England|North East|North West|Scotland|South East|South West|West Midlands|Yorkshire & the Humber,ScaleUp Institute Endorsed/One to Watch,,Leadership development/capacity building,Free,Programme,,,,"Savory, Anna",Anna.Savory@bl.uk,https://v2-scaleup-institute.pantheonsite.io/wp-content/uploads/2019/11/british-library-300x213-2.jpg,Support Offer,,Leadership,"Launched in 2022, the British Library’s Get Ready for Business Growth builds on the success and legacy of the SUI endorsed Innovating for Growth (I4G) programme – the British Library’s flagship scale-up offering.

As a direct continuation of the I4G programme with a much larger national reach, the three-month programme offers tailored scaleup support for businesses in the arts and culture sector across England and Scotland. It is funded by Arts Council England and has been designed and delivered by the British Library Business & Intellectual Property Centre (BIPC) and a number of private sector partners. The programme has tapped into the British Library’s BIPC National Network, consisting of 22 Business & IP Centres across the UK and a further 86 satellite services delivered through town libraries.

Get Ready for Business Growth has adopted I4G’s course structure and leverages its existing network of delivery partners along with two key learnings: the importance of assigned Relationship Managers and an emphasis on the British Library’s collections and customised business research. The overall programme consists of three streams; Get Ready for Business Growth: Scale-ups, Get Ready for Business Growth: Mentoring and Get Ready for Business Growth: Start-ups and is delivered completely virtually.

The programme, which is delivered to cohorts of c. 25 creative business leaders, consists of 8 workshops and 8 one to one bespoke sessions totalling 32 hours of support. The one to one sessions cover support in strategy development, fundraisings, testing and launching new products, protecting their IP, research competitors and many more. Each participant is paired with a Relationship Manager who oversees their engagement, acts as a counsellor and refers them to relevant services support. Additionally, they receive a personalised research report drawing on the Library’s world-leading collections and are trained in the use of the BIPC’s extensive market research resources.

Get Ready for Business Growth graduates benefit from access to the ‘Growth Club’, an existing community of over 700 leaders, first established as part of I4G; and ongoing engagement with their relationship manager enables their progress to be tracked and the measurement of business outcomes, while also providing ongoing support.

In its first year, the programme reported positive impact outperforming I4G’s first year in terms of number of scaleup businesses supported, jobs created and new products, processes and services generated, as well as the number of mentors trained. So far, the ‘Get Ready for Business Growth: Scale-ups’ stream has helped 98 creative scaling businesses, with so far 23% of them creating 56 new jobs. As a result of the programme’s learnings, participants have created and implemented 68 new products, processes and services in the first three quarters. 40 graduate mentors were trained with accreditation from the Institute of Leadership & Management (ILM) and all participants have been signposted to continuing accelerators and business hubs as part of offboarding from the programme.
<blockquote><span style=""font-family: inherit;"">""I feel very bittersweet about graduating because it's been such a transformative experience for our business. Running your own business can be a lonely place, but this programme provided us with the opportunity to meet like-minded people and receive invaluable feedback from experts in their respective fields. We feel more determined than ever to grow and reach new heights thanks to Get Ready for Business Growth.”</span></blockquote>
Dana - Codex Anatomy
<blockquote>""We LOVED being a part of this course. It has been intense at times but we realised how much our mindset has changed in the past three months. I feel like our purpose and drive has come back. Things that felt overwhelming and complicated at the start of the programme like auditing our suppliers and measuring our marketing activities now feel achievable and we are really excited to input more that we have learnt into our strategy for 2023.”</blockquote>
Bee and Amy - Aarven",96 Euston Road,London,,,England,England,NW1 2DB,United Kingdom,"51.52999,-0.12701"
The Bradfield Centre,13231,https://www.bradfieldcentre.com/,Technology & Communications,Technology,,Provider type>University/Business School,Provider type>Private sector,Mantle,,,East of England,Scaling firm focus,,Office space/hubs that focus on scaleups,Delivered for a fee,Service,,,,,hello@mantlespace.co.uk,https://v2-scaleup-institute.pantheonsite.io/wp-content/uploads/2022/11/Bradfield-Centre.png,Support Offer,"SECTORAL DEVELOPMENT, INCREASING PRODUCTIVITY, REGIONAL GROWTH",Infrastructure,"The Bradfield Centre, in partnership with Cambridge University, is providing space for early-stage and scaleup businesses in the technology sectors and is developing a scaleup offering. Along with the flexible co-working spaces further support includes access to AWS, Google and Microsoft programmes; access to tech & entrepreneurship related events; connections to Angel and VC investors; connections with the University’s talent through the Trinity Bradfield Prize; an internship program running with Trinity College; and access to events with student organisations and the Judge Business School.",184 Cambridge Science Park,Milton Road,Cambridge,,England,England,CB4 0GA,United Kingdom,"52.23377,0.14611"
Clean Growth UK,13239,https://www.clean-growth.uk/,Environmental Science & Technology,Net Zero,,Provider type>Public/hybrid mix,Provider type>University/Business School,Clean Growth UK,,,North West|South East|South West,Scaling firm focus,,Financial support/access|Skills training|Support for R&D and/or innovation,Free,Service,,1,,,,https://v2-scaleup-institute.pantheonsite.io/wp-content/uploads/2022/11/CleanGrowth.png,Ecosystem,"SECTORAL DEVELOPMENT, INCREASING PRODUCTIVITY, REGIONAL GROWTH",Infrastructure,"The Clean Growth programme helps early-stage and scaling businesses develop clean and green products, services and processes through access to research expertise and facilities, free expert workshops and business resources and funding opportunities. The programme operates across the North West, South West and South East through regional university hubs.","University of Brighton, Watts Building|University of Portsmouth, 0.08a Lion Gate Building, Lion Terrace",||,||,|Brighton and Hove|,England|England|England,England|England|England,PO1 3HF,United Kingdom|United Kingdom|United Kingdom,"50.79893,-1.09834"
Silverstone Technology cluster,13256,https://www.silverstonetechnologycluster.com/,Engineering / Advanced Engineering|Technology & Communications,Advanced Manufacturing,,Provider type>Public/hybrid mix,,Silverstone Technology Cluster,,,East Midlands|South East,Scaling firm focus,,Leadership development/capacity building,Delivered for a fee,Programme,,,2017,,admin@silverstonetechnologycluster.com,https://v2-scaleup-institute.pantheonsite.io/wp-content/uploads/2022/11/silverstonetechnologycluster.png,Ecosystem,SECTORAL DEVELOPMENT,Leadership|Infrastructure,"The Silverstone Technology Cluster (STC) helps Advanced Engineering, Electronics and Software businesses in the wider geographical area surrounding Silverstone. The STC is specifically focused on the areas of Promotion, Support and Thought Leadership. It offers expert support, mentoring, peer learning, events and networking opportunities.",Silverstone Park,,,Silverstone,England,England,NN12 8GX,United Kingdom,"52.07784,-1.02417"
Create Growth Programme,13276,https://iuk.ktn-uk.org/programme/create-growth/#page_top,"CREATIVE, DIGITAL, FILM, GAMES & MEDIA
",Creative Industries,,Provider type>Innovate UK,Provider type>Public/hybrid mix,Various (depending on region),,,North West|East of England|North East|South West|East Midlands|Yorkshire and The Humber|West Midlands,Scaling firm focus,,Access to peer networks|Leadership development/capacity building|Skills training,Free,Programme,,1,2022,,,https://v2-scaleup-institute.pantheonsite.io/wp-content/uploads/2024/03/Create-growth-programme.png,Ecosystem,REVENUE GROWTH FOR BUSINESSES,Leadership,"The Create Growth Programme was launched in 2022 by the Department for Culture, Media & Sport (DCMS) in partnership with Innovate UK. It is designed to support the development of creative industries with high-growth potential and is delivered across different regions in England, outside of London. It aims to drive innovation and investment in the sector and supports early-stage and scaling businesses stimulate growth and attract private investment.

The programme was initially a £17.5 million investment in the sector, with up to £7 million provided by Innovate UK, and in July 2023, the previous government published its Sector vision in which it announced an additional £10.9 million to support a further six regions. Innovate UK provided another £6.92 million for the grant funding competition. Eligible businesses in Create Growth regions can apply to Innovate UK for grants and investor partnerships.",,Great Bridgewater Street,,,England,England,SN2 1FL,United Kingdom,"51.56673,-1.78476"
FastFutures: Avado Learning,15149,https://www.fastfutures.com/,Technology & Communications,Technology,,Provider type>Private sector,,Fast Futures,,,UK,Scaling firm focus,,Access to talent and skills|Skills training,Free,Service,,,2020,,,https://v2-scaleup-institute.pantheonsite.io/wp-content/uploads/2023/02/fast-futures-logo.png,Support offer,"ATTRACTION OF TALENT/SKILLS
",Talent and Skills,"Avado is a professional academy that helps people and businesses through interactive learning experiences in data, marketing, people and agility. FastFutures Apprenticeships and Skills Bootcamps offer role-specific training, career coaching, and mentoring sessions that unlock potential for individuals and organisations.",,"White City Campus, 58 Wood Lane",London,,England,England,W12 7RZ,United Kingdom,"51.51373,-0.22342"
Multiverse,15151,https://www.multiverse.io/en-GB/programmes,Technology & Communications,Technology,,Provider type>Private sector,,Multiverse,,,International|UK,Scaling firm focus,,Access to talent and skills|Skills training,Delivered for a fee,Service,,,2016,,,https://v2-scaleup-institute.pantheonsite.io/wp-content/uploads/2023/02/multiverse-logo.png,Support offer,"ATTRACTION OF TALENT/SKILLS
",Talent and Skills,"Multiverse provides apprenticeship programmes that combine work, training and community. Since starting in 2016, they have trained over 5,000 apprentices in partnership with more than 200 employers worldwide. Focusing on the skills of the future, the programmes range from software engineering to data analytics to business analysis.",,Eastbourne Terrace,,,England,England,W2 6LG,United Kingdom,"51.51675,-0.17920"
Shott Scale Up Accelerator,15327,https://enterprisehub.raeng.org.uk/shott-scale-up,Engineering / Advanced Engineering,Advanced Manufacturing,1,Provider type>Public/hybrid mix,Provider type: Universities/ Business School,Royal Academy of Engineering,,,UK,ScaleUp Institute Endorsed/One to Watch,,Leadership development/capacity building,Free,Programme,,,2013,,shottscaleup@raeng.org.uk,https://v2-scaleup-institute.pantheonsite.io/wp-content/uploads/2020/11/raenew.png,Support Offer,SECTORAL DEVELOPMENT,Leadership,"The Royal Academy of Engineering celebrates a decade of supporting talented entrepreneurs and decision makers to transform breakthrough engineering innovations into disruptive spinouts, early stage, scaling businesses and scaleups that have a real impact on society. Its Scale Up Accelerator empowers leaders of high-growth engineering and tech businesses by equipping them with the leadership skills and insights needed to scale up successfully.

The programme offers a tailored 12-month package of leadership training, coaching and business mentoring, backed by a £10k grant to fund training of participants’ choosing. Each cohort of 15 scaling leaders is also connected with mentors from the Academy’s network 1,700+ fellows.

Mentors have industry and tech businesses scaling experience, so they can support with technology and business needs. This sits alongside expert-led workshops, speaker events, fireside chats and investor referrals. The range of support offered allows participants to create a bespoke package tailored to their scaling priorities and ambitions.

Upon graduation participants are given lifetime membership of the Academy’s Enterprise Hub, with access to its co-working spaces in London and Belfast and a new hub Glasgow, which opened in 2023. Additionally the Academy has developed a new exclusive alumni programme <span style=""color: #ff9900;""><a style=""color: #ff9900;"" href=""https://enterprisehub.raeng.org.uk/explore"">EXPLORE</a></span> to help previous programme participants to tap into overseas  markets and ecosystems and access investors; it also facilitates peer-to-peer networking events, connections, and ongoing mentoring opportunities for alumni.

Other new developments in the past year include increasing the number of participants per cohort and extending programme duration to 12 months, giving scaling leaders an additional six months to access support. A new Culture+ platform – developed in partnership with The Honeycomb Works – is a dedicated equality, diversity and inclusion (EDI) resource for scaling companies, giving access to training, policy templates, checklists, case studies, and opportunities for self and peer reflection.

Since 2016, 143 scaleup leaders have participated in the programme, more than 3,000 new jobs have been created and company valuations have increased by £1.76bn. On average, participants increased their employment by more than 50 per cent after 12 months of support and received £976m in investment and £133m in grant funding since the programme started.
<blockquote>“The Shott Scaleup accelerator is designed for skilled executives who have identified a knowledge gap that they want to work on both individually and professionally. It’s a structured and supportive environment to learn from peers, coaches, mentors, and the wider RAEng network. It’s a really great opportunity for industry leaders to explore new ways of thinking, working, and strategizing for growth.”</blockquote>
Amber Michelle Hill, Research Grid
<blockquote>“The Shott Scale Accelerator Programme has been transformative for myself as a leader and for my organisation as we grow. It has equipped me with skills, knowledge and networks that will help propel us forward.”</blockquote>
James Willard, MicrofluidX
<blockquote>“I set out to grow as a leader to grow the business and the programme has achieved that. I feel more confident and have been given a range of practical and helpful tools.”</blockquote>
Vicky De Groof, Holiferm",,Carlton House Terrace,,,England,England,SW1Y 5DG,United Kingdom,"51.50569,-0.13300"
Amadeus Capital Partners,15338,https://www.amadeuscapital.com/,Defence & Security|Finance|Healthcare|Technology & Communications,Fintech,1,Provider type>Private sector,,Amadeus Capital Partners,,,UK,ScaleUp Institute Endorsed/One to Watch,,Financial support/access,Delivered in exchange for equity,Service,,,1997,,,https://v2-scaleup-institute.pantheonsite.io/wp-content/uploads/2020/11/amadeus-1.png,Financier,REVENUE GROWTH FOR BUSINESSES,Finance,"<a href=""https://www.amadeuscapital.com/"">Amadeus Capital Partners</a> is a global technology investor that invests in companies requiring early investment and growth capital with global potential. Founded by Anne Glover and Herman Hauser in 1997, Amadeus now has a team of over 40. One-third of the firm’s early stage investment team are women.

The firm follows three investment strategies: providing seed, start-up and scaleup capital for early stage companies with exceptional IP based in, or growing from the UK; primary and secondary investments in high-growth technology companies; and growth capital investments in tech-enabled consumer and business services in emerging markets. It is focused on AI & machine learning, online consumer services, cyber security, digital health and medical technology, digital media, enterprise SaaS, fintech, regtech and insurtech.

The firm has offices in London, Cambridge, Oxford, San Francisco and São Paulo. It is a partner with the British Business Bank on the <a href=""https://www.british-business-bank.co.uk/ourpartners/enterprise-capital-funds/"">Enterprise Capital Fund programme</a>. Its latest £110m Amadeus V Technology Fund includes a cornerstone commitment by <a href=""https://www.britishpatientcapital.co.uk/"">British Patient Capital</a>.

Growth investments in the past year include medical device company <a href=""https://www.natroxwoundcare.com/about-us/"">Inotec AMD</a>, healthcare review platform <a href=""https://www.doctify.com/uk/about/doctify"">Doctify</a>, machine learning operations platform <a href=""http://www.seldon.io/"">Seldon</a> and quantum engineers <a href=""https://www.riverlane.com/press-release/riverlane-raises-15m-series-b-to-advance-useful-quantum-computing"">River Lane Research</a>.

Notable scaleups in their portfolio include chip designers <a href=""https://www.graphcore.ai/"">Graphcore</a>, graphene company <a href=""https://www.paragraf.com/"">Paragraf</a>, cell and gene therapy manufacturing platform <a href=""https://oribiotech.com/"">OriBiotech</a>, <a href=""https://www.nuclera.com/"">Nuclera</a> and <a href=""https://poly.ai/"">PolyAi</a>.

In the period between January 2016 to June 2023, the average turnover of companies in its portfolio was £5.3m and the estimated average number of employees was 55.

Alongside investment Amadeus supports scaling businesses with technical insight, operational experience and access to a global network. They connect portfolio companies to additional support for innovation and growth including access to mentors and NEDs.",|,Jermyn Street|Quayside,|,|,England|England,England|England,SW1Y 4UR,United Kingdom|United Kingdom,"51.50944,-0.13316"
Archangels,15340,https://archangelsonline.com/,Life Sciences & Biotech|Technology & Communications,Life Sciences,1,Provider type>Private sector,,Archangel Investors,,,Scotland,ScaleUp Institute Endorsed/One to Watch,,Financial support/access,Delivered in exchange for equity,Service,,,1992,,investment@archangelsonline.com,https://v2-scaleup-institute.pantheonsite.io/wp-content/uploads/2022/11/Archangels-logo.png,Financier,REVENUE GROWTH FOR BUSINESSES,Finance,"Established in 1992, <a href=""https://archangelsonline.com/"">Archangels</a> says it is “the longest continuously operating angel syndicate in the world.”  Based in Edinburgh, Archangels aims to deliver returns for its investors while harnessing their experience and networks to fuel the success of Scotland’s entrepreneurs and innovators in technology and life sciences.

The syndicate currently has around 120 members invested in a portfolio of 20 early-stage companies. The preferred level of investment is £250k to £2m and typically co-ordinates the investment of more than £15m per year. While the capital provided by Archangels is not primarily scaleup capital, it provides businesses with patient money to help them on their scaling journey.

The syndicate typically co-ordinates the investment of more than £10m per year in early stage Scottish tech and life science companies. Archangels invested £13.4m during 2022; the total investment among 11 businesses was a 14% increase on Archangels’ investment activity in 2021 (£11.8m).

Archangels regularly invests alongside co-investment partners including Scottish Enterprise, other angel syndicates and VCs. In 2023, the syndicate secured a £12m <a href=""https://archangelsonline.com/archangels-coinvestment-12m-british-business-investments-bbi/"">co-investment agreement with British Business Investments</a> via its Regional Angels Programme.

Companies must fit the investment criteria of being based in Scotland; a technology or life science business with a B2B business model; having high growth potential with international sales potential; defendable technology; and qualify under the Enterprise Investment Scheme. Its investments include <a href=""https://www.integratedgraphene.com/"">Integrated Graphene</a>, <a href=""https://www.cytomos.com/"">Cytomos</a>, <a href=""https://www.earthblox.io/"">Earth Blox</a>, <a href=""https://www.getadministrate.com/"">Administrate</a> and <a href=""https://www.biocaptiva.com/"">BioCaptiva</a> and <a href=""https://www.nctechimaging.com/"">NCTech.</a>

Archangels helped in the creation of the <a href=""https://www.scottish-enterprise.com/support-for-businesses/funding-and-grants/accessing-finance-and-attracting-investment/scottish-co-investment-fund"">Scottish Co-Investment</a> Fund (SCF) which sees the public and private sector partnering to support risk financing of early-stage high-growth potential companies. SCF has increasingly participated in Archangels’ deals with a relatively steady proportion of total investment at around 25-30%. Archangels uses this stable relationship to increase leverage, particularly in later rounds. SCF’s participation offers Archangels’ portfolio companies further support including mentoring and other practical support from the public sector.

As well as financial investment, members contribute their time and expertise to support company growth including providing connections to relevant industry experience and contacts. Archangels has pushed its learnings into the wider angel community and beyond into the policy domain in order to facilitate improved performance and impacts economically. The open innovation approach taken by Archangels from an early stage has helped facilitate the wider growth of angel investing in Scotland.

According to <a href=""https://archangelsonline.com/wp-content/uploads/2022/09/1992-2022-Archangels-Economic-Impact-Report.pdf"">recent analysis conducted by the University of Glasgow’s Adam Smith Business School</a>, the £161m invested by Archangels since 1992 has directly created 3,647 high-skilled jobs and indirectly created a further 1,500 jobs. The companies in which Archangels has invested from 1992 to 2021 are estimated to have created over 4,000 jobs, generated aggregate turnover of at least £2.15bn and have contributed £1.43bn GVA to the Scottish economy.",,Rutland Square,,,Scotland,Scotland,EH1 2BB,United Kingdom,"55.94834,-3.20954"
